{"experiment": "pgolf", "commit": "", "status": "keep", "val_bpb": 1.6734, "val_loss": 2.7927, "train_loss": 2.8437, "param_count": 6823951, "total_flops": 0.0, "peak_memory_mb": 0.0, "wall_time_s": 749.2444672584534, "description": "Z-loss 5e-4 (5x stronger than 1e-4)", "config": {"env_overrides": {"UNIQUE_BLOCKS": "3", "NUM_HEADS": "4", "NUM_KV_HEADS": "4", "NUM_LAYERS": "6", "EVAL_STRIDE": "256", "NORMUON": "1", "XSA": "1", "XSA_START_LAYER": "4", "VALUE_RESID": "1", "FP16_EMBED": "1", "Z_LOSS": "5e-4"}, "description": "Z-loss 5e-4 (5x stronger than 1e-4)", "hypothesis": "HYP-042-zloss-5e4"}, "metrics": {"artifact_size_bytes": 6224174, "wall_time_ms": 338.0, "steps": 1896, "early_stopped": true, "hypothesis": "HYP-042-zloss-5e4", "estimated_params": 6817280}, "timestamp": 1774076056.709271, "seed": 42}
{"experiment": "pgolf", "commit": "", "status": "keep", "val_bpb": 1.669, "val_loss": 2.7852, "train_loss": 2.8237, "param_count": 6823951, "total_flops": 0.0, "peak_memory_mb": 0.0, "wall_time_s": 749.3737080097198, "description": "Focal loss gamma=0.5 (mild hard-token focus)", "config": {"env_overrides": {"UNIQUE_BLOCKS": "3", "NUM_HEADS": "4", "NUM_KV_HEADS": "4", "NUM_LAYERS": "6", "EVAL_STRIDE": "256", "NORMUON": "1", "XSA": "1", "XSA_START_LAYER": "4", "VALUE_RESID": "1", "FP16_EMBED": "1", "Z_LOSS": "1e-4", "FOCAL_GAMMA": "0.5"}, "description": "Focal loss gamma=0.5 (mild hard-token focus)", "hypothesis": "HYP-043-focal05"}, "metrics": {"artifact_size_bytes": 6229473, "wall_time_ms": 323.0, "steps": 1887, "early_stopped": true, "hypothesis": "HYP-043-focal05", "estimated_params": 6817280}, "timestamp": 1774076967.615764, "seed": 42}
{"experiment": "pgolf", "commit": "", "status": "keep", "val_bpb": 1.6718, "val_loss": 2.79, "train_loss": 2.7436, "param_count": 6823951, "total_flops": 0.0, "peak_memory_mb": 0.0, "wall_time_s": 749.1319441795349, "description": "Focal loss gamma=1.0 (moderate hard-token focus)", "config": {"env_overrides": {"UNIQUE_BLOCKS": "3", "NUM_HEADS": "4", "NUM_KV_HEADS": "4", "NUM_LAYERS": "6", "EVAL_STRIDE": "256", "NORMUON": "1", "XSA": "1", "XSA_START_LAYER": "4", "VALUE_RESID": "1", "FP16_EMBED": "1", "Z_LOSS": "1e-4", "FOCAL_GAMMA": "1.0"}, "description": "Focal loss gamma=1.0 (moderate hard-token focus)", "hypothesis": "HYP-043-focal10"}, "metrics": {"artifact_size_bytes": 6226940, "wall_time_ms": 323.0, "steps": 1886, "early_stopped": true, "hypothesis": "HYP-043-focal10", "estimated_params": 6817280}, "timestamp": 1774077723.345598, "seed": 42}
{"experiment": "pgolf", "commit": "", "status": "keep", "val_bpb": 4.4197, "val_loss": 7.3757, "train_loss": 8.6476, "param_count": 6823951, "total_flops": 0.0, "peak_memory_mb": 0.0, "wall_time_s": 213.02501583099365, "description": "MiLe loss gamma=1.0 (entropy-weighted, arXiv 2310.19531)", "config": {"env_overrides": {"UNIQUE_BLOCKS": "3", "NUM_HEADS": "4", "NUM_KV_HEADS": "4", "NUM_LAYERS": "6", "EVAL_STRIDE": "256", "NORMUON": "1", "XSA": "1", "XSA_START_LAYER": "4", "VALUE_RESID": "1", "FP16_EMBED": "1", "Z_LOSS": "1e-4", "MILE_GAMMA": "1.0"}, "description": "MiLe loss gamma=1.0 (entropy-weighted, arXiv 2310.19531)", "hypothesis": "HYP-044-mile10"}, "metrics": {"artifact_size_bytes": 5046168, "wall_time_ms": 323.0, "steps": 200, "hypothesis": "HYP-044-mile10", "estimated_params": 6817280}, "timestamp": 1774078065.963014, "seed": 42}
{"experiment": "pgolf", "commit": "", "status": "keep", "val_bpb": 2.4275, "val_loss": 4.0511, "train_loss": 4.0994, "param_count": 6823951, "total_flops": 0.0, "peak_memory_mb": 0.0, "wall_time_s": 212.83021187782288, "description": "MiLe loss gamma=1.0 (entropy-weighted, arXiv 2310.19531)", "config": {"env_overrides": {"UNIQUE_BLOCKS": "3", "NUM_HEADS": "4", "NUM_KV_HEADS": "4", "NUM_LAYERS": "6", "EVAL_STRIDE": "256", "NORMUON": "1", "XSA": "1", "XSA_START_LAYER": "4", "VALUE_RESID": "1", "FP16_EMBED": "1", "Z_LOSS": "1e-4", "MILE_GAMMA": "1.0"}, "description": "MiLe loss gamma=1.0 (entropy-weighted, arXiv 2310.19531)", "hypothesis": "HYP-044-mile10"}, "metrics": {"artifact_size_bytes": 5034361, "wall_time_ms": 327.0, "steps": 200, "hypothesis": "HYP-044-mile10", "estimated_params": 6817280}, "timestamp": 1774078312.522733, "seed": 42}
{"experiment": "pgolf", "commit": "", "status": "keep", "val_bpb": 2.105, "val_loss": 3.5129, "train_loss": 3.038, "param_count": 6823951, "total_flops": 0.0, "peak_memory_mb": 0.0, "wall_time_s": 748.8894350528717, "description": "MiLe loss gamma=1.0 (entropy-weighted, arXiv 2310.19531)", "config": {"env_overrides": {"UNIQUE_BLOCKS": "3", "NUM_HEADS": "4", "NUM_KV_HEADS": "4", "NUM_LAYERS": "6", "EVAL_STRIDE": "256", "NORMUON": "1", "XSA": "1", "XSA_START_LAYER": "4", "VALUE_RESID": "1", "FP16_EMBED": "1", "Z_LOSS": "1e-4", "MILE_GAMMA": "1.0"}, "description": "MiLe loss gamma=1.0 (entropy-weighted, arXiv 2310.19531)", "hypothesis": "HYP-044-mile10"}, "metrics": {"artifact_size_bytes": 6235301, "wall_time_ms": 327.0, "steps": 1871, "early_stopped": true, "hypothesis": "HYP-044-mile10", "estimated_params": 6817280}, "timestamp": 1774079072.3657951, "seed": 42}
{"experiment": "pgolf", "commit": "", "status": "keep", "val_bpb": 1.745, "val_loss": 2.9121, "train_loss": 3.0943, "param_count": 6823951, "total_flops": 0.0, "peak_memory_mb": 0.0, "wall_time_s": 749.0278770923615, "description": "MiLe loss gamma=0.5 (mild entropy weighting)", "config": {"env_overrides": {"UNIQUE_BLOCKS": "3", "NUM_HEADS": "4", "NUM_KV_HEADS": "4", "NUM_LAYERS": "6", "EVAL_STRIDE": "256", "NORMUON": "1", "XSA": "1", "XSA_START_LAYER": "4", "VALUE_RESID": "1", "FP16_EMBED": "1", "Z_LOSS": "1e-4", "MILE_GAMMA": "0.5"}, "description": "MiLe loss gamma=0.5 (mild entropy weighting)", "hypothesis": "HYP-044-mile05"}, "metrics": {"artifact_size_bytes": 6235722, "wall_time_ms": 328.0, "steps": 1871, "early_stopped": true, "hypothesis": "HYP-044-mile05", "estimated_params": 6817280}, "timestamp": 1774079828.431773, "seed": 42}
{"experiment": "pgolf", "commit": "", "status": "keep", "val_bpb": 1.6624, "val_loss": 2.7742, "train_loss": 2.8363, "param_count": 6823951, "total_flops": 0.0, "peak_memory_mb": 0.0, "wall_time_s": 750.1565120220184, "description": "Softcap 50 + z-loss (less clipping, z-loss handles scale)", "config": {"env_overrides": {"UNIQUE_BLOCKS": "3", "NUM_HEADS": "4", "NUM_KV_HEADS": "4", "NUM_LAYERS": "6", "EVAL_STRIDE": "256", "NORMUON": "1", "XSA": "1", "XSA_START_LAYER": "4", "VALUE_RESID": "1", "FP16_EMBED": "1", "Z_LOSS": "1e-4", "LOGIT_SOFTCAP": "50.0"}, "description": "Softcap 50 + z-loss (less clipping, z-loss handles scale)", "hypothesis": "HYP-045-cap50"}, "metrics": {"artifact_size_bytes": 6216368, "wall_time_ms": 322.0, "steps": 1895, "early_stopped": true, "hypothesis": "HYP-045-cap50", "estimated_params": 6817280}, "timestamp": 1774080772.276751, "seed": 42}
{"experiment": "pgolf", "commit": "", "status": "keep", "val_bpb": 1.6698, "val_loss": 2.7866, "train_loss": 2.8658, "param_count": 6823951, "total_flops": 0.0, "peak_memory_mb": 0.0, "wall_time_s": 749.0627570152283, "description": "Softcap 20 + z-loss (tighter clipping + smooth penalty)", "config": {"env_overrides": {"UNIQUE_BLOCKS": "3", "NUM_HEADS": "4", "NUM_KV_HEADS": "4", "NUM_LAYERS": "6", "EVAL_STRIDE": "256", "NORMUON": "1", "XSA": "1", "XSA_START_LAYER": "4", "VALUE_RESID": "1", "FP16_EMBED": "1", "Z_LOSS": "1e-4", "LOGIT_SOFTCAP": "20.0"}, "description": "Softcap 20 + z-loss (tighter clipping + smooth penalty)", "hypothesis": "HYP-045-cap20"}, "metrics": {"artifact_size_bytes": 6226694, "wall_time_ms": 326.0, "steps": 1890, "early_stopped": true, "hypothesis": "HYP-045-cap20", "estimated_params": 6817280}, "timestamp": 1774081530.5675678, "seed": 42}
{"experiment": "pgolf", "commit": "", "status": "keep", "val_bpb": 1.6745, "val_loss": 2.7945, "train_loss": 2.8596, "param_count": 6823951, "total_flops": 0.0, "peak_memory_mb": 0.0, "wall_time_s": 749.1560671329498, "description": "Softcap 100 + z-loss (near-disabled softcap, z-loss only)", "config": {"env_overrides": {"UNIQUE_BLOCKS": "3", "NUM_HEADS": "4", "NUM_KV_HEADS": "4", "NUM_LAYERS": "6", "EVAL_STRIDE": "256", "NORMUON": "1", "XSA": "1", "XSA_START_LAYER": "4", "VALUE_RESID": "1", "FP16_EMBED": "1", "Z_LOSS": "1e-4", "LOGIT_SOFTCAP": "100.0"}, "description": "Softcap 100 + z-loss (near-disabled softcap, z-loss only)", "hypothesis": "HYP-045-cap100"}, "metrics": {"artifact_size_bytes": 6199112, "wall_time_ms": 318.0, "steps": 1899, "early_stopped": true, "hypothesis": "HYP-045-cap100", "estimated_params": 6817280}, "timestamp": 1774082298.491029, "seed": 42}
{"experiment": "pgolf", "commit": "", "status": "keep", "val_bpb": 1.6829, "val_loss": 2.8085, "train_loss": 2.8903, "param_count": 6823951, "total_flops": 0.0, "peak_memory_mb": 0.0, "wall_time_s": 749.0372588634491, "description": "Softcap 75 + z-loss (between 50 and 100)", "config": {"env_overrides": {"UNIQUE_BLOCKS": "3", "NUM_HEADS": "4", "NUM_KV_HEADS": "4", "NUM_LAYERS": "6", "EVAL_STRIDE": "256", "NORMUON": "1", "XSA": "1", "XSA_START_LAYER": "4", "VALUE_RESID": "1", "FP16_EMBED": "1", "Z_LOSS": "1e-4", "LOGIT_SOFTCAP": "75.0"}, "description": "Softcap 75 + z-loss (between 50 and 100)", "hypothesis": "HYP-045-cap75"}, "metrics": {"artifact_size_bytes": 6206548, "wall_time_ms": 318.0, "steps": 1895, "early_stopped": true, "hypothesis": "HYP-045-cap75", "estimated_params": 6817280}, "timestamp": 1774083055.6075468, "seed": 42}
{"experiment": "pgolf", "commit": "", "status": "keep", "val_bpb": 1.6642, "val_loss": 2.7773, "train_loss": 2.8502, "param_count": 6823951, "total_flops": 0.0, "peak_memory_mb": 0.0, "wall_time_s": 748.8287041187286, "description": "QK gain 1.0 + softcap 50 (less attention sharpening)", "config": {"env_overrides": {"UNIQUE_BLOCKS": "3", "NUM_HEADS": "4", "NUM_KV_HEADS": "4", "NUM_LAYERS": "6", "EVAL_STRIDE": "256", "NORMUON": "1", "XSA": "1", "XSA_START_LAYER": "4", "VALUE_RESID": "1", "FP16_EMBED": "1", "Z_LOSS": "1e-4", "LOGIT_SOFTCAP": "50.0", "QK_GAIN_INIT": "1.0"}, "description": "QK gain 1.0 + softcap 50 (less attention sharpening)", "hypothesis": "HYP-046-qk10"}, "metrics": {"artifact_size_bytes": 6209334, "wall_time_ms": 324.0, "steps": 1897, "early_stopped": true, "hypothesis": "HYP-046-qk10", "estimated_params": 6817280}, "timestamp": 1774083855.237447, "seed": 42}
{"experiment": "pgolf", "commit": "", "status": "keep", "val_bpb": 1.6638, "val_loss": 2.7767, "train_loss": 2.8424, "param_count": 6823951, "total_flops": 0.0, "peak_memory_mb": 0.0, "wall_time_s": 749.1288397312164, "description": "QK gain 2.0 + softcap 50 (more attention sharpening)", "config": {"env_overrides": {"UNIQUE_BLOCKS": "3", "NUM_HEADS": "4", "NUM_KV_HEADS": "4", "NUM_LAYERS": "6", "EVAL_STRIDE": "256", "NORMUON": "1", "XSA": "1", "XSA_START_LAYER": "4", "VALUE_RESID": "1", "FP16_EMBED": "1", "Z_LOSS": "1e-4", "LOGIT_SOFTCAP": "50.0", "QK_GAIN_INIT": "2.0"}, "description": "QK gain 2.0 + softcap 50 (more attention sharpening)", "hypothesis": "HYP-046-qk20"}, "metrics": {"artifact_size_bytes": 6213626, "wall_time_ms": 320.0, "steps": 1893, "early_stopped": true, "hypothesis": "HYP-046-qk20", "estimated_params": 6817280}, "timestamp": 1774084610.388778, "seed": 42}
{"experiment": "pgolf", "commit": "", "status": "keep", "val_bpb": 1.666, "val_loss": 2.7803, "train_loss": 2.858, "param_count": 6823951, "total_flops": 0.0, "peak_memory_mb": 0.0, "wall_time_s": 749.1396770477295, "description": "Embed init std 0.01 (2x default, warmer logits)", "config": {"env_overrides": {"UNIQUE_BLOCKS": "3", "NUM_HEADS": "4", "NUM_KV_HEADS": "4", "NUM_LAYERS": "6", "EVAL_STRIDE": "256", "NORMUON": "1", "XSA": "1", "XSA_START_LAYER": "4", "VALUE_RESID": "1", "FP16_EMBED": "1", "Z_LOSS": "1e-4", "LOGIT_SOFTCAP": "50.0", "TIED_EMBED_INIT_STD": "0.01"}, "description": "Embed init std 0.01 (2x default, warmer logits)", "hypothesis": "HYP-047-std01"}, "metrics": {"artifact_size_bytes": 6215187, "wall_time_ms": 322.0, "steps": 1892, "early_stopped": true, "hypothesis": "HYP-047-std01", "estimated_params": 6817280}, "timestamp": 1774085468.933842, "seed": 42}
{"experiment": "pgolf", "commit": "", "status": "keep", "val_bpb": 1.665, "val_loss": 2.7787, "train_loss": 2.8436, "param_count": 6823951, "total_flops": 0.0, "peak_memory_mb": 0.0, "wall_time_s": 749.1382119655609, "description": "Embed init std 0.002 (0.4x default, cooler logits)", "config": {"env_overrides": {"UNIQUE_BLOCKS": "3", "NUM_HEADS": "4", "NUM_KV_HEADS": "4", "NUM_LAYERS": "6", "EVAL_STRIDE": "256", "NORMUON": "1", "XSA": "1", "XSA_START_LAYER": "4", "VALUE_RESID": "1", "FP16_EMBED": "1", "Z_LOSS": "1e-4", "LOGIT_SOFTCAP": "50.0", "TIED_EMBED_INIT_STD": "0.002"}, "description": "Embed init std 0.002 (0.4x default, cooler logits)", "hypothesis": "HYP-047-std002"}, "metrics": {"artifact_size_bytes": 6213816, "wall_time_ms": 319.0, "steps": 1892, "early_stopped": true, "hypothesis": "HYP-047-std002", "estimated_params": 6817280}, "timestamp": 1774086224.739904, "seed": 42}
{"experiment": "pgolf", "commit": "", "status": "keep", "val_bpb": 1.6789, "val_loss": 2.8018, "train_loss": 2.8665, "param_count": 6823951, "total_flops": 0.0, "peak_memory_mb": 0.0, "wall_time_s": 749.2840349674225, "description": "Best config seed 42 (multi-seed validation)", "config": {"env_overrides": {"UNIQUE_BLOCKS": "3", "NUM_HEADS": "4", "NUM_KV_HEADS": "4", "NUM_LAYERS": "6", "EVAL_STRIDE": "256", "NORMUON": "1", "XSA": "1", "XSA_START_LAYER": "4", "VALUE_RESID": "1", "FP16_EMBED": "1", "Z_LOSS": "1e-4", "LOGIT_SOFTCAP": "50.0", "SEED": "42"}, "description": "Best config seed 42 (multi-seed validation)", "hypothesis": "HYP-048-seed42"}, "metrics": {"artifact_size_bytes": 6218970, "wall_time_ms": 317.0, "steps": 1896, "early_stopped": true, "hypothesis": "HYP-048-seed42", "estimated_params": 6817280}, "timestamp": 1774087124.8597178, "seed": 42}
{"experiment": "pgolf", "commit": "", "status": "keep", "val_bpb": 1.6633, "val_loss": 2.7758, "train_loss": 2.8444, "param_count": 6823951, "total_flops": 0.0, "peak_memory_mb": 0.0, "wall_time_s": 749.17649102211, "description": "Best config seed 43 (multi-seed validation)", "config": {"env_overrides": {"UNIQUE_BLOCKS": "3", "NUM_HEADS": "4", "NUM_KV_HEADS": "4", "NUM_LAYERS": "6", "EVAL_STRIDE": "256", "NORMUON": "1", "XSA": "1", "XSA_START_LAYER": "4", "VALUE_RESID": "1", "FP16_EMBED": "1", "Z_LOSS": "1e-4", "LOGIT_SOFTCAP": "50.0", "SEED": "43"}, "description": "Best config seed 43 (multi-seed validation)", "hypothesis": "HYP-048-seed43"}, "metrics": {"artifact_size_bytes": 6209719, "wall_time_ms": 317.0, "steps": 1893, "early_stopped": true, "hypothesis": "HYP-048-seed43", "estimated_params": 6817280}, "timestamp": 1774087880.786695, "seed": 42}
{"experiment": "pgolf", "commit": "", "status": "keep", "val_bpb": 1.6695, "val_loss": 2.7861, "train_loss": 2.8537, "param_count": 6823951, "total_flops": 0.0, "peak_memory_mb": 0.0, "wall_time_s": 748.8561410903931, "description": "Best config seed 44 (multi-seed validation)", "config": {"env_overrides": {"UNIQUE_BLOCKS": "3", "NUM_HEADS": "4", "NUM_KV_HEADS": "4", "NUM_LAYERS": "6", "EVAL_STRIDE": "256", "NORMUON": "1", "XSA": "1", "XSA_START_LAYER": "4", "VALUE_RESID": "1", "FP16_EMBED": "1", "Z_LOSS": "1e-4", "LOGIT_SOFTCAP": "50.0", "SEED": "44"}, "description": "Best config seed 44 (multi-seed validation)", "hypothesis": "HYP-048-seed44"}, "metrics": {"artifact_size_bytes": 6213912, "wall_time_ms": 318.0, "steps": 1894, "early_stopped": true, "hypothesis": "HYP-048-seed44", "estimated_params": 6817280}, "timestamp": 1774088637.485873, "seed": 42}
{"experiment": "pgolf", "commit": "", "status": "keep", "val_bpb": 1.6883, "val_loss": 2.8175, "train_loss": 2.7522, "param_count": 6823951, "total_flops": 0.0, "peak_memory_mb": 0.0, "wall_time_s": 672.6339998245239, "description": "Train seq_len 512 (2x batch diversity, shorter context)", "config": {"env_overrides": {"UNIQUE_BLOCKS": "3", "NUM_HEADS": "4", "NUM_KV_HEADS": "4", "NUM_LAYERS": "6", "EVAL_STRIDE": "256", "NORMUON": "1", "XSA": "1", "XSA_START_LAYER": "4", "VALUE_RESID": "1", "FP16_EMBED": "1", "Z_LOSS": "1e-4", "LOGIT_SOFTCAP": "50.0", "TRAIN_SEQ_LEN": "512"}, "description": "Train seq_len 512 (2x batch diversity, shorter context)", "hypothesis": "HYP-049-seq512"}, "metrics": {"artifact_size_bytes": 6399274, "wall_time_ms": 273.0, "steps": 2209, "early_stopped": true, "hypothesis": "HYP-049-seq512", "estimated_params": 6817280}, "timestamp": 1774089467.6604412, "seed": 42}
{"experiment": "pgolf", "commit": "", "status": "keep", "val_bpb": 1.6831, "val_loss": 2.8087, "train_loss": 3.0754, "param_count": 6823951, "total_flops": 0.0, "peak_memory_mb": 0.0, "wall_time_s": 929.0758211612701, "description": "Train seq_len 2048 (0.5x diversity, longer context)", "config": {"env_overrides": {"UNIQUE_BLOCKS": "3", "NUM_HEADS": "4", "NUM_KV_HEADS": "4", "NUM_LAYERS": "6", "EVAL_STRIDE": "256", "NORMUON": "1", "XSA": "1", "XSA_START_LAYER": "4", "VALUE_RESID": "1", "FP16_EMBED": "1", "Z_LOSS": "1e-4", "LOGIT_SOFTCAP": "50.0", "TRAIN_SEQ_LEN": "2048"}, "description": "Train seq_len 2048 (0.5x diversity, longer context)", "hypothesis": "HYP-049-seq2048"}, "metrics": {"artifact_size_bytes": 5848708, "wall_time_ms": 409.0, "steps": 1476, "early_stopped": true, "hypothesis": "HYP-049-seq2048", "estimated_params": 6817280}, "timestamp": 1774090404.763519, "seed": 42}
{"experiment": "pgolf", "commit": "", "status": "keep", "val_bpb": 1.6565, "val_loss": 2.7645, "train_loss": 2.8526, "param_count": 3938319, "total_flops": 0.0, "peak_memory_mb": 0.0, "wall_time_s": 739.6192300319672, "description": "dim=384 + 4h (head_dim=96, smaller+faster model)", "config": {"env_overrides": {"UNIQUE_BLOCKS": "3", "NUM_HEADS": "4", "NUM_KV_HEADS": "4", "NUM_LAYERS": "6", "EVAL_STRIDE": "256", "NORMUON": "1", "XSA": "1", "XSA_START_LAYER": "4", "VALUE_RESID": "1", "FP16_EMBED": "1", "Z_LOSS": "1e-4", "LOGIT_SOFTCAP": "50.0", "MODEL_DIM": "384"}, "description": "dim=384 + 4h (head_dim=96, smaller+faster model)", "hypothesis": "HYP-050-dim384"}, "metrics": {"artifact_size_bytes": 3881034, "wall_time_ms": 238.0, "steps": 2634, "early_stopped": true, "hypothesis": "HYP-050-dim384", "estimated_params": 3933312}, "timestamp": 1774091195.0945668, "seed": 42}
{"experiment": "pgolf", "commit": "", "status": "keep", "val_bpb": 2.3769, "val_loss": 3.9667, "train_loss": 3.8775, "param_count": 6823951, "total_flops": 0.0, "peak_memory_mb": 0.0, "wall_time_s": 211.8406217098236, "description": "dim=512 iso-step baseline (200 steps)", "config": {"env_overrides": {"UNIQUE_BLOCKS": "3", "NUM_HEADS": "4", "NUM_KV_HEADS": "4", "NUM_LAYERS": "6", "EVAL_STRIDE": "256", "NORMUON": "1", "XSA": "1", "XSA_START_LAYER": "4", "VALUE_RESID": "1", "FP16_EMBED": "1", "Z_LOSS": "1e-4", "LOGIT_SOFTCAP": "50.0", "MODEL_DIM": "512", "ITERATIONS": "200", "MAX_WALLCLOCK_SECONDS": "300"}, "description": "dim=512 iso-step baseline (200 steps)", "hypothesis": "HYP-051-dim512", "smoke": true}, "metrics": {"artifact_size_bytes": 4744963, "wall_time_ms": 323.0, "steps": 200, "hypothesis": "HYP-051-dim512", "estimated_params": 6817280}, "timestamp": 1774091482.9880068, "seed": 42}
{"experiment": "pgolf", "commit": "", "status": "keep", "val_bpb": 2.4132, "val_loss": 4.0273, "train_loss": 3.8906, "param_count": 3938319, "total_flops": 0.0, "peak_memory_mb": 0.0, "wall_time_s": 184.91757202148438, "description": "dim=384 iso-step comparison (200 steps)", "config": {"env_overrides": {"UNIQUE_BLOCKS": "3", "NUM_HEADS": "4", "NUM_KV_HEADS": "4", "NUM_LAYERS": "6", "EVAL_STRIDE": "256", "NORMUON": "1", "XSA": "1", "XSA_START_LAYER": "4", "VALUE_RESID": "1", "FP16_EMBED": "1", "Z_LOSS": "1e-4", "LOGIT_SOFTCAP": "50.0", "MODEL_DIM": "384", "ITERATIONS": "200", "MAX_WALLCLOCK_SECONDS": "300"}, "description": "dim=384 iso-step comparison (200 steps)", "hypothesis": "HYP-051-dim384", "smoke": true}, "metrics": {"artifact_size_bytes": 3037270, "wall_time_ms": 236.0, "steps": 200, "hypothesis": "HYP-051-dim384", "estimated_params": 3933312}, "timestamp": 1774091674.217628, "seed": 42}
{"experiment": "pgolf", "commit": "", "status": "keep", "val_bpb": 1.6642, "val_loss": 2.7773, "train_loss": 2.8423, "param_count": 6823951, "total_flops": 0.0, "peak_memory_mb": 0.0, "wall_time_s": 750.6495468616486, "description": "V normalization: RMSNorm on V (completes QKV norm)", "config": {"env_overrides": {"UNIQUE_BLOCKS": "3", "NUM_HEADS": "4", "NUM_KV_HEADS": "4", "NUM_LAYERS": "6", "EVAL_STRIDE": "256", "NORMUON": "1", "XSA": "1", "XSA_START_LAYER": "4", "VALUE_RESID": "1", "FP16_EMBED": "1", "Z_LOSS": "1e-4", "LOGIT_SOFTCAP": "50.0", "V_NORM": "1"}, "description": "V normalization: RMSNorm on V (completes QKV norm)", "hypothesis": "HYP-052-vnorm"}, "metrics": {"artifact_size_bytes": 6208430, "wall_time_ms": 320.0, "steps": 1887, "early_stopped": true, "hypothesis": "HYP-052-vnorm", "estimated_params": 6817280}, "timestamp": 1774092606.0730722, "seed": 42}
