{"experiment": "pgolf", "commit": "", "status": "keep", "val_bpb": 1.6998, "val_loss": 3.3488, "train_loss": 3.8147, "param_count": 7877642, "total_flops": 0.0, "peak_memory_mb": 0.0, "wall_time_s": 836.36781001091, "description": "CausalConv block 0 (layers 0,3 = conv, rest = attention)", "config": {"env_overrides": {"UNIQUE_BLOCKS": "3", "NUM_HEADS": "4", "NUM_KV_HEADS": "4", "NUM_LAYERS": "6", "EVAL_STRIDE": "256", "NORMUON": "1", "XSA": "1", "XSA_START_LAYER": "4", "VALUE_RESID": "1", "FP16_EMBED": "1", "Z_LOSS": "1e-4", "LOGIT_SOFTCAP": "50.0", "VOCAB_SIZE": "2048", "TOKENIZER_PATH": "./data/tokenizers/fineweb_2048_bpe.model", "DATA_PATH": "./data/datasets/fineweb10B_sp2048_local", "VAL_BATCH_SIZE": "65536", "CONV_LAYERS": "0"}, "description": "CausalConv block 0 (layers 0,3 = conv, rest = attention)", "hypothesis": "HYP-057-conv0"}, "metrics": {"artifact_size_bytes": 6926806, "wall_time_ms": 536.0, "steps": 1381, "early_stopped": true, "hypothesis": "HYP-057-conv0", "estimated_params": 7341568}, "timestamp": 1774122510.790699, "seed": 42}
{"experiment": "pgolf", "commit": "", "status": "keep", "val_bpb": 1.6843, "val_loss": 3.3181, "train_loss": 3.7961, "param_count": 8407045, "total_flops": 0.0, "peak_memory_mb": 0.0, "wall_time_s": 848.0871810913086, "description": "CausalConv blocks 0,1 (layers 0,1,3,4 = conv, 2,5 = attention)", "config": {"env_overrides": {"UNIQUE_BLOCKS": "3", "NUM_HEADS": "4", "NUM_KV_HEADS": "4", "NUM_LAYERS": "6", "EVAL_STRIDE": "256", "NORMUON": "1", "XSA": "1", "XSA_START_LAYER": "4", "VALUE_RESID": "1", "FP16_EMBED": "1", "Z_LOSS": "1e-4", "LOGIT_SOFTCAP": "50.0", "VOCAB_SIZE": "2048", "TOKENIZER_PATH": "./data/tokenizers/fineweb_2048_bpe.model", "DATA_PATH": "./data/datasets/fineweb10B_sp2048_local", "VAL_BATCH_SIZE": "65536", "CONV_LAYERS": "0,1"}, "description": "CausalConv blocks 0,1 (layers 0,1,3,4 = conv, 2,5 = attention)", "hypothesis": "HYP-057-conv01"}, "metrics": {"artifact_size_bytes": 7348638, "wall_time_ms": 461.0, "steps": 1391, "early_stopped": true, "hypothesis": "HYP-057-conv01", "estimated_params": 7341568}, "timestamp": 1774123529.133929, "seed": 42}
{"experiment": "pgolf", "commit": "", "status": "crash", "val_bpb": Infinity, "val_loss": Infinity, "train_loss": 0.0, "param_count": 7341568, "total_flops": 0.0, "peak_memory_mb": 0.0, "wall_time_s": 0.18850469589233398, "description": "Pre-attention causal conv k=4 (local context mixing)", "config": {"env_overrides": {"UNIQUE_BLOCKS": "3", "NUM_HEADS": "4", "NUM_KV_HEADS": "4", "NUM_LAYERS": "6", "EVAL_STRIDE": "256", "NORMUON": "1", "XSA": "1", "XSA_START_LAYER": "4", "VALUE_RESID": "1", "FP16_EMBED": "1", "Z_LOSS": "1e-4", "LOGIT_SOFTCAP": "50.0", "VOCAB_SIZE": "2048", "TOKENIZER_PATH": "./data/tokenizers/fineweb_2048_bpe.model", "DATA_PATH": "./data/datasets/fineweb10B_sp2048_local", "VAL_BATCH_SIZE": "65536", "PRE_CONV": "4"}, "description": "Pre-attention causal conv k=4 (local context mixing)", "hypothesis": "HYP-058-preconv4"}, "metrics": {"artifact_size_bytes": 0, "error": "\n                                                                                                                                                                                    ^^^^^^^^^^^^^^^^^^^^^^^\n  File \"/Users/michaelellis/Projects/parameter-golf/.venv/lib/python3.13/site-packages/mlx/nn/layers/base.py\", line 103, in __getattr__\n    super(Module, self).__getattribute__(key)\n    ~~~~~~~~~~~~~~~~~~~~~~~~~~~~~~~~~~~~^^^^^\nAttributeError: 'CausalSelfAttention' object has no attribute 'up'\n", "hypothesis": "HYP-058-preconv4"}, "timestamp": 1774123541.969453, "seed": 42}
{"experiment": "pgolf", "commit": "", "status": "crash", "val_bpb": Infinity, "val_loss": Infinity, "train_loss": 0.0, "param_count": 7341568, "total_flops": 0.0, "peak_memory_mb": 0.0, "wall_time_s": 0.13417387008666992, "description": "Pre-attention causal conv k=4 (local context mixing)", "config": {"env_overrides": {"UNIQUE_BLOCKS": "3", "NUM_HEADS": "4", "NUM_KV_HEADS": "4", "NUM_LAYERS": "6", "EVAL_STRIDE": "256", "NORMUON": "1", "XSA": "1", "XSA_START_LAYER": "4", "VALUE_RESID": "1", "FP16_EMBED": "1", "Z_LOSS": "1e-4", "LOGIT_SOFTCAP": "50.0", "VOCAB_SIZE": "2048", "TOKENIZER_PATH": "./data/tokenizers/fineweb_2048_bpe.model", "DATA_PATH": "./data/datasets/fineweb10B_sp2048_local", "VAL_BATCH_SIZE": "65536", "PRE_CONV": "4"}, "description": "Pre-attention causal conv k=4 (local context mixing)", "hypothesis": "HYP-058-preconv4"}, "metrics": {"artifact_size_bytes": 0, "error": "\n                                                                                                                                                                                    ^^^^^^^^^^^^^^^^^^^^^^^\n  File \"/Users/michaelellis/Projects/parameter-golf/.venv/lib/python3.13/site-packages/mlx/nn/layers/base.py\", line 103, in __getattr__\n    super(Module, self).__getattribute__(key)\n    ~~~~~~~~~~~~~~~~~~~~~~~~~~~~~~~~~~~~^^^^^\nAttributeError: 'CausalSelfAttention' object has no attribute 'up'\n", "hypothesis": "HYP-058-preconv4"}, "timestamp": 1774123550.822699, "seed": 42}
{"experiment": "pgolf", "commit": "", "status": "keep", "val_bpb": 1.6777, "val_loss": 3.3051, "train_loss": 3.2717, "param_count": 7354383, "total_flops": 0.0, "peak_memory_mb": 0.0, "wall_time_s": 886.376039981842, "description": "Pre-attention causal conv k=4 (local context mixing)", "config": {"env_overrides": {"UNIQUE_BLOCKS": "3", "NUM_HEADS": "4", "NUM_KV_HEADS": "4", "NUM_LAYERS": "6", "EVAL_STRIDE": "256", "NORMUON": "1", "XSA": "1", "XSA_START_LAYER": "4", "VALUE_RESID": "1", "FP16_EMBED": "1", "Z_LOSS": "1e-4", "LOGIT_SOFTCAP": "50.0", "VOCAB_SIZE": "2048", "TOKENIZER_PATH": "./data/tokenizers/fineweb_2048_bpe.model", "DATA_PATH": "./data/datasets/fineweb10B_sp2048_local", "VAL_BATCH_SIZE": "65536", "PRE_CONV": "4"}, "description": "Pre-attention causal conv k=4 (local context mixing)", "hypothesis": "HYP-058-preconv4"}, "metrics": {"artifact_size_bytes": 6226488, "wall_time_ms": 775.0, "steps": 1135, "early_stopped": true, "hypothesis": "HYP-058-preconv4", "estimated_params": 7341568}, "timestamp": 1774124453.035915, "seed": 42}
{"experiment": "pgolf", "commit": "", "status": "crash", "val_bpb": Infinity, "val_loss": Infinity, "train_loss": 0.0, "param_count": 7341568, "total_flops": 0.0, "peak_memory_mb": 0.0, "wall_time_s": 0.2350752353668213, "description": "Conv1d k=32 block 0 (nn.Conv1d, no loop, layers 0,3)", "config": {"env_overrides": {"UNIQUE_BLOCKS": "3", "NUM_HEADS": "4", "NUM_KV_HEADS": "4", "NUM_LAYERS": "6", "EVAL_STRIDE": "256", "NORMUON": "1", "XSA": "1", "XSA_START_LAYER": "4", "VALUE_RESID": "1", "FP16_EMBED": "1", "Z_LOSS": "1e-4", "LOGIT_SOFTCAP": "50.0", "VOCAB_SIZE": "2048", "TOKENIZER_PATH": "./data/tokenizers/fineweb_2048_bpe.model", "DATA_PATH": "./data/datasets/fineweb10B_sp2048_local", "VAL_BATCH_SIZE": "65536", "CONV_LAYERS": "0"}, "description": "Conv1d k=32 block 0 (nn.Conv1d, no loop, layers 0,3)", "hypothesis": "HYP-059-conv32"}, "metrics": {"artifact_size_bytes": 0, "error": ", 'c_q') else b.attn.c_q_down.weight for b in model.blocks if hasattr(b.attn, 'c_q') or hasattr(b.attn, 'c_q_down')), next(p for p in model.parameters()['blocks'][0]['attn'].values() if hasattr(p, 'dtype'))).dtype} \"\n                                                                                                                                                                                    ~~~~^^^^^^^^^^^^^^^^^^^^^^^^^^^^^^^^^^^^^^^^^^^^^^^^^^^^^^^^^^^^^^^^^^^^^^^^^^^^^^^^^^^^\nStopIteration\n", "hypothesis": "HYP-059-conv32"}, "timestamp": 1774124885.14353, "seed": 42}
{"experiment": "pgolf", "commit": "", "status": "crash", "val_bpb": Infinity, "val_loss": Infinity, "train_loss": 0.0, "param_count": 7341568, "total_flops": 0.0, "peak_memory_mb": 0.0, "wall_time_s": 0.13367700576782227, "description": "Conv1d k=32 block 0 (nn.Conv1d, no loop, layers 0,3)", "config": {"env_overrides": {"UNIQUE_BLOCKS": "3", "NUM_HEADS": "4", "NUM_KV_HEADS": "4", "NUM_LAYERS": "6", "EVAL_STRIDE": "256", "NORMUON": "1", "XSA": "1", "XSA_START_LAYER": "4", "VALUE_RESID": "1", "FP16_EMBED": "1", "Z_LOSS": "1e-4", "LOGIT_SOFTCAP": "50.0", "VOCAB_SIZE": "2048", "TOKENIZER_PATH": "./data/tokenizers/fineweb_2048_bpe.model", "DATA_PATH": "./data/datasets/fineweb10B_sp2048_local", "VAL_BATCH_SIZE": "65536", "CONV_LAYERS": "0"}, "description": "Conv1d k=32 block 0 (nn.Conv1d, no loop, layers 0,3)", "hypothesis": "HYP-059-conv32"}, "metrics": {"artifact_size_bytes": 0, "error": ", 'c_q') else b.attn.c_q_down.weight for b in model.blocks if hasattr(b.attn, 'c_q') or hasattr(b.attn, 'c_q_down')), next(p for p in model.parameters()['blocks'][0]['attn'].values() if hasattr(p, 'dtype'))).dtype} \"\n                                                                                                                                                                                    ~~~~^^^^^^^^^^^^^^^^^^^^^^^^^^^^^^^^^^^^^^^^^^^^^^^^^^^^^^^^^^^^^^^^^^^^^^^^^^^^^^^^^^^^\nStopIteration\n", "hypothesis": "HYP-059-conv32"}, "timestamp": 1774124893.9481359, "seed": 42}
{"experiment": "pgolf", "commit": "", "status": "crash", "val_bpb": Infinity, "val_loss": Infinity, "train_loss": 0.0, "param_count": 7341568, "total_flops": 0.0, "peak_memory_mb": 0.0, "wall_time_s": 0.18878388404846191, "description": "Conv1d k=32 block 0 (nn.Conv1d, no loop, layers 0,3)", "config": {"env_overrides": {"UNIQUE_BLOCKS": "3", "NUM_HEADS": "4", "NUM_KV_HEADS": "4", "NUM_LAYERS": "6", "EVAL_STRIDE": "256", "NORMUON": "1", "XSA": "1", "XSA_START_LAYER": "4", "VALUE_RESID": "1", "FP16_EMBED": "1", "Z_LOSS": "1e-4", "LOGIT_SOFTCAP": "50.0", "VOCAB_SIZE": "2048", "TOKENIZER_PATH": "./data/tokenizers/fineweb_2048_bpe.model", "DATA_PATH": "./data/datasets/fineweb10B_sp2048_local", "VAL_BATCH_SIZE": "65536", "CONV_LAYERS": "0"}, "description": "Conv1d k=32 block 0 (nn.Conv1d, no loop, layers 0,3)", "hypothesis": "HYP-059-conv32"}, "metrics": {"artifact_size_bytes": 0, "error": ", 'c_q') else b.attn.c_q_down.weight for b in model.blocks if hasattr(b.attn, 'c_q') or hasattr(b.attn, 'c_q_down')), next(p for p in model.parameters()['blocks'][0]['attn'].values() if hasattr(p, 'dtype'))).dtype} \"\n                                                                                                                                                                                    ~~~~^^^^^^^^^^^^^^^^^^^^^^^^^^^^^^^^^^^^^^^^^^^^^^^^^^^^^^^^^^^^^^^^^^^^^^^^^^^^^^^^^^^^\nStopIteration\n", "hypothesis": "HYP-059-conv32"}, "timestamp": 1774124900.290144, "seed": 42}
{"experiment": "pgolf", "commit": "", "status": "crash", "val_bpb": Infinity, "val_loss": Infinity, "train_loss": 0.0, "param_count": 7341568, "total_flops": 0.0, "peak_memory_mb": 0.0, "wall_time_s": 0.13314080238342285, "description": "Conv1d k=32 block 0 (nn.Conv1d, no loop, layers 0,3)", "config": {"env_overrides": {"UNIQUE_BLOCKS": "3", "NUM_HEADS": "4", "NUM_KV_HEADS": "4", "NUM_LAYERS": "6", "EVAL_STRIDE": "256", "NORMUON": "1", "XSA": "1", "XSA_START_LAYER": "4", "VALUE_RESID": "1", "FP16_EMBED": "1", "Z_LOSS": "1e-4", "LOGIT_SOFTCAP": "50.0", "VOCAB_SIZE": "2048", "TOKENIZER_PATH": "./data/tokenizers/fineweb_2048_bpe.model", "DATA_PATH": "./data/datasets/fineweb10B_sp2048_local", "VAL_BATCH_SIZE": "65536", "CONV_LAYERS": "0"}, "description": "Conv1d k=32 block 0 (nn.Conv1d, no loop, layers 0,3)", "hypothesis": "HYP-059-conv32"}, "metrics": {"artifact_size_bytes": 0, "error": ", 'c_q') else b.attn.c_q_down.weight for b in model.blocks if hasattr(b.attn, 'c_q') or hasattr(b.attn, 'c_q_down')), next(p for p in model.parameters()['blocks'][0]['attn'].values() if hasattr(p, 'dtype'))).dtype} \"\n                                                                                                                                                                                    ~~~~^^^^^^^^^^^^^^^^^^^^^^^^^^^^^^^^^^^^^^^^^^^^^^^^^^^^^^^^^^^^^^^^^^^^^^^^^^^^^^^^^^^^\nStopIteration\n", "hypothesis": "HYP-059-conv32"}, "timestamp": 1774124907.249247, "seed": 42}
{"experiment": "pgolf", "commit": "", "status": "keep", "val_bpb": 2.3169, "val_loss": 4.5645, "train_loss": 4.6809, "param_count": 7877642, "total_flops": 0.0, "peak_memory_mb": 0.0, "wall_time_s": 343.2182059288025, "description": "Conv1d k=32 block 0 (nn.Conv1d, no loop, layers 0,3)", "config": {"env_overrides": {"UNIQUE_BLOCKS": "3", "NUM_HEADS": "4", "NUM_KV_HEADS": "4", "NUM_LAYERS": "6", "EVAL_STRIDE": "256", "NORMUON": "1", "XSA": "1", "XSA_START_LAYER": "4", "VALUE_RESID": "1", "FP16_EMBED": "1", "Z_LOSS": "1e-4", "LOGIT_SOFTCAP": "50.0", "VOCAB_SIZE": "2048", "TOKENIZER_PATH": "./data/tokenizers/fineweb_2048_bpe.model", "DATA_PATH": "./data/datasets/fineweb10B_sp2048_local", "VAL_BATCH_SIZE": "65536", "CONV_LAYERS": "0"}, "description": "Conv1d k=32 block 0 (nn.Conv1d, no loop, layers 0,3)", "hypothesis": "HYP-059-conv32"}, "metrics": {"artifact_size_bytes": 6070656, "wall_time_ms": 546.0, "steps": 200, "hypothesis": "HYP-059-conv32", "estimated_params": 7341568}, "timestamp": 1774125264.187534, "seed": 42}
{"experiment": "pgolf", "commit": "", "status": "keep", "val_bpb": 1.7024, "val_loss": 3.3538, "train_loss": 3.7323, "param_count": 7877642, "total_flops": 0.0, "peak_memory_mb": 0.0, "wall_time_s": 856.0991833209991, "description": "Conv1d k=32 block 0 (nn.Conv1d, no loop, layers 0,3)", "config": {"env_overrides": {"UNIQUE_BLOCKS": "3", "NUM_HEADS": "4", "NUM_KV_HEADS": "4", "NUM_LAYERS": "6", "EVAL_STRIDE": "256", "NORMUON": "1", "XSA": "1", "XSA_START_LAYER": "4", "VALUE_RESID": "1", "FP16_EMBED": "1", "Z_LOSS": "1e-4", "LOGIT_SOFTCAP": "50.0", "VOCAB_SIZE": "2048", "TOKENIZER_PATH": "./data/tokenizers/fineweb_2048_bpe.model", "DATA_PATH": "./data/datasets/fineweb10B_sp2048_local", "VAL_BATCH_SIZE": "65536", "CONV_LAYERS": "0"}, "description": "Conv1d k=32 block 0 (nn.Conv1d, no loop, layers 0,3)", "hypothesis": "HYP-059-conv32"}, "metrics": {"artifact_size_bytes": 6825363, "wall_time_ms": 617.0, "steps": 1289, "early_stopped": true, "hypothesis": "HYP-059-conv32", "estimated_params": 7341568}, "timestamp": 1774126138.821707, "seed": 42}
{"experiment": "pgolf", "commit": "", "status": "keep", "val_bpb": 1.7377, "val_loss": 3.4235, "train_loss": 3.4973, "param_count": 8135690, "total_flops": 0.0, "peak_memory_mb": 0.0, "wall_time_s": 804.0397911071777, "description": "gMLP SGU block 0 (causal spatial mixing, layers 0,3)", "config": {"env_overrides": {"UNIQUE_BLOCKS": "3", "NUM_HEADS": "4", "NUM_KV_HEADS": "4", "NUM_LAYERS": "6", "EVAL_STRIDE": "256", "NORMUON": "1", "XSA": "1", "XSA_START_LAYER": "4", "VALUE_RESID": "1", "FP16_EMBED": "1", "Z_LOSS": "1e-4", "LOGIT_SOFTCAP": "50.0", "VOCAB_SIZE": "2048", "TOKENIZER_PATH": "./data/tokenizers/fineweb_2048_bpe.model", "DATA_PATH": "./data/datasets/fineweb10B_sp2048_local", "VAL_BATCH_SIZE": "65536", "SGU_LAYERS": "0"}, "description": "gMLP SGU block 0 (causal spatial mixing, layers 0,3)", "hypothesis": "HYP-059-sgu0"}, "metrics": {"artifact_size_bytes": 7171555, "wall_time_ms": 516.0, "steps": 1464, "early_stopped": true, "hypothesis": "HYP-059-sgu0", "estimated_params": 7341568}, "timestamp": 1774126951.056512, "seed": 42}
{"experiment": "pgolf", "commit": "", "status": "keep", "val_bpb": 1.6462, "val_loss": 3.2432, "train_loss": 3.4937, "param_count": 7348239, "total_flops": 0.0, "peak_memory_mb": 0.0, "wall_time_s": 896.4378018379211, "description": "sp2048 + eval stride 128 (tighter sliding window)", "config": {"env_overrides": {"UNIQUE_BLOCKS": "3", "NUM_HEADS": "4", "NUM_KV_HEADS": "4", "NUM_LAYERS": "6", "EVAL_STRIDE": "128", "NORMUON": "1", "XSA": "1", "XSA_START_LAYER": "4", "VALUE_RESID": "1", "FP16_EMBED": "1", "Z_LOSS": "1e-4", "LOGIT_SOFTCAP": "50.0", "VOCAB_SIZE": "2048", "TOKENIZER_PATH": "./data/tokenizers/fineweb_2048_bpe.model", "DATA_PATH": "./data/datasets/fineweb10B_sp2048_local", "VAL_BATCH_SIZE": "65536"}, "description": "sp2048 + eval stride 128 (tighter sliding window)", "hypothesis": "HYP-060-stride128"}, "metrics": {"artifact_size_bytes": 6964396, "wall_time_ms": 336.0, "steps": 1826, "early_stopped": true, "hypothesis": "HYP-060-stride128", "estimated_params": 7341568}, "timestamp": 1774136134.256208, "seed": 42}
{"experiment": "pgolf", "commit": "", "status": "keep", "val_bpb": 1.6413, "val_loss": 3.2336, "train_loss": 3.4996, "param_count": 7348239, "total_flops": 0.0, "peak_memory_mb": 0.0, "wall_time_s": 1192.0772371292114, "description": "sp2048 + eval stride 64 (competition standard)", "config": {"env_overrides": {"UNIQUE_BLOCKS": "3", "NUM_HEADS": "4", "NUM_KV_HEADS": "4", "NUM_LAYERS": "6", "EVAL_STRIDE": "64", "NORMUON": "1", "XSA": "1", "XSA_START_LAYER": "4", "VALUE_RESID": "1", "FP16_EMBED": "1", "Z_LOSS": "1e-4", "LOGIT_SOFTCAP": "50.0", "VOCAB_SIZE": "2048", "TOKENIZER_PATH": "./data/tokenizers/fineweb_2048_bpe.model", "DATA_PATH": "./data/datasets/fineweb10B_sp2048_local", "VAL_BATCH_SIZE": "65536"}, "description": "sp2048 + eval stride 64 (competition standard)", "hypothesis": "HYP-060-stride64"}, "metrics": {"artifact_size_bytes": 6953429, "wall_time_ms": 336.0, "steps": 1805, "early_stopped": true, "hypothesis": "HYP-060-stride64", "estimated_params": 7341568}, "timestamp": 1774137336.551429, "seed": 42}
{"experiment": "pgolf", "commit": "", "status": "keep", "val_bpb": 1.6719, "val_loss": 3.2938, "train_loss": 3.5292, "param_count": 7348239, "total_flops": 0.0, "peak_memory_mb": 0.0, "wall_time_s": 756.6652359962463, "description": "RDOQ: keep tok_emb + all proj layers at fp16", "config": {"env_overrides": {"UNIQUE_BLOCKS": "3", "NUM_HEADS": "4", "NUM_KV_HEADS": "4", "NUM_LAYERS": "6", "EVAL_STRIDE": "256", "NORMUON": "1", "XSA": "1", "XSA_START_LAYER": "4", "VALUE_RESID": "1", "FP16_EMBED": "1", "Z_LOSS": "1e-4", "LOGIT_SOFTCAP": "50.0", "VOCAB_SIZE": "2048", "TOKENIZER_PATH": "./data/tokenizers/fineweb_2048_bpe.model", "DATA_PATH": "./data/datasets/fineweb10B_sp2048_local", "VAL_BATCH_SIZE": "65536", "INT8_KEEP_FLOAT_NAME_PATTERNS": "tok_emb,proj"}, "description": "RDOQ: keep tok_emb + all proj layers at fp16", "hypothesis": "HYP-061-fp16proj"}, "metrics": {"artifact_size_bytes": 9366635, "wall_time_ms": 334.0, "steps": 1804, "early_stopped": true, "hypothesis": "HYP-061-fp16proj", "estimated_params": 7341568}, "timestamp": 1774138316.9698691, "seed": 42}
{"experiment": "pgolf", "commit": "", "status": "keep", "val_bpb": 1.6381, "val_loss": 3.2272, "train_loss": 3.4762, "param_count": 7348239, "total_flops": 0.0, "peak_memory_mb": 0.0, "wall_time_s": 753.0026969909668, "description": "RDOQ: keep tok_emb + all control tensors at fp16", "config": {"env_overrides": {"UNIQUE_BLOCKS": "3", "NUM_HEADS": "4", "NUM_KV_HEADS": "4", "NUM_LAYERS": "6", "EVAL_STRIDE": "256", "NORMUON": "1", "XSA": "1", "XSA_START_LAYER": "4", "VALUE_RESID": "1", "FP16_EMBED": "1", "Z_LOSS": "1e-4", "LOGIT_SOFTCAP": "50.0", "VOCAB_SIZE": "2048", "TOKENIZER_PATH": "./data/tokenizers/fineweb_2048_bpe.model", "DATA_PATH": "./data/datasets/fineweb10B_sp2048_local", "VAL_BATCH_SIZE": "65536", "INT8_KEEP_FLOAT_NAME_PATTERNS": "tok_emb,attn_scale,mlp_scale,q_gain,resid_mix"}, "description": "RDOQ: keep tok_emb + all control tensors at fp16", "hypothesis": "HYP-061-fp16ctrl"}, "metrics": {"artifact_size_bytes": 6930886, "wall_time_ms": 342.0, "steps": 1812, "early_stopped": true, "hypothesis": "HYP-061-fp16ctrl", "estimated_params": 7341568}, "timestamp": 1774139081.9887218, "seed": 42}
{"experiment": "pgolf", "commit": "", "status": "keep", "val_bpb": 1.7046, "val_loss": 3.3581, "train_loss": 3.5334, "param_count": 7348239, "total_flops": 0.0, "peak_memory_mb": 0.0, "wall_time_s": 756.4332580566406, "description": "Eval temp 0.9 (sharpen \u2014 model may be underconfident)", "config": {"env_overrides": {"UNIQUE_BLOCKS": "3", "NUM_HEADS": "4", "NUM_KV_HEADS": "4", "NUM_LAYERS": "6", "EVAL_STRIDE": "256", "NORMUON": "1", "XSA": "1", "XSA_START_LAYER": "4", "VALUE_RESID": "1", "FP16_EMBED": "1", "Z_LOSS": "1e-4", "LOGIT_SOFTCAP": "50.0", "VOCAB_SIZE": "2048", "TOKENIZER_PATH": "./data/tokenizers/fineweb_2048_bpe.model", "DATA_PATH": "./data/datasets/fineweb10B_sp2048_local", "VAL_BATCH_SIZE": "65536", "EVAL_TEMP": "0.9"}, "description": "Eval temp 0.9 (sharpen \u2014 model may be underconfident)", "hypothesis": "HYP-063-temp09"}, "metrics": {"artifact_size_bytes": 6968515, "wall_time_ms": 329.0, "steps": 1818, "early_stopped": true, "hypothesis": "HYP-063-temp09", "estimated_params": 7341568}, "timestamp": 1774140416.825581, "seed": 42}
{"experiment": "pgolf", "commit": "", "status": "keep", "val_bpb": 1.7034, "val_loss": 3.3558, "train_loss": 3.5031, "param_count": 7348239, "total_flops": 0.0, "peak_memory_mb": 0.0, "wall_time_s": 752.7073080539703, "description": "Eval temp 0.8 (sharpen more)", "config": {"env_overrides": {"UNIQUE_BLOCKS": "3", "NUM_HEADS": "4", "NUM_KV_HEADS": "4", "NUM_LAYERS": "6", "EVAL_STRIDE": "256", "NORMUON": "1", "XSA": "1", "XSA_START_LAYER": "4", "VALUE_RESID": "1", "FP16_EMBED": "1", "Z_LOSS": "1e-4", "LOGIT_SOFTCAP": "50.0", "VOCAB_SIZE": "2048", "TOKENIZER_PATH": "./data/tokenizers/fineweb_2048_bpe.model", "DATA_PATH": "./data/datasets/fineweb10B_sp2048_local", "VAL_BATCH_SIZE": "65536", "EVAL_TEMP": "0.8"}, "description": "Eval temp 0.8 (sharpen more)", "hypothesis": "HYP-063-temp08"}, "metrics": {"artifact_size_bytes": 6959253, "wall_time_ms": 336.0, "steps": 1818, "early_stopped": true, "hypothesis": "HYP-063-temp08", "estimated_params": 7341568}, "timestamp": 1774141179.843919, "seed": 42}
