{"experiment": "pgolf", "commit": "", "status": "crash", "val_bpb": Infinity, "val_loss": Infinity, "train_loss": 0.0, "param_count": 7341568, "total_flops": 0.0, "peak_memory_mb": 0.0, "wall_time_s": 6.39574933052063, "description": "Random MLP fc (freeze input proj, learn output only)", "config": {"env_overrides": {"UNIQUE_BLOCKS": "3", "NUM_HEADS": "4", "NUM_KV_HEADS": "4", "NUM_LAYERS": "6", "EVAL_STRIDE": "256", "NORMUON": "1", "XSA": "1", "XSA_START_LAYER": "4", "VALUE_RESID": "1", "FP16_EMBED": "1", "Z_LOSS": "1e-4", "LOGIT_SOFTCAP": "50.0", "VOCAB_SIZE": "2048", "TOKENIZER_PATH": "./data/tokenizers/fineweb_2048_bpe.model", "DATA_PATH": "./data/datasets/fineweb10B_sp2048_local_v2", "VAL_BATCH_SIZE": "65536", "RANDOM_MLP_FC": "1"}, "description": "Random MLP fc (freeze input proj, learn output only)", "hypothesis": "HYP-073-randomfc"}, "metrics": {"artifact_size_bytes": 0, "error": "t.step(model, grads, step=step, lr_mul=lr_mul)\n    ~~~~~~~~^^^^^^^^^^^^^^^^^^^^^^^^^^^^^^^^^^^^^^^^\n  File \"/Users/michaelellis/Projects/parameter-golf/train_gpt_mlx.py\", line 1346, in step\n    updated.update(self.muon.step(params, grads, step=step, lr_mul=lr_mul))\n                   ~~~~~~~~~~~~~~^^^^^^^^^^^^^^^^^^^^^^^^^^^^^^^^^^^^^^^^^\n  File \"/Users/michaelellis/Projects/parameter-golf/train_gpt_mlx.py\", line 1279, in step\n    g = grads[k]\n        ~~~~~^^^\nKeyError: 'blocks.0.mlp.fc.weight'\n", "hypothesis": "HYP-073-randomfc"}, "timestamp": 1774155592.166768, "seed": 42}
{"experiment": "pgolf", "commit": "", "status": "keep", "val_bpb": 1.6423, "val_loss": 3.2354, "train_loss": 3.3908, "param_count": 7348239, "total_flops": 0.0, "peak_memory_mb": 0.0, "wall_time_s": 749.7393369674683, "description": "Random MLP fc (freeze input proj, learn output only)", "config": {"env_overrides": {"UNIQUE_BLOCKS": "3", "NUM_HEADS": "4", "NUM_KV_HEADS": "4", "NUM_LAYERS": "6", "EVAL_STRIDE": "256", "NORMUON": "1", "XSA": "1", "XSA_START_LAYER": "4", "VALUE_RESID": "1", "FP16_EMBED": "1", "Z_LOSS": "1e-4", "LOGIT_SOFTCAP": "50.0", "VOCAB_SIZE": "2048", "TOKENIZER_PATH": "./data/tokenizers/fineweb_2048_bpe.model", "DATA_PATH": "./data/datasets/fineweb10B_sp2048_local_v2", "VAL_BATCH_SIZE": "65536", "RANDOM_MLP_FC": "1"}, "description": "Random MLP fc (freeze input proj, learn output only)", "hypothesis": "HYP-073-randomfc"}, "metrics": {"artifact_size_bytes": 6822256, "wall_time_ms": 321.0, "steps": 1906, "early_stopped": true, "hypothesis": "HYP-073-randomfc", "estimated_params": 7341568}, "timestamp": 1774156392.9952168, "seed": 42}
{"experiment": "pgolf", "commit": "", "status": "keep", "val_bpb": 1.6492, "val_loss": 3.249, "train_loss": 3.415, "param_count": 7348239, "total_flops": 0.0, "peak_memory_mb": 0.0, "wall_time_s": 749.591903924942, "description": "Random MLP fc + random V projection (extend JL to attention)", "config": {"env_overrides": {"UNIQUE_BLOCKS": "3", "NUM_HEADS": "4", "NUM_KV_HEADS": "4", "NUM_LAYERS": "6", "EVAL_STRIDE": "256", "NORMUON": "1", "XSA": "1", "XSA_START_LAYER": "4", "VALUE_RESID": "1", "FP16_EMBED": "1", "Z_LOSS": "1e-4", "LOGIT_SOFTCAP": "50.0", "VOCAB_SIZE": "2048", "TOKENIZER_PATH": "./data/tokenizers/fineweb_2048_bpe.model", "DATA_PATH": "./data/datasets/fineweb10B_sp2048_local_v2", "VAL_BATCH_SIZE": "65536", "RANDOM_MLP_FC": "1", "RANDOM_ATTN_V": "1"}, "description": "Random MLP fc + random V projection (extend JL to attention)", "hypothesis": "HYP-074-randomv"}, "metrics": {"artifact_size_bytes": 6752042, "wall_time_ms": 312.0, "steps": 1929, "early_stopped": true, "hypothesis": "HYP-074-randomv", "estimated_params": 7341568}, "timestamp": 1774157302.936119, "seed": 42}
{"experiment": "pgolf", "commit": "", "status": "keep", "val_bpb": 1.644, "val_loss": 3.2388, "train_loss": 3.4026, "param_count": 7348239, "total_flops": 0.0, "peak_memory_mb": 0.0, "wall_time_s": 749.6697940826416, "description": "Random MLP fc + random K projection (extend JL to keys)", "config": {"env_overrides": {"UNIQUE_BLOCKS": "3", "NUM_HEADS": "4", "NUM_KV_HEADS": "4", "NUM_LAYERS": "6", "EVAL_STRIDE": "256", "NORMUON": "1", "XSA": "1", "XSA_START_LAYER": "4", "VALUE_RESID": "1", "FP16_EMBED": "1", "Z_LOSS": "1e-4", "LOGIT_SOFTCAP": "50.0", "VOCAB_SIZE": "2048", "TOKENIZER_PATH": "./data/tokenizers/fineweb_2048_bpe.model", "DATA_PATH": "./data/datasets/fineweb10B_sp2048_local_v2", "VAL_BATCH_SIZE": "65536", "RANDOM_MLP_FC": "1", "RANDOM_ATTN_K": "1"}, "description": "Random MLP fc + random K projection (extend JL to keys)", "hypothesis": "HYP-074-randomk"}, "metrics": {"artifact_size_bytes": 6746114, "wall_time_ms": 314.0, "steps": 1929, "early_stopped": true, "hypothesis": "HYP-074-randomk", "estimated_params": 7341568}, "timestamp": 1774158062.4133928, "seed": 42}
{"experiment": "pgolf", "commit": "", "status": "keep", "val_bpb": 1.6478, "val_loss": 3.2463, "train_loss": 3.4092, "param_count": 7348239, "total_flops": 0.0, "peak_memory_mb": 0.0, "wall_time_s": 749.8419351577759, "description": "Random MLP fc + V + K (maximum JL freezing)", "config": {"env_overrides": {"UNIQUE_BLOCKS": "3", "NUM_HEADS": "4", "NUM_KV_HEADS": "4", "NUM_LAYERS": "6", "EVAL_STRIDE": "256", "NORMUON": "1", "XSA": "1", "XSA_START_LAYER": "4", "VALUE_RESID": "1", "FP16_EMBED": "1", "Z_LOSS": "1e-4", "LOGIT_SOFTCAP": "50.0", "VOCAB_SIZE": "2048", "TOKENIZER_PATH": "./data/tokenizers/fineweb_2048_bpe.model", "DATA_PATH": "./data/datasets/fineweb10B_sp2048_local_v2", "VAL_BATCH_SIZE": "65536", "RANDOM_MLP_FC": "1", "RANDOM_ATTN_V": "1", "RANDOM_ATTN_K": "1"}, "description": "Random MLP fc + V + K (maximum JL freezing)", "hypothesis": "HYP-074-randomvk"}, "metrics": {"artifact_size_bytes": 6665981, "wall_time_ms": 313.0, "steps": 1944, "early_stopped": true, "hypothesis": "HYP-074-randomvk", "estimated_params": 7341568}, "timestamp": 1774158830.7887628, "seed": 42}
{"experiment": "pgolf", "commit": "", "status": "keep", "val_bpb": 1.6442, "val_loss": 3.2391, "train_loss": 3.3969, "param_count": 7348239, "total_flops": 0.0, "peak_memory_mb": 0.0, "wall_time_s": 749.589460849762, "description": "Random fc + full stack, seed 42 (validation)", "config": {"env_overrides": {"UNIQUE_BLOCKS": "3", "NUM_HEADS": "4", "NUM_KV_HEADS": "4", "NUM_LAYERS": "6", "EVAL_STRIDE": "256", "NORMUON": "1", "XSA": "1", "XSA_START_LAYER": "4", "VALUE_RESID": "1", "FP16_EMBED": "1", "Z_LOSS": "1e-4", "LOGIT_SOFTCAP": "50.0", "VOCAB_SIZE": "2048", "TOKENIZER_PATH": "./data/tokenizers/fineweb_2048_bpe.model", "DATA_PATH": "./data/datasets/fineweb10B_sp2048_local_v2", "VAL_BATCH_SIZE": "65536", "RANDOM_MLP_FC": "1", "SEED": "42"}, "description": "Random fc + full stack, seed 42 (validation)", "hypothesis": "HYP-075-seed42"}, "metrics": {"artifact_size_bytes": 6822972, "wall_time_ms": 319.0, "steps": 1908, "early_stopped": true, "hypothesis": "HYP-075-seed42", "estimated_params": 7341568}, "timestamp": 1774159695.3015418, "seed": 42}
{"experiment": "pgolf", "commit": "", "status": "keep", "val_bpb": 1.6456, "val_loss": 3.2419, "train_loss": 3.3969, "param_count": 7348239, "total_flops": 0.0, "peak_memory_mb": 0.0, "wall_time_s": 749.6431310176849, "description": "Random fc + full stack, seed 43 (validation)", "config": {"env_overrides": {"UNIQUE_BLOCKS": "3", "NUM_HEADS": "4", "NUM_KV_HEADS": "4", "NUM_LAYERS": "6", "EVAL_STRIDE": "256", "NORMUON": "1", "XSA": "1", "XSA_START_LAYER": "4", "VALUE_RESID": "1", "FP16_EMBED": "1", "Z_LOSS": "1e-4", "LOGIT_SOFTCAP": "50.0", "VOCAB_SIZE": "2048", "TOKENIZER_PATH": "./data/tokenizers/fineweb_2048_bpe.model", "DATA_PATH": "./data/datasets/fineweb10B_sp2048_local_v2", "VAL_BATCH_SIZE": "65536", "RANDOM_MLP_FC": "1", "SEED": "43"}, "description": "Random fc + full stack, seed 43 (validation)", "hypothesis": "HYP-075-seed43"}, "metrics": {"artifact_size_bytes": 6826599, "wall_time_ms": 320.0, "steps": 1908, "early_stopped": true, "hypothesis": "HYP-075-seed43", "estimated_params": 7341568}, "timestamp": 1774160454.3464808, "seed": 42}
{"experiment": "pgolf", "commit": "", "status": "keep", "val_bpb": 1.6619, "val_loss": 3.274, "train_loss": 3.4108, "param_count": 7348239, "total_flops": 0.0, "peak_memory_mb": 0.0, "wall_time_s": 749.7854378223419, "description": "No random fc (baseline), seed 42 (control)", "config": {"env_overrides": {"UNIQUE_BLOCKS": "3", "NUM_HEADS": "4", "NUM_KV_HEADS": "4", "NUM_LAYERS": "6", "EVAL_STRIDE": "256", "NORMUON": "1", "XSA": "1", "XSA_START_LAYER": "4", "VALUE_RESID": "1", "FP16_EMBED": "1", "Z_LOSS": "1e-4", "LOGIT_SOFTCAP": "50.0", "VOCAB_SIZE": "2048", "TOKENIZER_PATH": "./data/tokenizers/fineweb_2048_bpe.model", "DATA_PATH": "./data/datasets/fineweb10B_sp2048_local_v2", "VAL_BATCH_SIZE": "65536", "SEED": "42"}, "description": "No random fc (baseline), seed 42 (control)", "hypothesis": "HYP-075-ctrl42"}, "metrics": {"artifact_size_bytes": 7006837, "wall_time_ms": 328.0, "steps": 1863, "early_stopped": true, "hypothesis": "HYP-075-ctrl42", "estimated_params": 7341568}, "timestamp": 1774161212.334717, "seed": 42}
{"experiment": "pgolf", "commit": "", "status": "keep", "val_bpb": 1.6493, "val_loss": 3.2492, "train_loss": 3.3951, "param_count": 7348239, "total_flops": 0.0, "peak_memory_mb": 0.0, "wall_time_s": 749.7838411331177, "description": "No random fc (baseline), seed 43 (control)", "config": {"env_overrides": {"UNIQUE_BLOCKS": "3", "NUM_HEADS": "4", "NUM_KV_HEADS": "4", "NUM_LAYERS": "6", "EVAL_STRIDE": "256", "NORMUON": "1", "XSA": "1", "XSA_START_LAYER": "4", "VALUE_RESID": "1", "FP16_EMBED": "1", "Z_LOSS": "1e-4", "LOGIT_SOFTCAP": "50.0", "VOCAB_SIZE": "2048", "TOKENIZER_PATH": "./data/tokenizers/fineweb_2048_bpe.model", "DATA_PATH": "./data/datasets/fineweb10B_sp2048_local_v2", "VAL_BATCH_SIZE": "65536", "SEED": "43"}, "description": "No random fc (baseline), seed 43 (control)", "hypothesis": "HYP-075-ctrl43"}, "metrics": {"artifact_size_bytes": 6991433, "wall_time_ms": 324.0, "steps": 1864, "early_stopped": true, "hypothesis": "HYP-075-ctrl43", "estimated_params": 7341568}, "timestamp": 1774161969.636875, "seed": 42}
{"experiment": "pgolf", "commit": "", "status": "keep", "val_bpb": 1.6434, "val_loss": 3.2377, "train_loss": 3.5481, "param_count": 8921103, "total_flops": 0.0, "peak_memory_mb": 0.0, "wall_time_s": 770.6413159370422, "description": "Random fc + MLP 3x (1536 random features vs 1024)", "config": {"env_overrides": {"UNIQUE_BLOCKS": "3", "NUM_HEADS": "4", "NUM_KV_HEADS": "4", "NUM_LAYERS": "6", "EVAL_STRIDE": "256", "NORMUON": "1", "XSA": "1", "XSA_START_LAYER": "4", "VALUE_RESID": "1", "FP16_EMBED": "1", "Z_LOSS": "1e-4", "LOGIT_SOFTCAP": "50.0", "VOCAB_SIZE": "2048", "TOKENIZER_PATH": "./data/tokenizers/fineweb_2048_bpe.model", "DATA_PATH": "./data/datasets/fineweb10B_sp2048_local_v2", "VAL_BATCH_SIZE": "65536", "RANDOM_MLP_FC": "1", "MLP_MULT": "3"}, "description": "Random fc + MLP 3x (1536 random features vs 1024)", "hypothesis": "HYP-076-mlp3x"}, "metrics": {"artifact_size_bytes": 7851919, "wall_time_ms": 350.0, "steps": 1722, "early_stopped": true, "hypothesis": "HYP-076-mlp3x", "estimated_params": 8914432}, "timestamp": 1774162875.701805, "seed": 42}
{"experiment": "pgolf", "commit": "", "status": "keep", "val_bpb": 1.6465, "val_loss": 3.2436, "train_loss": 3.523, "param_count": 10493967, "total_flops": 0.0, "peak_memory_mb": 0.0, "wall_time_s": 790.8037371635437, "description": "Random fc + MLP 4x (2048 random features vs 1024)", "config": {"env_overrides": {"UNIQUE_BLOCKS": "3", "NUM_HEADS": "4", "NUM_KV_HEADS": "4", "NUM_LAYERS": "6", "EVAL_STRIDE": "256", "NORMUON": "1", "XSA": "1", "XSA_START_LAYER": "4", "VALUE_RESID": "1", "FP16_EMBED": "1", "Z_LOSS": "1e-4", "LOGIT_SOFTCAP": "50.0", "VOCAB_SIZE": "2048", "TOKENIZER_PATH": "./data/tokenizers/fineweb_2048_bpe.model", "DATA_PATH": "./data/datasets/fineweb10B_sp2048_local_v2", "VAL_BATCH_SIZE": "65536", "RANDOM_MLP_FC": "1", "MLP_MULT": "4"}, "description": "Random fc + MLP 4x (2048 random features vs 1024)", "hypothesis": "HYP-076-mlp4x"}, "metrics": {"artifact_size_bytes": 8819074, "wall_time_ms": 382.0, "steps": 1581, "early_stopped": true, "hypothesis": "HYP-076-mlp4x", "estimated_params": 10487296}, "timestamp": 1774163675.407115, "seed": 42}
{"experiment": "pgolf", "commit": "", "status": "keep", "val_bpb": 1.6408, "val_loss": 3.2324, "train_loss": 3.3855, "param_count": 7348239, "total_flops": 0.0, "peak_memory_mb": 0.0, "wall_time_s": 749.9081289768219, "description": "Orthogonal random fc (uncorrelated features, optimal JL)", "config": {"env_overrides": {"UNIQUE_BLOCKS": "3", "NUM_HEADS": "4", "NUM_KV_HEADS": "4", "NUM_LAYERS": "6", "EVAL_STRIDE": "256", "NORMUON": "1", "XSA": "1", "XSA_START_LAYER": "4", "VALUE_RESID": "1", "FP16_EMBED": "1", "Z_LOSS": "1e-4", "LOGIT_SOFTCAP": "50.0", "VOCAB_SIZE": "2048", "TOKENIZER_PATH": "./data/tokenizers/fineweb_2048_bpe.model", "DATA_PATH": "./data/datasets/fineweb10B_sp2048_local_v2", "VAL_BATCH_SIZE": "65536", "RANDOM_MLP_FC": "1", "ORTHO_RANDOM_FC": "1"}, "description": "Orthogonal random fc (uncorrelated features, optimal JL)", "hypothesis": "HYP-077-orthofc"}, "metrics": {"artifact_size_bytes": 6862310, "wall_time_ms": 318.0, "steps": 1908, "early_stopped": true, "hypothesis": "HYP-077-orthofc", "estimated_params": 7341568}, "timestamp": 1774164565.333432, "seed": 42}
{"experiment": "pgolf", "commit": "", "status": "keep", "val_bpb": 1.7176, "val_loss": 3.3839, "train_loss": 3.3876, "param_count": 7348239, "total_flops": 0.0, "peak_memory_mb": 0.0, "wall_time_s": 750.5061550140381, "description": "Prune 20% smallest weights (save ~0.5MB artifact)", "config": {"env_overrides": {"UNIQUE_BLOCKS": "3", "NUM_HEADS": "4", "NUM_KV_HEADS": "4", "NUM_LAYERS": "6", "EVAL_STRIDE": "256", "NORMUON": "1", "XSA": "1", "XSA_START_LAYER": "4", "VALUE_RESID": "1", "FP16_EMBED": "1", "Z_LOSS": "1e-4", "LOGIT_SOFTCAP": "50.0", "VOCAB_SIZE": "2048", "TOKENIZER_PATH": "./data/tokenizers/fineweb_2048_bpe.model", "DATA_PATH": "./data/datasets/fineweb10B_sp2048_local_v2", "VAL_BATCH_SIZE": "65536", "RANDOM_MLP_FC": "1", "ORTHO_RANDOM_FC": "1", "PRUNE_PCT": "20"}, "description": "Prune 20% smallest weights (save ~0.5MB artifact)", "hypothesis": "HYP-078-prune20"}, "metrics": {"artifact_size_bytes": 6374083, "wall_time_ms": 321.0, "steps": 1909, "early_stopped": true, "hypothesis": "HYP-078-prune20", "estimated_params": 7341568}, "timestamp": 1774165528.054185, "seed": 42}
{"experiment": "pgolf", "commit": "", "status": "keep", "val_bpb": 2.2515, "val_loss": 4.4356, "train_loss": 3.381, "param_count": 7348239, "total_flops": 0.0, "peak_memory_mb": 0.0, "wall_time_s": 750.1371378898621, "description": "Prune 30% smallest weights (save ~0.9MB artifact)", "config": {"env_overrides": {"UNIQUE_BLOCKS": "3", "NUM_HEADS": "4", "NUM_KV_HEADS": "4", "NUM_LAYERS": "6", "EVAL_STRIDE": "256", "NORMUON": "1", "XSA": "1", "XSA_START_LAYER": "4", "VALUE_RESID": "1", "FP16_EMBED": "1", "Z_LOSS": "1e-4", "LOGIT_SOFTCAP": "50.0", "VOCAB_SIZE": "2048", "TOKENIZER_PATH": "./data/tokenizers/fineweb_2048_bpe.model", "DATA_PATH": "./data/datasets/fineweb10B_sp2048_local_v2", "VAL_BATCH_SIZE": "65536", "RANDOM_MLP_FC": "1", "ORTHO_RANDOM_FC": "1", "PRUNE_PCT": "30"}, "description": "Prune 30% smallest weights (save ~0.9MB artifact)", "hypothesis": "HYP-078-prune30"}, "metrics": {"artifact_size_bytes": 5994871, "wall_time_ms": 318.0, "steps": 1910, "early_stopped": true, "hypothesis": "HYP-078-prune30", "estimated_params": 7341568}, "timestamp": 1774166287.5946612, "seed": 42}
{"experiment": "pgolf", "commit": "", "status": "keep", "val_bpb": 1.6445, "val_loss": 3.2397, "train_loss": 3.3857, "param_count": 8921103, "total_flops": 0.0, "peak_memory_mb": 0.0, "wall_time_s": 751.7060489654541, "description": "Position-dependent MLP bias (position-aware nonlinear transform)", "config": {"env_overrides": {"UNIQUE_BLOCKS": "3", "NUM_HEADS": "4", "NUM_KV_HEADS": "4", "NUM_LAYERS": "6", "EVAL_STRIDE": "256", "NORMUON": "1", "XSA": "1", "XSA_START_LAYER": "4", "VALUE_RESID": "1", "FP16_EMBED": "1", "Z_LOSS": "1e-4", "LOGIT_SOFTCAP": "50.0", "VOCAB_SIZE": "2048", "TOKENIZER_PATH": "./data/tokenizers/fineweb_2048_bpe.model", "DATA_PATH": "./data/datasets/fineweb10B_sp2048_local_v2", "VAL_BATCH_SIZE": "65536", "RANDOM_MLP_FC": "1", "ORTHO_RANDOM_FC": "1", "POS_MLP_BIAS": "1"}, "description": "Position-dependent MLP bias (position-aware nonlinear transform)", "hypothesis": "HYP-079-posmlp"}, "metrics": {"artifact_size_bytes": 8212042, "wall_time_ms": 331.0, "steps": 1852, "early_stopped": true, "hypothesis": "HYP-079-posmlp", "estimated_params": 7341568}, "timestamp": 1774167269.932226, "seed": 42}
{"experiment": "pgolf", "commit": "", "status": "keep", "val_bpb": 1.6448, "val_loss": 3.2404, "train_loss": 3.3993, "param_count": 7348239, "total_flops": 0.0, "peak_memory_mb": 0.0, "wall_time_s": 750.0574660301208, "description": "Palindrome sharing (0,1,2,2,1,0) \u2014 skip-aligned symmetry", "config": {"env_overrides": {"UNIQUE_BLOCKS": "3", "NUM_HEADS": "4", "NUM_KV_HEADS": "4", "NUM_LAYERS": "6", "EVAL_STRIDE": "256", "NORMUON": "1", "XSA": "1", "XSA_START_LAYER": "4", "VALUE_RESID": "1", "FP16_EMBED": "1", "Z_LOSS": "1e-4", "LOGIT_SOFTCAP": "50.0", "VOCAB_SIZE": "2048", "TOKENIZER_PATH": "./data/tokenizers/fineweb_2048_bpe.model", "DATA_PATH": "./data/datasets/fineweb10B_sp2048_local_v2", "VAL_BATCH_SIZE": "65536", "RANDOM_MLP_FC": "1", "ORTHO_RANDOM_FC": "1", "SHARING_PATTERN": "palindrome"}, "description": "Palindrome sharing (0,1,2,2,1,0) \u2014 skip-aligned symmetry", "hypothesis": "HYP-080-palindrome"}, "metrics": {"artifact_size_bytes": 6865403, "wall_time_ms": 318.0, "steps": 1909, "early_stopped": true, "hypothesis": "HYP-080-palindrome", "estimated_params": 7341568}, "timestamp": 1774168191.5245152, "seed": 42}
