{"experiment": "pgolf", "commit": "", "status": "keep", "val_bpb": 2.3791, "val_loss": 4.017, "train_loss": 3.9166, "param_count": 17059912, "total_flops": 0.0, "peak_memory_mb": 0.0, "wall_time_s": 1540.7617151737213, "description": "baseline: unmodified train_gpt_mlx.py", "config": {"env_overrides": {}, "description": "baseline: unmodified train_gpt_mlx.py", "hypothesis": "BASELINE"}, "metrics": {"artifact_size_bytes": 11042193, "wall_time_ms": 151.0, "steps": 200, "hypothesis": "BASELINE", "estimated_params": 17041408}, "timestamp": 1773890599.394573, "seed": 42}
{"experiment": "pgolf", "commit": "", "status": "crash", "val_bpb": Infinity, "val_loss": Infinity, "train_loss": 0.0, "param_count": 17041408, "total_flops": 0.0, "peak_memory_mb": 0.0, "wall_time_s": 0.1372537612915039, "description": "baseline: 5000 steps, default schedule", "config": {"env_overrides": {"ITERATIONS": "5000"}, "description": "baseline: 5000 steps, default schedule", "hypothesis": "HYP-017-baseline"}, "metrics": {"artifact_size_bytes": 0, "error": "cts/parameter-golf/train_gpt_mlx.py\", line 730, in load_validation_tokens\n    tokens = np.ascontiguousarray(np.concatenate([load_data_shard(file) for file in files], axis=0))\n                                                  ~~~~~~~~~~~~~~~^^^^^^\n  File \"/Users/michaelellis/Projects/parameter-golf/train_gpt_mlx.py\", line 199, in load_data_shard\n    raise ValueError(f\"Shard size mismatch for {path}\")\nValueError: Shard size mismatch for data/datasets/fineweb10B_sp1024_local/fineweb_val_000000.bin\n", "hypothesis": "HYP-017-baseline"}, "timestamp": 1773892564.788866, "seed": 42}
{"experiment": "pgolf", "commit": "", "status": "keep", "val_bpb": 1.941, "val_loss": 3.2392, "train_loss": 3.2333, "param_count": 17059912, "total_flops": 0.0, "peak_memory_mb": 0.0, "wall_time_s": 654.6281220912933, "description": "baseline: 5000 steps, default schedule", "config": {"env_overrides": {"ITERATIONS": "5000"}, "description": "baseline: 5000 steps, default schedule", "hypothesis": "HYP-017-baseline"}, "metrics": {"artifact_size_bytes": 12610364, "wall_time_ms": 146.0, "steps": 1141, "early_stopped": true, "hypothesis": "HYP-017-baseline", "estimated_params": 17041408}, "timestamp": 1773893240.530037, "seed": 42}
{"experiment": "pgolf", "commit": "", "status": "keep", "val_bpb": 1.9455, "val_loss": 3.2467, "train_loss": 3.237, "param_count": 17059912, "total_flops": 0.0, "peak_memory_mb": 0.0, "wall_time_s": 686.2816529273987, "description": "warmup=100 (vs baseline 20)", "config": {"env_overrides": {"ITERATIONS": "5000", "WARMUP_STEPS": "100"}, "description": "warmup=100 (vs baseline 20)", "hypothesis": "HYP-017-a"}, "metrics": {"artifact_size_bytes": 12547361, "wall_time_ms": 148.0, "steps": 1122, "early_stopped": true, "hypothesis": "HYP-017-a", "estimated_params": 17041408}, "timestamp": 1773893942.678024, "seed": 42}
{"experiment": "pgolf", "commit": "", "status": "keep", "val_bpb": 1.942, "val_loss": 3.2409, "train_loss": 3.2419, "param_count": 17059912, "total_flops": 0.0, "peak_memory_mb": 0.0, "wall_time_s": 728.3358550071716, "description": "warmup=200 (vs baseline 20)", "config": {"env_overrides": {"ITERATIONS": "5000", "WARMUP_STEPS": "200"}, "description": "warmup=200 (vs baseline 20)", "hypothesis": "HYP-017-a"}, "metrics": {"artifact_size_bytes": 12630618, "wall_time_ms": 147.0, "steps": 1143, "early_stopped": true, "hypothesis": "HYP-017-a", "estimated_params": 17041408}, "timestamp": 1773894678.1185842, "seed": 42}
{"experiment": "pgolf", "commit": "", "status": "keep", "val_bpb": 1.9258, "val_loss": 3.2139, "train_loss": 3.1541, "param_count": 17059912, "total_flops": 0.0, "peak_memory_mb": 0.0, "wall_time_s": 664.2704639434814, "description": "warmdown=2000 (vs baseline 1200)", "config": {"env_overrides": {"ITERATIONS": "5000", "WARMDOWN_ITERS": "2000"}, "description": "warmdown=2000 (vs baseline 1200)", "hypothesis": "HYP-017-b"}, "metrics": {"artifact_size_bytes": 11337944, "wall_time_ms": 147.0, "steps": 1004, "early_stopped": true, "hypothesis": "HYP-017-b", "estimated_params": 17041408}, "timestamp": 1773895347.844979, "seed": 42}
{"experiment": "pgolf", "commit": "", "status": "keep", "val_bpb": 1.887, "val_loss": 3.1491, "train_loss": 3.0932, "param_count": 17059912, "total_flops": 0.0, "peak_memory_mb": 0.0, "wall_time_s": 655.7325210571289, "description": "warmdown=3000 (vs baseline 1200)", "config": {"env_overrides": {"ITERATIONS": "5000", "WARMDOWN_ITERS": "3000"}, "description": "warmdown=3000 (vs baseline 1200)", "hypothesis": "HYP-017-b"}, "metrics": {"artifact_size_bytes": 10417836, "wall_time_ms": 153.0, "steps": 1044, "early_stopped": true, "hypothesis": "HYP-017-b", "estimated_params": 17041408}, "timestamp": 1773896033.304032, "seed": 42}
{"experiment": "pgolf", "commit": "", "status": "keep", "val_bpb": 1.9593, "val_loss": 3.2697, "train_loss": 3.2288, "param_count": 17059912, "total_flops": 0.0, "peak_memory_mb": 0.0, "wall_time_s": 656.5669491291046, "description": "matrix_lr=0.06 (vs baseline 0.04)", "config": {"env_overrides": {"ITERATIONS": "5000", "MATRIX_LR": "0.06"}, "description": "matrix_lr=0.06 (vs baseline 0.04)", "hypothesis": "HYP-017-lr"}, "metrics": {"artifact_size_bytes": 13483652, "wall_time_ms": 149.0, "steps": 1066, "early_stopped": true, "hypothesis": "HYP-017-lr", "estimated_params": 17041408}, "timestamp": 1773896704.7366369, "seed": 42}
{"experiment": "pgolf", "commit": "", "status": "keep", "val_bpb": 1.9293, "val_loss": 3.2197, "train_loss": 3.22, "param_count": 17059912, "total_flops": 0.0, "peak_memory_mb": 0.0, "wall_time_s": 652.4794590473175, "description": "matrix_lr=0.03 (vs baseline 0.04)", "config": {"env_overrides": {"ITERATIONS": "5000", "MATRIX_LR": "0.03"}, "description": "matrix_lr=0.03 (vs baseline 0.04)", "hypothesis": "HYP-017-lr"}, "metrics": {"artifact_size_bytes": 12074013, "wall_time_ms": 150.0, "steps": 1155, "early_stopped": true, "hypothesis": "HYP-017-lr", "estimated_params": 17041408}, "timestamp": 1773897372.1969101, "seed": 42}
{"experiment": "pgolf", "commit": "", "status": "keep", "val_bpb": 1.9105, "val_loss": 3.1882, "train_loss": 3.1783, "param_count": 17059912, "total_flops": 0.0, "peak_memory_mb": 0.0, "wall_time_s": 659.1715898513794, "description": "warmdown=1800 (between baseline 1200 and best 3000)", "config": {"env_overrides": {"ITERATIONS": "5000", "WARMDOWN_ITERS": "1800"}, "description": "warmdown=1800 (between baseline 1200 and best 3000)", "hypothesis": "HYP-017-b-refined"}, "metrics": {"artifact_size_bytes": 11940711, "wall_time_ms": 146.0, "steps": 1143, "early_stopped": true, "hypothesis": "HYP-017-b-refined", "estimated_params": 17041408}, "timestamp": 1773898060.4131892, "seed": 42}
{"experiment": "pgolf", "commit": "", "status": "keep", "val_bpb": 1.8952, "val_loss": 3.1628, "train_loss": 3.7938, "param_count": 17059912, "total_flops": 0.0, "peak_memory_mb": 0.0, "wall_time_s": 656.6940679550171, "description": "best combo: warmdown=3000 + lr=0.03", "config": {"env_overrides": {"ITERATIONS": "5000", "WARMDOWN_ITERS": "3000", "MATRIX_LR": "0.03", "SCALAR_LR": "0.03", "TIED_EMBED_LR": "0.04"}, "description": "best combo: warmdown=3000 + lr=0.03", "hypothesis": "HYP-017-combined"}, "metrics": {"artifact_size_bytes": 9694043, "wall_time_ms": 186.0, "steps": 996, "early_stopped": true, "hypothesis": "HYP-017-combined", "estimated_params": 17041408}, "timestamp": 1773898724.5005288, "seed": 42}
{"experiment": "pgolf", "commit": "", "status": "keep", "val_bpb": 1.8172, "val_loss": 3.0326, "train_loss": 2.9972, "param_count": 17059912, "total_flops": 0.0, "peak_memory_mb": 0.0, "wall_time_s": 653.2846128940582, "description": "best combo: warmdown=3000 + lr=0.03", "config": {"env_overrides": {"ITERATIONS": "5000", "WARMDOWN_ITERS": "3000", "MATRIX_LR": "0.03", "SCALAR_LR": "0.03", "TIED_EMBED_LR": "0.04"}, "description": "best combo: warmdown=3000 + lr=0.03", "hypothesis": "HYP-017-combined"}, "metrics": {"artifact_size_bytes": 10322407, "wall_time_ms": 158.0, "steps": 1149, "early_stopped": true, "hypothesis": "HYP-017-combined", "estimated_params": 17041408}, "timestamp": 1773899384.384732, "seed": 42}
{"experiment": "pgolf", "commit": "", "status": "keep", "val_bpb": 1.8395, "val_loss": 3.0698, "train_loss": 3.0421, "param_count": 17059912, "total_flops": 0.0, "peak_memory_mb": 0.0, "wall_time_s": 652.4433732032776, "description": "warmdown=5000 (full linear decay, extreme low LR)", "config": {"env_overrides": {"ITERATIONS": "5000", "WARMDOWN_ITERS": "5000"}, "description": "warmdown=5000 (full linear decay, extreme low LR)", "hypothesis": "HYP-017-b-extreme"}, "metrics": {"artifact_size_bytes": 9958977, "wall_time_ms": 146.0, "steps": 1156, "early_stopped": true, "hypothesis": "HYP-017-b-extreme", "estimated_params": 17041408}, "timestamp": 1773900107.202059, "seed": 42}
{"experiment": "pgolf", "commit": "", "status": "keep", "val_bpb": 1.9377, "val_loss": 3.2336, "train_loss": 3.2288, "param_count": 17059912, "total_flops": 0.0, "peak_memory_mb": 0.0, "wall_time_s": 651.9801149368286, "description": "baseline (rerun for variance check)", "config": {"env_overrides": {"ITERATIONS": "5000"}, "description": "baseline (rerun for variance check)", "hypothesis": "HYP-017-variance"}, "metrics": {"artifact_size_bytes": 12642756, "wall_time_ms": 147.0, "steps": 1156, "early_stopped": true, "hypothesis": "HYP-017-variance", "estimated_params": 17041408}, "timestamp": 1773900764.8052711, "seed": 42}
{"experiment": "pgolf", "commit": "", "status": "keep", "val_bpb": 1.8453, "val_loss": 3.0794, "train_loss": 3.0707, "param_count": 17059912, "total_flops": 0.0, "peak_memory_mb": 0.0, "wall_time_s": 652.3251619338989, "description": "warmdown=4000 (between 3000 and 5000)", "config": {"env_overrides": {"ITERATIONS": "5000", "WARMDOWN_ITERS": "4000"}, "description": "warmdown=4000 (between 3000 and 5000)", "hypothesis": "HYP-017-b-sweep"}, "metrics": {"artifact_size_bytes": 10438135, "wall_time_ms": 148.0, "steps": 1156, "early_stopped": true, "hypothesis": "HYP-017-b-sweep", "estimated_params": 17041408}, "timestamp": 1773901423.984714, "seed": 42}
{"experiment": "pgolf", "commit": "", "status": "keep", "val_bpb": 2.4064, "val_loss": 4.0158, "train_loss": 3.9148, "param_count": 17059912, "total_flops": 0.0, "peak_memory_mb": 0.0, "wall_time_s": 155.11627006530762, "description": "baseline rerun (9 unique, dim=512)", "config": {"env_overrides": {"ITERATIONS": "5000"}, "description": "baseline rerun (9 unique, dim=512)", "hypothesis": "HYP-018-baseline"}, "metrics": {"artifact_size_bytes": 11065723, "wall_time_ms": 145.0, "steps": 200, "hypothesis": "HYP-018-baseline", "estimated_params": 17041408}, "timestamp": 1773902107.2254562, "seed": 42}
{"experiment": "pgolf", "commit": "", "status": "keep", "val_bpb": 1.9393, "val_loss": 3.2364, "train_loss": 3.2276, "param_count": 17059912, "total_flops": 0.0, "peak_memory_mb": 0.0, "wall_time_s": 652.0333139896393, "description": "baseline rerun (9 unique, dim=512)", "config": {"env_overrides": {"ITERATIONS": "5000"}, "description": "baseline rerun (9 unique, dim=512)", "hypothesis": "HYP-018-baseline"}, "metrics": {"artifact_size_bytes": 12645534, "wall_time_ms": 151.0, "steps": 1157, "early_stopped": true, "hypothesis": "HYP-018-baseline", "estimated_params": 17041408}, "timestamp": 1773903220.734946, "seed": 42}
{"experiment": "pgolf", "commit": "", "status": "keep", "val_bpb": 1.9102, "val_loss": 3.1878, "train_loss": 3.2222, "param_count": 6037528, "total_flops": 0.0, "peak_memory_mb": 0.0, "wall_time_s": 651.5751328468323, "description": "3 unique blocks, dim=512 (pure sharing cost)", "config": {"env_overrides": {"ITERATIONS": "5000", "UNIQUE_BLOCKS": "3"}, "description": "3 unique blocks, dim=512 (pure sharing cost)", "hypothesis": "HYP-018-a"}, "metrics": {"artifact_size_bytes": 4741119, "wall_time_ms": 143.0, "steps": 1313, "early_stopped": true, "hypothesis": "HYP-018-a", "estimated_params": 6031360}, "timestamp": 1773903876.461163, "seed": 42}
{"experiment": "pgolf", "commit": "", "status": "keep", "val_bpb": 1.9276, "val_loss": 3.2168, "train_loss": 3.2331, "param_count": 9711656, "total_flops": 0.0, "peak_memory_mb": 0.0, "wall_time_s": 652.079775094986, "description": "5 unique blocks, dim=512 (moderate sharing)", "config": {"env_overrides": {"ITERATIONS": "5000", "UNIQUE_BLOCKS": "5"}, "description": "5 unique blocks, dim=512 (moderate sharing)", "hypothesis": "HYP-018-c"}, "metrics": {"artifact_size_bytes": 7477135, "wall_time_ms": 147.0, "steps": 1253, "early_stopped": true, "hypothesis": "HYP-018-c", "estimated_params": 9701376}, "timestamp": 1773904540.696176, "seed": 42}
{"experiment": "pgolf", "commit": "", "status": "keep", "val_bpb": 1.9754, "val_loss": 3.2967, "train_loss": 3.2746, "param_count": 13185048, "total_flops": 0.0, "peak_memory_mb": 0.0, "wall_time_s": 728.9065959453583, "description": "3 unique, dim=768 (shared+wider, ~13.2M params)", "config": {"env_overrides": {"ITERATIONS": "5000", "UNIQUE_BLOCKS": "3", "MODEL_DIM": "768", "NUM_HEADS": "8", "NUM_KV_HEADS": "4"}, "description": "3 unique, dim=768 (shared+wider, ~13.2M params)", "hypothesis": "HYP-018-b"}, "metrics": {"artifact_size_bytes": 8379248, "wall_time_ms": 242.0, "steps": 780, "early_stopped": true, "hypothesis": "HYP-018-b", "estimated_params": 13175808}, "timestamp": 1773905275.706452, "seed": 42}
{"experiment": "pgolf", "commit": "", "status": "keep", "val_bpb": 1.9764, "val_loss": 3.2982, "train_loss": 3.2877, "param_count": 13185048, "total_flops": 0.0, "peak_memory_mb": 0.0, "wall_time_s": 728.1418437957764, "description": "3 unique, dim=768 (shared+wider, ~13.2M params)", "config": {"env_overrides": {"ITERATIONS": "5000", "UNIQUE_BLOCKS": "3", "MODEL_DIM": "768", "NUM_HEADS": "8", "NUM_KV_HEADS": "4"}, "description": "3 unique, dim=768 (shared+wider, ~13.2M params)", "hypothesis": "HYP-018-b"}, "metrics": {"artifact_size_bytes": 8385283, "wall_time_ms": 238.0, "steps": 780, "early_stopped": true, "hypothesis": "HYP-018-b", "estimated_params": 13175808}, "timestamp": 1773906019.665313, "seed": 42}
{"experiment": "pgolf", "commit": "", "status": "keep", "val_bpb": 1.9611, "val_loss": 3.2728, "train_loss": 3.8741, "param_count": 15006760, "total_flops": 0.0, "peak_memory_mb": 0.0, "wall_time_s": 674.5322046279907, "description": "5 unique, dim=640 (moderate sharing+wider, ~12.5M)", "config": {"env_overrides": {"ITERATIONS": "5000", "UNIQUE_BLOCKS": "5", "MODEL_DIM": "640", "NUM_HEADS": "8", "NUM_KV_HEADS": "4"}, "description": "5 unique, dim=640 (moderate sharing+wider, ~12.5M)", "hypothesis": "HYP-018-b"}, "metrics": {"artifact_size_bytes": 10167921, "wall_time_ms": 197.0, "steps": 900, "early_stopped": true, "hypothesis": "HYP-018-b", "estimated_params": 14993920}, "timestamp": 1773906799.600657, "seed": 42}
{"experiment": "pgolf", "commit": "", "status": "keep", "val_bpb": 1.9751, "val_loss": 3.296, "train_loss": 3.2388, "param_count": 6038552, "total_flops": 0.0, "peak_memory_mb": 0.0, "wall_time_s": 668.1496829986572, "description": "3 blocks \u00d7 4 loops = 12 layers", "config": {"env_overrides": {"ITERATIONS": "5000", "UNIQUE_BLOCKS": "3", "NUM_LAYERS": "12"}, "description": "3 blocks \u00d7 4 loops = 12 layers", "hypothesis": "HYP-019-a"}, "metrics": {"artifact_size_bytes": 4400250, "wall_time_ms": 190.0, "steps": 1009, "early_stopped": true, "hypothesis": "HYP-019-a", "estimated_params": 6032384}, "timestamp": 1773907682.075962, "seed": 42}
{"experiment": "pgolf", "commit": "", "status": "keep", "val_bpb": 1.9985, "val_loss": 3.3352, "train_loss": 3.8384, "param_count": 6039064, "total_flops": 0.0, "peak_memory_mb": 0.0, "wall_time_s": 684.8496098518372, "description": "3 blocks \u00d7 5 loops = 15 layers", "config": {"env_overrides": {"ITERATIONS": "5000", "UNIQUE_BLOCKS": "3", "NUM_LAYERS": "15"}, "description": "3 blocks \u00d7 5 loops = 15 layers", "hypothesis": "HYP-019-a"}, "metrics": {"artifact_size_bytes": 4166110, "wall_time_ms": 244.0, "steps": 824, "early_stopped": true, "hypothesis": "HYP-019-a", "estimated_params": 6032896}, "timestamp": 1773908392.022378, "seed": 42}
{"experiment": "pgolf", "commit": "", "status": "keep", "val_bpb": 1.8998, "val_loss": 3.1705, "train_loss": 3.1894, "param_count": 6037528, "total_flops": 0.0, "peak_memory_mb": 0.0, "wall_time_s": 651.8227090835571, "description": "3\u00d73=9 layers + warmdown=3000 (schedule combo)", "config": {"env_overrides": {"ITERATIONS": "5000", "UNIQUE_BLOCKS": "3", "WARMDOWN_ITERS": "3000"}, "description": "3\u00d73=9 layers + warmdown=3000 (schedule combo)", "hypothesis": "HYP-019-c"}, "metrics": {"artifact_size_bytes": 4132925, "wall_time_ms": 143.0, "steps": 1313, "early_stopped": true, "hypothesis": "HYP-019-c", "estimated_params": 6031360}, "timestamp": 1773909062.2467682, "seed": 42}
{"experiment": "pgolf", "commit": "", "status": "keep", "val_bpb": 1.9447, "val_loss": 3.2454, "train_loss": 3.1904, "param_count": 6038552, "total_flops": 0.0, "peak_memory_mb": 0.0, "wall_time_s": 668.3742599487305, "description": "3\u00d74=12 layers + warmdown=3000 (combined best)", "config": {"env_overrides": {"ITERATIONS": "5000", "UNIQUE_BLOCKS": "3", "NUM_LAYERS": "12", "WARMDOWN_ITERS": "3000"}, "description": "3\u00d74=12 layers + warmdown=3000 (combined best)", "hypothesis": "HYP-019-combined"}, "metrics": {"artifact_size_bytes": 3819741, "wall_time_ms": 191.0, "steps": 1010, "early_stopped": true, "hypothesis": "HYP-019-combined", "estimated_params": 6032384}, "timestamp": 1773909767.266094, "seed": 42}
{"experiment": "pgolf", "commit": "", "status": "keep", "val_bpb": 1.9571, "val_loss": 3.266, "train_loss": 3.2969, "param_count": 4200464, "total_flops": 0.0, "peak_memory_mb": 0.0, "wall_time_s": 651.4316918849945, "description": "2 unique blocks \u00d7 4.5 loops = 9 layers", "config": {"env_overrides": {"ITERATIONS": "5000", "UNIQUE_BLOCKS": "2"}, "description": "2 unique blocks \u00d7 4.5 loops = 9 layers", "hypothesis": "HYP-019b-sharing"}, "metrics": {"artifact_size_bytes": 3346832, "wall_time_ms": 142.0, "steps": 1345, "early_stopped": true, "hypothesis": "HYP-019b-sharing", "estimated_params": 4196352}, "timestamp": 1773910482.761726, "seed": 42}
{"experiment": "pgolf", "commit": "", "status": "keep", "val_bpb": 2.0046, "val_loss": 3.3454, "train_loss": 3.388, "param_count": 2363400, "total_flops": 0.0, "peak_memory_mb": 0.0, "wall_time_s": 651.684250831604, "description": "1 unique block \u00d7 9 loops = 9 layers", "config": {"env_overrides": {"ITERATIONS": "5000", "UNIQUE_BLOCKS": "1"}, "description": "1 unique block \u00d7 9 loops = 9 layers", "hypothesis": "HYP-019b-sharing"}, "metrics": {"artifact_size_bytes": 1936664, "wall_time_ms": 144.0, "steps": 1385, "early_stopped": true, "hypothesis": "HYP-019b-sharing", "estimated_params": 2361344}, "timestamp": 1773911140.6103418, "seed": 42}
{"experiment": "pgolf", "commit": "", "status": "keep", "val_bpb": 1.8528, "val_loss": 3.092, "train_loss": 3.1033, "param_count": 6037528, "total_flops": 0.0, "peak_memory_mb": 0.0, "wall_time_s": 651.8801348209381, "description": "3\u00d73=9 layers + warmdown=5000 (best local schedule)", "config": {"env_overrides": {"ITERATIONS": "5000", "UNIQUE_BLOCKS": "3", "WARMDOWN_ITERS": "5000"}, "description": "3\u00d73=9 layers + warmdown=5000 (best local schedule)", "hypothesis": "HYP-019b-schedule"}, "metrics": {"artifact_size_bytes": 3779908, "wall_time_ms": 143.0, "steps": 1313, "early_stopped": true, "hypothesis": "HYP-019b-schedule", "estimated_params": 6031360}, "timestamp": 1773911801.8975842, "seed": 42}
{"experiment": "pgolf", "commit": "", "status": "keep", "val_bpb": 1.9224, "val_loss": 3.2082, "train_loss": 3.2484, "param_count": 4200464, "total_flops": 0.0, "peak_memory_mb": 0.0, "wall_time_s": 651.7467708587646, "description": "2 blocks + warmdown=3000", "config": {"env_overrides": {"ITERATIONS": "5000", "UNIQUE_BLOCKS": "2", "WARMDOWN_ITERS": "3000"}, "description": "2 blocks + warmdown=3000", "hypothesis": "HYP-019b-combined"}, "metrics": {"artifact_size_bytes": 2937202, "wall_time_ms": 143.0, "steps": 1347, "early_stopped": true, "hypothesis": "HYP-019b-combined", "estimated_params": 4196352}, "timestamp": 1773912463.682914, "seed": 42}
{"experiment": "pgolf", "commit": "", "status": "keep", "val_bpb": 1.9616, "val_loss": 3.2736, "train_loss": 3.3074, "param_count": 2363400, "total_flops": 0.0, "peak_memory_mb": 0.0, "wall_time_s": 651.2542881965637, "description": "1 block + warmdown=3000 (extreme sharing+schedule)", "config": {"env_overrides": {"ITERATIONS": "5000", "UNIQUE_BLOCKS": "1", "WARMDOWN_ITERS": "3000"}, "description": "1 block + warmdown=3000 (extreme sharing+schedule)", "hypothesis": "HYP-019b-combined"}, "metrics": {"artifact_size_bytes": 1721139, "wall_time_ms": 144.0, "steps": 1385, "early_stopped": true, "hypothesis": "HYP-019b-combined", "estimated_params": 2361344}, "timestamp": 1773913120.709205, "seed": 42}
{"experiment": "pgolf", "commit": "", "status": "keep", "val_bpb": 1.8436, "val_loss": 3.0767, "train_loss": 3.0957, "param_count": 6037528, "total_flops": 0.0, "peak_memory_mb": 0.0, "wall_time_s": 652.0543780326843, "description": "3u + wd=5000 + lr=0.03 (triple combo)", "config": {"env_overrides": {"ITERATIONS": "5000", "UNIQUE_BLOCKS": "3", "WARMDOWN_ITERS": "5000", "MATRIX_LR": "0.03", "SCALAR_LR": "0.03", "TIED_EMBED_LR": "0.04"}, "description": "3u + wd=5000 + lr=0.03 (triple combo)", "hypothesis": "HYP-019c-triple"}, "metrics": {"artifact_size_bytes": 3559077, "wall_time_ms": 144.0, "steps": 1312, "early_stopped": true, "hypothesis": "HYP-019c-triple", "estimated_params": 6031360}, "timestamp": 1773913831.312466, "seed": 42}
