{"experiment": "pgolf", "commit": "", "status": "keep", "val_bpb": 1.7638, "val_loss": 2.9434, "train_loss": 2.8651, "param_count": 6823436, "total_flops": 0.0, "peak_memory_mb": 0.0, "wall_time_s": 637.6741321086884, "description": "Optuna trial 6: mom=0.985 lr=0.0742/0.0160 wd=3000 qk=1.22 sc=45.3", "config": {"env_overrides": {"UNIQUE_BLOCKS": "3", "NUM_HEADS": "4", "NUM_KV_HEADS": "4", "NUM_LAYERS": "6", "ITERATIONS": "5000", "MUON_MOMENTUM": "0.9851983210539754", "MATRIX_LR": "0.07419992481030326", "SCALAR_LR": "0.016027666712497557", "WARMDOWN_ITERS": "3000", "QK_GAIN_INIT": "1.2168098926898527", "LOGIT_SOFTCAP": "45.34613258901551"}, "description": "Optuna trial 6: mom=0.985 lr=0.0742/0.0160 wd=3000 qk=1.22 sc=45.3", "hypothesis": "HYP-025-optuna-t6"}, "metrics": {"artifact_size_bytes": 6203279, "wall_time_ms": 93.0, "steps": 2011, "early_stopped": true, "hypothesis": "HYP-025-optuna-t6", "estimated_params": 6817280}, "timestamp": 1773936043.057877, "seed": 42}
{"experiment": "pgolf", "commit": "", "status": "keep", "val_bpb": 1.7791, "val_loss": 2.969, "train_loss": 2.952, "param_count": 6823436, "total_flops": 0.0, "peak_memory_mb": 0.0, "wall_time_s": 637.6455428600311, "description": "Optuna trial 7: mom=0.948 lr=0.0703/0.0105 wd=2500 qk=1.52 sc=37.9", "config": {"env_overrides": {"UNIQUE_BLOCKS": "3", "NUM_HEADS": "4", "NUM_KV_HEADS": "4", "NUM_LAYERS": "6", "ITERATIONS": "5000", "MUON_MOMENTUM": "0.9477066179444611", "MATRIX_LR": "0.07027972195244767", "SCALAR_LR": "0.01045081426968969", "WARMDOWN_ITERS": "2500", "QK_GAIN_INIT": "1.5205690876920168", "LOGIT_SOFTCAP": "37.93932384642665"}, "description": "Optuna trial 7: mom=0.948 lr=0.0703/0.0105 wd=2500 qk=1.52 sc=37.9", "hypothesis": "HYP-025-optuna-t7"}, "metrics": {"artifact_size_bytes": 5910712, "wall_time_ms": 92.0, "steps": 2009, "early_stopped": true, "hypothesis": "HYP-025-optuna-t7", "estimated_params": 6817280}, "timestamp": 1773936680.717443, "seed": 42}
{"experiment": "pgolf", "commit": "", "status": "keep", "val_bpb": 2.411, "val_loss": 4.0235, "train_loss": 3.9103, "param_count": 8396300, "total_flops": 0.0, "peak_memory_mb": 0.0, "wall_time_s": 108.11534905433655, "description": "6L+3u+4h + MLP 3x (wider MLP, competition top tech)", "config": {"env_overrides": {"ITERATIONS": "5000", "UNIQUE_BLOCKS": "3", "NUM_HEADS": "4", "NUM_KV_HEADS": "4", "NUM_LAYERS": "6", "MLP_MULT": "3"}, "description": "6L+3u+4h + MLP 3x (wider MLP, competition top tech)", "hypothesis": "HYP-026-mlp3x"}, "metrics": {"artifact_size_bytes": 5584016, "wall_time_ms": 103.0, "steps": 200, "hypothesis": "HYP-026-mlp3x", "estimated_params": 8390144}, "timestamp": 1773936885.604198, "seed": 42}
{"experiment": "pgolf", "commit": "", "status": "keep", "val_bpb": 1.7658, "val_loss": 2.9468, "train_loss": 2.9298, "param_count": 8396300, "total_flops": 0.0, "peak_memory_mb": 0.0, "wall_time_s": 643.2729940414429, "description": "6L+3u+4h + MLP 3x (wider MLP, competition top tech)", "config": {"env_overrides": {"ITERATIONS": "5000", "UNIQUE_BLOCKS": "3", "NUM_HEADS": "4", "NUM_KV_HEADS": "4", "NUM_LAYERS": "6", "MLP_MULT": "3"}, "description": "6L+3u+4h + MLP 3x (wider MLP, competition top tech)", "hypothesis": "HYP-026-mlp3x"}, "metrics": {"artifact_size_bytes": 7024933, "wall_time_ms": 105.0, "steps": 1826, "early_stopped": true, "hypothesis": "HYP-026-mlp3x", "estimated_params": 8390144}, "timestamp": 1773937535.776221, "seed": 42}
{"experiment": "pgolf", "commit": "", "status": "keep", "val_bpb": 1.7489, "val_loss": 2.9187, "train_loss": 2.8359, "param_count": 6823436, "total_flops": 0.0, "peak_memory_mb": 0.0, "wall_time_s": 637.8870747089386, "description": "6L+3u+4h + high softcap=50 (Optuna signal)", "config": {"env_overrides": {"ITERATIONS": "5000", "UNIQUE_BLOCKS": "3", "NUM_HEADS": "4", "NUM_KV_HEADS": "4", "NUM_LAYERS": "6", "LOGIT_SOFTCAP": "50.0"}, "description": "6L+3u+4h + high softcap=50 (Optuna signal)", "hypothesis": "HYP-026-softcap50"}, "metrics": {"artifact_size_bytes": 5913471, "wall_time_ms": 96.0, "steps": 2009, "early_stopped": true, "hypothesis": "HYP-026-softcap50", "estimated_params": 6817280}, "timestamp": 1773938180.009208, "seed": 42}
{"experiment": "pgolf", "commit": "", "status": "keep", "val_bpb": 1.8632, "val_loss": 3.1094, "train_loss": 3.1249, "param_count": 6823436, "total_flops": 0.0, "peak_memory_mb": 0.0, "wall_time_s": 637.5360083580017, "description": "6L+3u+4h + momentum=0.99 (competition consensus)", "config": {"env_overrides": {"ITERATIONS": "5000", "UNIQUE_BLOCKS": "3", "NUM_HEADS": "4", "NUM_KV_HEADS": "4", "NUM_LAYERS": "6", "MUON_MOMENTUM": "0.99"}, "description": "6L+3u+4h + momentum=0.99 (competition consensus)", "hypothesis": "HYP-026-mom99"}, "metrics": {"artifact_size_bytes": 6220256, "wall_time_ms": 94.0, "steps": 2011, "early_stopped": true, "hypothesis": "HYP-026-mom99", "estimated_params": 6817280}, "timestamp": 1773938824.290224, "seed": 42}
{"experiment": "pgolf", "commit": "", "status": "keep", "val_bpb": 1.7046, "val_loss": 2.8447, "train_loss": 2.7593, "param_count": 6823436, "total_flops": 0.0, "peak_memory_mb": 0.0, "wall_time_s": 737.5897960662842, "description": "6L+3u+4h + sliding window eval stride=256", "config": {"env_overrides": {"ITERATIONS": "5000", "UNIQUE_BLOCKS": "3", "NUM_HEADS": "4", "NUM_KV_HEADS": "4", "NUM_LAYERS": "6", "EVAL_STRIDE": "256"}, "description": "6L+3u+4h + sliding window eval stride=256", "hypothesis": "HYP-027-stride256"}, "metrics": {"artifact_size_bytes": 5901815, "wall_time_ms": 95.0, "steps": 2012, "early_stopped": true, "hypothesis": "HYP-027-stride256", "estimated_params": 6817280}, "timestamp": 1773942017.8075671, "seed": 42}
{"experiment": "pgolf", "commit": "", "status": "keep", "val_bpb": 1.7161, "val_loss": 2.864, "train_loss": 2.8315, "param_count": 6823436, "total_flops": 0.0, "peak_memory_mb": 0.0, "wall_time_s": 867.0831451416016, "description": "6L+3u+4h + sliding window eval stride=128", "config": {"env_overrides": {"ITERATIONS": "5000", "UNIQUE_BLOCKS": "3", "NUM_HEADS": "4", "NUM_KV_HEADS": "4", "NUM_LAYERS": "6", "EVAL_STRIDE": "128"}, "description": "6L+3u+4h + sliding window eval stride=128", "hypothesis": "HYP-027-stride128"}, "metrics": {"artifact_size_bytes": 5912295, "wall_time_ms": 88.0, "steps": 2012, "early_stopped": true, "hypothesis": "HYP-027-stride128", "estimated_params": 6817280}, "timestamp": 1773943043.350816, "seed": 42}
{"experiment": "pgolf", "commit": "", "status": "keep", "val_bpb": 1.7008, "val_loss": 2.8384, "train_loss": 2.7649, "param_count": 6823436, "total_flops": 0.0, "peak_memory_mb": 0.0, "wall_time_s": 1126.3721520900726, "description": "6L+3u+4h + sliding window eval stride=64", "config": {"env_overrides": {"ITERATIONS": "5000", "UNIQUE_BLOCKS": "3", "NUM_HEADS": "4", "NUM_KV_HEADS": "4", "NUM_LAYERS": "6", "EVAL_STRIDE": "64"}, "description": "6L+3u+4h + sliding window eval stride=64", "hypothesis": "HYP-027-stride64"}, "metrics": {"artifact_size_bytes": 5899381, "wall_time_ms": 88.0, "steps": 2013, "early_stopped": true, "hypothesis": "HYP-027-stride64", "estimated_params": 6817280}, "timestamp": 1773944175.61377, "seed": 42}
{"experiment": "pgolf", "commit": "", "status": "keep", "val_bpb": 2.3781, "val_loss": 3.9687, "train_loss": 3.832, "param_count": 6823948, "total_flops": 0.0, "peak_memory_mb": 0.0, "wall_time_s": 191.68758511543274, "description": "HYP-039 baseline (6L+3u+4h+stride256+normuon, no XSA)", "config": {"env_overrides": {"UNIQUE_BLOCKS": "3", "NUM_HEADS": "4", "NUM_KV_HEADS": "4", "NUM_LAYERS": "6", "EVAL_STRIDE": "256", "NORMUON": "1"}, "description": "HYP-039 baseline (6L+3u+4h+stride256+normuon, no XSA)", "hypothesis": "HYP-039-baseline"}, "metrics": {"artifact_size_bytes": 4656979, "wall_time_ms": 303.0, "steps": 200, "hypothesis": "HYP-039-baseline", "estimated_params": 6817280}, "timestamp": 1774063765.1843588, "seed": 42}
{"experiment": "pgolf", "commit": "", "status": "keep", "val_bpb": 2.3812, "val_loss": 3.9739, "train_loss": 3.8353, "param_count": 6823948, "total_flops": 0.0, "peak_memory_mb": 0.0, "wall_time_s": 191.40772891044617, "description": "HYP-039 baseline (6L+3u+4h+stride256+normuon, no XSA)", "config": {"env_overrides": {"UNIQUE_BLOCKS": "3", "NUM_HEADS": "4", "NUM_KV_HEADS": "4", "NUM_LAYERS": "6", "EVAL_STRIDE": "256", "NORMUON": "1"}, "description": "HYP-039 baseline (6L+3u+4h+stride256+normuon, no XSA)", "hypothesis": "HYP-039-baseline"}, "metrics": {"artifact_size_bytes": 4658667, "wall_time_ms": 301.0, "steps": 200, "hypothesis": "HYP-039-baseline", "estimated_params": 6817280}, "timestamp": 1774063962.547418, "seed": 42}
{"experiment": "pgolf", "commit": "", "status": "keep", "val_bpb": 1.7484, "val_loss": 2.9179, "train_loss": 2.9413, "param_count": 6823948, "total_flops": 0.0, "peak_memory_mb": 0.0, "wall_time_s": 732.0245072841644, "description": "HYP-039 baseline (6L+3u+4h+stride256+normuon, no XSA)", "config": {"env_overrides": {"UNIQUE_BLOCKS": "3", "NUM_HEADS": "4", "NUM_KV_HEADS": "4", "NUM_LAYERS": "6", "EVAL_STRIDE": "256", "NORMUON": "1"}, "description": "HYP-039 baseline (6L+3u+4h+stride256+normuon, no XSA)", "hypothesis": "HYP-039-baseline"}, "metrics": {"artifact_size_bytes": 5986691, "wall_time_ms": 303.0, "steps": 2018, "early_stopped": true, "hypothesis": "HYP-039-baseline", "estimated_params": 6817280}, "timestamp": 1774064712.038995, "seed": 42}
{"experiment": "pgolf", "commit": "", "status": "crash", "val_bpb": Infinity, "val_loss": Infinity, "train_loss": 0.0, "param_count": 6817280, "total_flops": 0.0, "peak_memory_mb": 0.0, "wall_time_s": 0.2105119228363037, "description": "XSA: Exclusive Self Attention (arXiv 2603.09078), all layers", "config": {"env_overrides": {"UNIQUE_BLOCKS": "3", "NUM_HEADS": "4", "NUM_KV_HEADS": "4", "NUM_LAYERS": "6", "EVAL_STRIDE": "256", "NORMUON": "1", "XSA": "1"}, "description": "XSA: Exclusive Self Attention (arXiv 2603.09078), all layers", "hypothesis": "HYP-039-xsa"}, "metrics": {"artifact_size_bytes": 0, "error": "_map[i]](x, x0, v_resid=v_resid)\n  File \"/Users/michaelellis/Projects/parameter-golf/train_gpt_mlx.py\", line 605, in __call__\n    attn_out = self.attn(self.attn_norm(x), v_resid=v_resid)\n  File \"/Users/michaelellis/Projects/parameter-golf/train_gpt_mlx.py\", line 432, in __call__\n    v_norm = mx.sqrt(mx.sum(v_xsa * v_xsa, axis=-1, keepdims=True).clip(min=1e-12))\n                     ^^^^^^^^^^^^^^^^^^^^^^^^^^^^^^^^^^^^^^^^^^^^^^^^^^\nAttributeError: 'mlx.core.array' object has no attribute 'clip'\n", "hypothesis": "HYP-039-xsa"}, "timestamp": 1774064719.248802, "seed": 42}
{"experiment": "pgolf", "commit": "", "status": "keep", "val_bpb": 1.7401, "val_loss": 2.904, "train_loss": 2.9187, "param_count": 6823948, "total_flops": 0.0, "peak_memory_mb": 0.0, "wall_time_s": 745.0075469017029, "description": "XSA: Exclusive Self Attention (arXiv 2603.09078), all layers", "config": {"env_overrides": {"UNIQUE_BLOCKS": "3", "NUM_HEADS": "4", "NUM_KV_HEADS": "4", "NUM_LAYERS": "6", "EVAL_STRIDE": "256", "NORMUON": "1", "XSA": "1"}, "description": "XSA: Exclusive Self Attention (arXiv 2603.09078), all layers", "hypothesis": "HYP-039-xsa"}, "metrics": {"artifact_size_bytes": 5932338, "wall_time_ms": 317.0, "steps": 1929, "early_stopped": true, "hypothesis": "HYP-039-xsa", "estimated_params": 6817280}, "timestamp": 1774065478.813539, "seed": 42}
{"experiment": "pgolf", "commit": "", "status": "keep", "val_bpb": 1.6758, "val_loss": 2.7966, "train_loss": 2.8447, "param_count": 6823951, "total_flops": 0.0, "peak_memory_mb": 0.0, "wall_time_s": 748.8522217273712, "description": "XSA + Value Residual (test interaction)", "config": {"env_overrides": {"UNIQUE_BLOCKS": "3", "NUM_HEADS": "4", "NUM_KV_HEADS": "4", "NUM_LAYERS": "6", "EVAL_STRIDE": "256", "NORMUON": "1", "XSA": "1", "VALUE_RESID": "1"}, "description": "XSA + Value Residual (test interaction)", "hypothesis": "HYP-039-xsa-vr"}, "metrics": {"artifact_size_bytes": 5921305, "wall_time_ms": 325.0, "steps": 1902, "early_stopped": true, "hypothesis": "HYP-039-xsa-vr", "estimated_params": 6817280}, "timestamp": 1774066236.8670132, "seed": 42}
{"experiment": "pgolf", "commit": "", "status": "keep", "val_bpb": 1.6758, "val_loss": 2.7967, "train_loss": 2.831, "param_count": 6823972, "total_flops": 0.0, "peak_memory_mb": 0.0, "wall_time_s": 757.9257380962372, "description": "XSA + DWA + Value Residual (triple combo test)", "config": {"env_overrides": {"UNIQUE_BLOCKS": "3", "NUM_HEADS": "4", "NUM_KV_HEADS": "4", "NUM_LAYERS": "6", "EVAL_STRIDE": "256", "NORMUON": "1", "XSA": "1", "DENSE_DWA": "1", "VALUE_RESID": "1"}, "description": "XSA + DWA + Value Residual (triple combo test)", "hypothesis": "HYP-039-xsa-dwa-vr"}, "metrics": {"artifact_size_bytes": 5871717, "wall_time_ms": 329.0, "steps": 1858, "early_stopped": true, "hypothesis": "HYP-039-xsa-dwa-vr", "estimated_params": 6817280}, "timestamp": 1774067153.527689, "seed": 42}
{"experiment": "pgolf", "commit": "", "status": "keep", "val_bpb": 2.3926, "val_loss": 3.9929, "train_loss": 3.8684, "param_count": 6823951, "total_flops": 0.0, "peak_memory_mb": 0.0, "wall_time_s": 211.4489130973816, "description": "Partial XSA: last 3 of 6 layers only + VR", "config": {"env_overrides": {"UNIQUE_BLOCKS": "3", "NUM_HEADS": "4", "NUM_KV_HEADS": "4", "NUM_LAYERS": "6", "EVAL_STRIDE": "256", "NORMUON": "1", "XSA": "1", "VALUE_RESID": "1", "XSA_START_LAYER": "3"}, "description": "Partial XSA: last 3 of 6 layers only + VR", "hypothesis": "HYP-040-last3"}, "metrics": {"artifact_size_bytes": 4699253, "wall_time_ms": 328.0, "steps": 200, "hypothesis": "HYP-040-last3", "estimated_params": 6817280}, "timestamp": 1774067716.29513, "seed": 42}
{"experiment": "pgolf", "commit": "", "status": "keep", "val_bpb": 1.6753, "val_loss": 2.7957, "train_loss": 2.8467, "param_count": 6823951, "total_flops": 0.0, "peak_memory_mb": 0.0, "wall_time_s": 748.7964313030243, "description": "Partial XSA: last 3 of 6 layers only + VR", "config": {"env_overrides": {"UNIQUE_BLOCKS": "3", "NUM_HEADS": "4", "NUM_KV_HEADS": "4", "NUM_LAYERS": "6", "EVAL_STRIDE": "256", "NORMUON": "1", "XSA": "1", "VALUE_RESID": "1", "XSA_START_LAYER": "3"}, "description": "Partial XSA: last 3 of 6 layers only + VR", "hypothesis": "HYP-040-last3"}, "metrics": {"artifact_size_bytes": 5912010, "wall_time_ms": 323.0, "steps": 1895, "early_stopped": true, "hypothesis": "HYP-040-last3", "estimated_params": 6817280}, "timestamp": 1774068470.371062, "seed": 42}
{"experiment": "pgolf", "commit": "", "status": "keep", "val_bpb": 1.6738, "val_loss": 2.7933, "train_loss": 2.8387, "param_count": 6823951, "total_flops": 0.0, "peak_memory_mb": 0.0, "wall_time_s": 748.9107630252838, "description": "Partial XSA: last 2 of 6 layers only + VR", "config": {"env_overrides": {"UNIQUE_BLOCKS": "3", "NUM_HEADS": "4", "NUM_KV_HEADS": "4", "NUM_LAYERS": "6", "EVAL_STRIDE": "256", "NORMUON": "1", "XSA": "1", "VALUE_RESID": "1", "XSA_START_LAYER": "4"}, "description": "Partial XSA: last 2 of 6 layers only + VR", "hypothesis": "HYP-040-last2"}, "metrics": {"artifact_size_bytes": 5912498, "wall_time_ms": 329.0, "steps": 1895, "early_stopped": true, "hypothesis": "HYP-040-last2", "estimated_params": 6817280}, "timestamp": 1774069225.582325, "seed": 42}
{"experiment": "pgolf", "commit": "", "status": "keep", "val_bpb": 1.6754, "val_loss": 2.796, "train_loss": 2.8502, "param_count": 6823951, "total_flops": 0.0, "peak_memory_mb": 0.0, "wall_time_s": 748.8099362850189, "description": "Partial XSA: last 1 of 6 layers only + VR", "config": {"env_overrides": {"UNIQUE_BLOCKS": "3", "NUM_HEADS": "4", "NUM_KV_HEADS": "4", "NUM_LAYERS": "6", "EVAL_STRIDE": "256", "NORMUON": "1", "XSA": "1", "VALUE_RESID": "1", "XSA_START_LAYER": "5"}, "description": "Partial XSA: last 1 of 6 layers only + VR", "hypothesis": "HYP-040-last1"}, "metrics": {"artifact_size_bytes": 5922477, "wall_time_ms": 319.0, "steps": 1898, "early_stopped": true, "hypothesis": "HYP-040-last1", "estimated_params": 6817280}, "timestamp": 1774070049.859468, "seed": 42}
{"experiment": "pgolf", "commit": "", "status": "keep", "val_bpb": 2.3933, "val_loss": 3.9941, "train_loss": 3.8676, "param_count": 6823951, "total_flops": 0.0, "peak_memory_mb": 0.0, "wall_time_s": 211.64046788215637, "description": "FP16 embeddings (skip int8 quant on tok_emb)", "config": {"env_overrides": {"UNIQUE_BLOCKS": "3", "NUM_HEADS": "4", "NUM_KV_HEADS": "4", "NUM_LAYERS": "6", "EVAL_STRIDE": "256", "NORMUON": "1", "XSA": "1", "XSA_START_LAYER": "4", "VALUE_RESID": "1", "FP16_EMBED": "1"}, "description": "FP16 embeddings (skip int8 quant on tok_emb)", "hypothesis": "HYP-041-fp16embed"}, "metrics": {"artifact_size_bytes": 5024177, "wall_time_ms": 349.0, "steps": 200, "hypothesis": "HYP-041-fp16embed", "estimated_params": 6817280}, "timestamp": 1774070671.3074381, "seed": 42}
{"experiment": "pgolf", "commit": "", "status": "keep", "val_bpb": 1.673, "val_loss": 2.792, "train_loss": 2.8473, "param_count": 6823951, "total_flops": 0.0, "peak_memory_mb": 0.0, "wall_time_s": 748.9578378200531, "description": "FP16 embeddings (skip int8 quant on tok_emb)", "config": {"env_overrides": {"UNIQUE_BLOCKS": "3", "NUM_HEADS": "4", "NUM_KV_HEADS": "4", "NUM_LAYERS": "6", "EVAL_STRIDE": "256", "NORMUON": "1", "XSA": "1", "XSA_START_LAYER": "4", "VALUE_RESID": "1", "FP16_EMBED": "1"}, "description": "FP16 embeddings (skip int8 quant on tok_emb)", "hypothesis": "HYP-041-fp16embed"}, "metrics": {"artifact_size_bytes": 6241937, "wall_time_ms": 317.0, "steps": 1899, "early_stopped": true, "hypothesis": "HYP-041-fp16embed", "estimated_params": 6817280}, "timestamp": 1774071427.9327538, "seed": 42}
{"experiment": "pgolf", "commit": "", "status": "keep", "val_bpb": 1.7281, "val_loss": 2.884, "train_loss": 3.5405, "param_count": 6823951, "total_flops": 0.0, "peak_memory_mb": 0.0, "wall_time_s": 749.2165441513062, "description": "Label smoothing 0.1 (reduce overconfidence)", "config": {"env_overrides": {"UNIQUE_BLOCKS": "3", "NUM_HEADS": "4", "NUM_KV_HEADS": "4", "NUM_LAYERS": "6", "EVAL_STRIDE": "256", "NORMUON": "1", "XSA": "1", "XSA_START_LAYER": "4", "VALUE_RESID": "1", "LABEL_SMOOTH": "0.1"}, "description": "Label smoothing 0.1 (reduce overconfidence)", "hypothesis": "HYP-041-labelsmooth"}, "metrics": {"artifact_size_bytes": 5892289, "wall_time_ms": 324.0, "steps": 1887, "early_stopped": true, "hypothesis": "HYP-041-labelsmooth", "estimated_params": 6817280}, "timestamp": 1774072184.734431, "seed": 42}
{"experiment": "pgolf", "commit": "", "status": "keep", "val_bpb": 1.6711, "val_loss": 2.7887, "train_loss": 2.8898, "param_count": 6823951, "total_flops": 0.0, "peak_memory_mb": 0.0, "wall_time_s": 748.9804561138153, "description": "Z-loss 1e-4 (PaLM-style logit stabilization)", "config": {"env_overrides": {"UNIQUE_BLOCKS": "3", "NUM_HEADS": "4", "NUM_KV_HEADS": "4", "NUM_LAYERS": "6", "EVAL_STRIDE": "256", "NORMUON": "1", "XSA": "1", "XSA_START_LAYER": "4", "VALUE_RESID": "1", "Z_LOSS": "1e-4"}, "description": "Z-loss 1e-4 (PaLM-style logit stabilization)", "hypothesis": "HYP-041-zloss"}, "metrics": {"artifact_size_bytes": 5909282, "wall_time_ms": 318.0, "steps": 1897, "early_stopped": true, "hypothesis": "HYP-041-zloss", "estimated_params": 6817280}, "timestamp": 1774072941.628802, "seed": 42}
{"experiment": "pgolf", "commit": "", "status": "keep", "val_bpb": 1.6679, "val_loss": 2.7835, "train_loss": 2.8941, "param_count": 6823951, "total_flops": 0.0, "peak_memory_mb": 0.0, "wall_time_s": 748.7208178043365, "description": "FP16 embed + z-loss (best combo test)", "config": {"env_overrides": {"UNIQUE_BLOCKS": "3", "NUM_HEADS": "4", "NUM_KV_HEADS": "4", "NUM_LAYERS": "6", "EVAL_STRIDE": "256", "NORMUON": "1", "XSA": "1", "XSA_START_LAYER": "4", "VALUE_RESID": "1", "FP16_EMBED": "1", "Z_LOSS": "1e-4"}, "description": "FP16 embed + z-loss (best combo test)", "hypothesis": "HYP-041-combined"}, "metrics": {"artifact_size_bytes": 6238553, "wall_time_ms": 317.0, "steps": 1900, "early_stopped": true, "hypothesis": "HYP-041-combined", "estimated_params": 6817280}, "timestamp": 1774073702.7536268, "seed": 42}
{"experiment": "pgolf", "commit": "", "status": "keep", "val_bpb": 1.6744, "val_loss": 2.7943, "train_loss": 2.8442, "param_count": 6823951, "total_flops": 0.0, "peak_memory_mb": 0.0, "wall_time_s": 748.8760352134705, "description": "Z-loss 1e-3 (10x stronger than 1e-4)", "config": {"env_overrides": {"UNIQUE_BLOCKS": "3", "NUM_HEADS": "4", "NUM_KV_HEADS": "4", "NUM_LAYERS": "6", "EVAL_STRIDE": "256", "NORMUON": "1", "XSA": "1", "XSA_START_LAYER": "4", "VALUE_RESID": "1", "FP16_EMBED": "1", "Z_LOSS": "1e-3"}, "description": "Z-loss 1e-3 (10x stronger than 1e-4)", "hypothesis": "HYP-042-zloss-1e3"}, "metrics": {"artifact_size_bytes": 6226967, "wall_time_ms": 317.0, "steps": 1899, "early_stopped": true, "hypothesis": "HYP-042-zloss-1e3", "estimated_params": 6817280}, "timestamp": 1774074547.702325, "seed": 42}
{"experiment": "pgolf", "commit": "", "status": "keep", "val_bpb": 1.6714, "val_loss": 2.7894, "train_loss": 2.8429, "param_count": 6823951, "total_flops": 0.0, "peak_memory_mb": 0.0, "wall_time_s": 748.8744330406189, "description": "Z-loss 1e-5 (10x weaker than 1e-4)", "config": {"env_overrides": {"UNIQUE_BLOCKS": "3", "NUM_HEADS": "4", "NUM_KV_HEADS": "4", "NUM_LAYERS": "6", "EVAL_STRIDE": "256", "NORMUON": "1", "XSA": "1", "XSA_START_LAYER": "4", "VALUE_RESID": "1", "FP16_EMBED": "1", "Z_LOSS": "1e-5"}, "description": "Z-loss 1e-5 (10x weaker than 1e-4)", "hypothesis": "HYP-042-zloss-1e5"}, "metrics": {"artifact_size_bytes": 6234981, "wall_time_ms": 318.0, "steps": 1896, "early_stopped": true, "hypothesis": "HYP-042-zloss-1e5", "estimated_params": 6817280}, "timestamp": 1774075302.260694, "seed": 42}
