{"experiment": "pgolf", "commit": "", "status": "crash", "val_bpb": Infinity, "val_loss": Infinity, "train_loss": 0.0, "param_count": 6817280, "total_flops": 0.0, "peak_memory_mb": 0.0, "wall_time_s": 0.20408296585083008, "description": "Stochastic depth p=0.1 (10% layer drop rate)", "config": {"env_overrides": {"UNIQUE_BLOCKS": "3", "NUM_HEADS": "4", "NUM_KV_HEADS": "4", "NUM_LAYERS": "6", "EVAL_STRIDE": "256", "NORMUON": "1", "XSA": "1", "XSA_START_LAYER": "4", "VALUE_RESID": "1", "FP16_EMBED": "1", "Z_LOSS": "1e-4", "LOGIT_SOFTCAP": "50.0", "STOCH_DEPTH": "0.1"}, "description": "Stochastic depth p=0.1 (10% layer drop rate)", "hypothesis": "HYP-053-sd01"}, "metrics": {"artifact_size_bytes": 0, "error": " x, y: model.loss(x, y)),\n                                          ~~~~~~~~~~^^^^^^\n  File \"/Users/michaelellis/Projects/parameter-golf/train_gpt_mlx.py\", line 963, in loss\n    x = self(input_ids).reshape(-1, self.tok_emb.weight.shape[1])\n        ~~~~^^^^^^^^^^^\n  File \"/Users/michaelellis/Projects/parameter-golf/train_gpt_mlx.py\", line 882, in __call__\n    if mx.random.uniform(()).item() < drop_prob:\n       ~~~~~~~~~~~~~~~~~^^^^\nValueError: Invalid type tuple received in array initialization.\n", "hypothesis": "HYP-053-sd01"}, "timestamp": 1774092683.604814, "seed": 42}
{"experiment": "pgolf", "commit": "", "status": "crash", "val_bpb": Infinity, "val_loss": Infinity, "train_loss": 0.0, "param_count": 6817280, "total_flops": 0.0, "peak_memory_mb": 0.0, "wall_time_s": 0.20057177543640137, "description": "Stochastic depth p=0.1 (10% layer drop rate)", "config": {"env_overrides": {"UNIQUE_BLOCKS": "3", "NUM_HEADS": "4", "NUM_KV_HEADS": "4", "NUM_LAYERS": "6", "EVAL_STRIDE": "256", "NORMUON": "1", "XSA": "1", "XSA_START_LAYER": "4", "VALUE_RESID": "1", "FP16_EMBED": "1", "Z_LOSS": "1e-4", "LOGIT_SOFTCAP": "50.0", "STOCH_DEPTH": "0.1"}, "description": "Stochastic depth p=0.1 (10% layer drop rate)", "hypothesis": "HYP-053-sd01"}, "metrics": {"artifact_size_bytes": 0, "error": " x, y: model.loss(x, y)),\n                                          ~~~~~~~~~~^^^^^^\n  File \"/Users/michaelellis/Projects/parameter-golf/train_gpt_mlx.py\", line 963, in loss\n    x = self(input_ids).reshape(-1, self.tok_emb.weight.shape[1])\n        ~~~~^^^^^^^^^^^\n  File \"/Users/michaelellis/Projects/parameter-golf/train_gpt_mlx.py\", line 882, in __call__\n    if mx.random.uniform(()).item() < drop_prob:\n       ~~~~~~~~~~~~~~~~~^^^^\nValueError: Invalid type tuple received in array initialization.\n", "hypothesis": "HYP-053-sd01"}, "timestamp": 1774092690.684382, "seed": 42}
{"experiment": "pgolf", "commit": "", "status": "keep", "val_bpb": 1.9743, "val_loss": 3.2948, "train_loss": 2.8587, "param_count": 6823951, "total_flops": 0.0, "peak_memory_mb": 0.0, "wall_time_s": 742.6806042194366, "description": "Stochastic depth p=0.1 (10% layer drop rate)", "config": {"env_overrides": {"UNIQUE_BLOCKS": "3", "NUM_HEADS": "4", "NUM_KV_HEADS": "4", "NUM_LAYERS": "6", "EVAL_STRIDE": "256", "NORMUON": "1", "XSA": "1", "XSA_START_LAYER": "4", "VALUE_RESID": "1", "FP16_EMBED": "1", "Z_LOSS": "1e-4", "LOGIT_SOFTCAP": "50.0", "STOCH_DEPTH": "0.1"}, "description": "Stochastic depth p=0.1 (10% layer drop rate)", "hypothesis": "HYP-053-sd01"}, "metrics": {"artifact_size_bytes": 6213587, "wall_time_ms": 322.0, "steps": 1895, "early_stopped": true, "hypothesis": "HYP-053-sd01", "estimated_params": 6817280}, "timestamp": 1774093447.4600909, "seed": 42}
{"experiment": "pgolf", "commit": "", "status": "keep", "val_bpb": 2.3565, "val_loss": 4.6424, "train_loss": 4.764, "param_count": 7348239, "total_flops": 0.0, "peak_memory_mb": 0.0, "wall_time_s": 220.27096700668335, "description": "sp2048 vocab with best config (BPB comparison vs sp1024)", "config": {"env_overrides": {"UNIQUE_BLOCKS": "3", "NUM_HEADS": "4", "NUM_KV_HEADS": "4", "NUM_LAYERS": "6", "EVAL_STRIDE": "256", "NORMUON": "1", "XSA": "1", "XSA_START_LAYER": "4", "VALUE_RESID": "1", "FP16_EMBED": "1", "Z_LOSS": "1e-4", "LOGIT_SOFTCAP": "50.0", "VOCAB_SIZE": "2048", "TOKENIZER_PATH": "./data/tokenizers/fineweb_2048_bpe.model", "DATA_PATH": "./data/datasets/fineweb10B_sp2048_local", "VAL_BATCH_SIZE": "65536"}, "description": "sp2048 vocab with best config (BPB comparison vs sp1024)", "hypothesis": "HYP-054-sp2048"}, "metrics": {"artifact_size_bytes": 5767420, "wall_time_ms": 329.0, "steps": 200, "hypothesis": "HYP-054-sp2048", "estimated_params": 7341568}, "timestamp": 1774112882.903018, "seed": 42}
{"experiment": "pgolf", "commit": "", "status": "keep", "val_bpb": 1.6344, "val_loss": 3.2199, "train_loss": 3.4828, "param_count": 7348239, "total_flops": 0.0, "peak_memory_mb": 0.0, "wall_time_s": 753.7852077484131, "description": "sp2048 vocab with best config (BPB comparison vs sp1024)", "config": {"env_overrides": {"UNIQUE_BLOCKS": "3", "NUM_HEADS": "4", "NUM_KV_HEADS": "4", "NUM_LAYERS": "6", "EVAL_STRIDE": "256", "NORMUON": "1", "XSA": "1", "XSA_START_LAYER": "4", "VALUE_RESID": "1", "FP16_EMBED": "1", "Z_LOSS": "1e-4", "LOGIT_SOFTCAP": "50.0", "VOCAB_SIZE": "2048", "TOKENIZER_PATH": "./data/tokenizers/fineweb_2048_bpe.model", "DATA_PATH": "./data/datasets/fineweb10B_sp2048_local", "VAL_BATCH_SIZE": "65536"}, "description": "sp2048 vocab with best config (BPB comparison vs sp1024)", "hypothesis": "HYP-054-sp2048"}, "metrics": {"artifact_size_bytes": 6959155, "wall_time_ms": 335.0, "steps": 1824, "early_stopped": true, "hypothesis": "HYP-054-sp2048", "estimated_params": 7341568}, "timestamp": 1774113648.321551, "seed": 42}
{"experiment": "pgolf", "commit": "", "status": "crash", "val_bpb": Infinity, "val_loss": Infinity, "train_loss": 0.0, "param_count": 7341568, "total_flops": 0.0, "peak_memory_mb": 0.0, "wall_time_s": 0.2917671203613281, "description": "MinGRU layer 0 only (early layer = RNN, rest = attention)", "config": {"env_overrides": {"UNIQUE_BLOCKS": "3", "NUM_HEADS": "4", "NUM_KV_HEADS": "4", "NUM_LAYERS": "6", "EVAL_STRIDE": "256", "NORMUON": "1", "XSA": "1", "XSA_START_LAYER": "4", "VALUE_RESID": "1", "FP16_EMBED": "1", "Z_LOSS": "1e-4", "LOGIT_SOFTCAP": "50.0", "VOCAB_SIZE": "2048", "TOKENIZER_PATH": "./data/tokenizers/fineweb_2048_bpe.model", "DATA_PATH": "./data/datasets/fineweb10B_sp2048_local", "VAL_BATCH_SIZE": "65536", "MINGRU_LAYERS": "0"}, "description": "MinGRU layer 0 only (early layer = RNN, rest = attention)", "hypothesis": "HYP-055-mingru0"}, "metrics": {"artifact_size_bytes": 0, "error": "r(model.blocks[0].attn, 'c_q') else model.blocks[0].attn.c_q_down.weight).dtype} \"\n                                                                                                   ^^^^^^^^^^^^^^^^^^^^^^^^^^^^^\n  File \"/Users/michaelellis/Projects/parameter-golf/.venv/lib/python3.13/site-packages/mlx/nn/layers/base.py\", line 103, in __getattr__\n    super(Module, self).__getattribute__(key)\n    ~~~~~~~~~~~~~~~~~~~~~~~~~~~~~~~~~~~~^^^^^\nAttributeError: 'MinGRU' object has no attribute 'c_q_down'\n", "hypothesis": "HYP-055-mingru0"}, "timestamp": 1774114437.436262, "seed": 42}
{"experiment": "pgolf", "commit": "", "status": "crash", "val_bpb": Infinity, "val_loss": Infinity, "train_loss": 0.0, "param_count": 7341568, "total_flops": 0.0, "peak_memory_mb": 0.0, "wall_time_s": 0.2931990623474121, "description": "MinGRU layer 0 only (early layer = RNN, rest = attention)", "config": {"env_overrides": {"UNIQUE_BLOCKS": "3", "NUM_HEADS": "4", "NUM_KV_HEADS": "4", "NUM_LAYERS": "6", "EVAL_STRIDE": "256", "NORMUON": "1", "XSA": "1", "XSA_START_LAYER": "4", "VALUE_RESID": "1", "FP16_EMBED": "1", "Z_LOSS": "1e-4", "LOGIT_SOFTCAP": "50.0", "VOCAB_SIZE": "2048", "TOKENIZER_PATH": "./data/tokenizers/fineweb_2048_bpe.model", "DATA_PATH": "./data/datasets/fineweb10B_sp2048_local", "VAL_BATCH_SIZE": "65536", "MINGRU_LAYERS": "0"}, "description": "MinGRU layer 0 only (early layer = RNN, rest = attention)", "hypothesis": "HYP-055-mingru0"}, "metrics": {"artifact_size_bytes": 0, "error": "^\n  File \"/Users/michaelellis/Projects/parameter-golf/train_gpt_mlx.py\", line 960, in __call__\n    v_resid = self.blocks[self._layer_map[0]].attn._last_v\n              ^^^^^^^^^^^^^^^^^^^^^^^^^^^^^^^^^^^^^^^^^^^^\n  File \"/Users/michaelellis/Projects/parameter-golf/.venv/lib/python3.13/site-packages/mlx/nn/layers/base.py\", line 103, in __getattr__\n    super(Module, self).__getattribute__(key)\n    ~~~~~~~~~~~~~~~~~~~~~~~~~~~~~~~~~~~~^^^^^\nAttributeError: 'MinGRU' object has no attribute '_last_v'\n", "hypothesis": "HYP-055-mingru0"}, "timestamp": 1774114468.66821, "seed": 42}
{"experiment": "pgolf", "commit": "", "status": "keep", "val_bpb": 2.2735, "val_loss": 4.4789, "train_loss": 4.6101, "param_count": 7086090, "total_flops": 0.0, "peak_memory_mb": 0.0, "wall_time_s": 515.8665580749512, "description": "MinGRU layer 0 only (early layer = RNN, rest = attention)", "config": {"env_overrides": {"UNIQUE_BLOCKS": "3", "NUM_HEADS": "4", "NUM_KV_HEADS": "4", "NUM_LAYERS": "6", "EVAL_STRIDE": "256", "NORMUON": "1", "XSA": "1", "XSA_START_LAYER": "4", "VALUE_RESID": "1", "FP16_EMBED": "1", "Z_LOSS": "1e-4", "LOGIT_SOFTCAP": "50.0", "VOCAB_SIZE": "2048", "TOKENIZER_PATH": "./data/tokenizers/fineweb_2048_bpe.model", "DATA_PATH": "./data/datasets/fineweb10B_sp2048_local", "VAL_BATCH_SIZE": "65536", "MINGRU_LAYERS": "0"}, "description": "MinGRU layer 0 only (early layer = RNN, rest = attention)", "hypothesis": "HYP-055-mingru0"}, "metrics": {"artifact_size_bytes": 4506743, "wall_time_ms": 4573.0, "steps": 200, "hypothesis": "HYP-055-mingru0", "estimated_params": 7341568}, "timestamp": 1774114997.818272, "seed": 42}
{"experiment": "pgolf", "commit": "", "status": "keep", "val_bpb": 2.2631, "val_loss": 4.4586, "train_loss": 4.6967, "param_count": 6823941, "total_flops": 0.0, "peak_memory_mb": 0.0, "wall_time_s": 785.9681520462036, "description": "MinGRU layers 0,1 (first 2 = RNN, last 4 = attention)", "config": {"env_overrides": {"UNIQUE_BLOCKS": "3", "NUM_HEADS": "4", "NUM_KV_HEADS": "4", "NUM_LAYERS": "6", "EVAL_STRIDE": "256", "NORMUON": "1", "XSA": "1", "XSA_START_LAYER": "4", "VALUE_RESID": "1", "FP16_EMBED": "1", "Z_LOSS": "1e-4", "LOGIT_SOFTCAP": "50.0", "VOCAB_SIZE": "2048", "TOKENIZER_PATH": "./data/tokenizers/fineweb_2048_bpe.model", "DATA_PATH": "./data/datasets/fineweb10B_sp2048_local", "VAL_BATCH_SIZE": "65536", "MINGRU_LAYERS": "0,1"}, "description": "MinGRU layers 0,1 (first 2 = RNN, last 4 = attention)", "hypothesis": "HYP-055-mingru01"}, "metrics": {"artifact_size_bytes": 4246816, "wall_time_ms": 4206.0, "steps": 244, "early_stopped": true, "hypothesis": "HYP-055-mingru01", "estimated_params": 7341568}, "timestamp": 1774115796.446013, "seed": 42}
{"experiment": "pgolf", "commit": "", "status": "keep", "val_bpb": 0.0, "val_loss": 0.0, "train_loss": 0.0, "param_count": 6561792, "total_flops": 0.0, "peak_memory_mb": 0.0, "wall_time_s": 156.5286569595337, "description": "MinGRU layers 0,1,2 (half RNN, half attention)", "config": {"env_overrides": {"UNIQUE_BLOCKS": "3", "NUM_HEADS": "4", "NUM_KV_HEADS": "4", "NUM_LAYERS": "6", "EVAL_STRIDE": "256", "NORMUON": "1", "XSA": "1", "XSA_START_LAYER": "4", "VALUE_RESID": "1", "FP16_EMBED": "1", "Z_LOSS": "1e-4", "LOGIT_SOFTCAP": "50.0", "VOCAB_SIZE": "2048", "TOKENIZER_PATH": "./data/tokenizers/fineweb_2048_bpe.model", "DATA_PATH": "./data/datasets/fineweb10B_sp2048_local", "VAL_BATCH_SIZE": "65536", "MINGRU_LAYERS": "0,1,2"}, "description": "MinGRU layers 0,1,2 (half RNN, half attention)", "hypothesis": "HYP-055-mingru012"}, "metrics": {"artifact_size_bytes": 9773, "wall_time_ms": 202.0, "steps": 200, "hypothesis": "HYP-055-mingru012", "estimated_params": 7341568}, "timestamp": 1774115998.9895492, "seed": 42}
{"experiment": "pgolf", "commit": "", "status": "keep", "val_bpb": 0.0, "val_loss": 0.0, "train_loss": 7.6185, "param_count": 6561792, "total_flops": 0.0, "peak_memory_mb": 0.0, "wall_time_s": 172.37314772605896, "description": "MinGRU layers 0,1,2 (half RNN, half attention)", "config": {"env_overrides": {"UNIQUE_BLOCKS": "3", "NUM_HEADS": "4", "NUM_KV_HEADS": "4", "NUM_LAYERS": "6", "EVAL_STRIDE": "256", "NORMUON": "1", "XSA": "1", "XSA_START_LAYER": "4", "VALUE_RESID": "1", "FP16_EMBED": "1", "Z_LOSS": "1e-4", "LOGIT_SOFTCAP": "50.0", "VOCAB_SIZE": "2048", "TOKENIZER_PATH": "./data/tokenizers/fineweb_2048_bpe.model", "DATA_PATH": "./data/datasets/fineweb10B_sp2048_local", "VAL_BATCH_SIZE": "65536", "MINGRU_LAYERS": "0,1,2"}, "description": "MinGRU layers 0,1,2 (half RNN, half attention)", "hypothesis": "HYP-055-mingru012"}, "metrics": {"artifact_size_bytes": 9773, "wall_time_ms": 246.0, "steps": 200, "hypothesis": "HYP-055-mingru012", "estimated_params": 7341568}, "timestamp": 1774116216.165565, "seed": 42}
{"experiment": "pgolf", "commit": "", "status": "crash", "val_bpb": Infinity, "val_loss": Infinity, "train_loss": 0.0, "param_count": 7341568, "total_flops": 0.0, "peak_memory_mb": 0.0, "wall_time_s": 0.29132509231567383, "description": "MinGRU layers 0,1,2 (half RNN, half attention)", "config": {"env_overrides": {"UNIQUE_BLOCKS": "3", "NUM_HEADS": "4", "NUM_KV_HEADS": "4", "NUM_LAYERS": "6", "EVAL_STRIDE": "256", "NORMUON": "1", "XSA": "1", "XSA_START_LAYER": "4", "VALUE_RESID": "1", "FP16_EMBED": "1", "Z_LOSS": "1e-4", "LOGIT_SOFTCAP": "50.0", "VOCAB_SIZE": "2048", "TOKENIZER_PATH": "./data/tokenizers/fineweb_2048_bpe.model", "DATA_PATH": "./data/datasets/fineweb10B_sp2048_local", "VAL_BATCH_SIZE": "65536", "MINGRU_LAYERS": "0,1,2"}, "description": "MinGRU layers 0,1,2 (half RNN, half attention)", "hypothesis": "HYP-055-mingru012"}, "metrics": {"artifact_size_bytes": 0, "error": "all__\n    x = self.blocks[self._layer_map[i]](x, x0, v_resid=v_resid, use_xsa=layer_xsa)\n  File \"/Users/michaelellis/Projects/parameter-golf/train_gpt_mlx.py\", line 635, in __call__\n    attn_out = self.attn(self.attn_norm(x))\n  File \"/Users/michaelellis/Projects/parameter-golf/train_gpt_mlx.py\", line 611, in __call__\n    mx.eval(h)  # materialize to limit graph size\n    ~~~~~~~^^^\nValueError: [eval] Attempting to eval an array during function transformations like compile or vmap is not allowed.\n", "hypothesis": "HYP-055-mingru012"}, "timestamp": 1774116249.852125, "seed": 42}
{"experiment": "pgolf", "commit": "", "status": "crash", "val_bpb": Infinity, "val_loss": Infinity, "train_loss": 0.0, "param_count": 7341568, "total_flops": 0.0, "peak_memory_mb": 0.0, "wall_time_s": 0.23893094062805176, "description": "MinGRU layers 0,1,2 (half RNN, half attention)", "config": {"env_overrides": {"UNIQUE_BLOCKS": "3", "NUM_HEADS": "4", "NUM_KV_HEADS": "4", "NUM_LAYERS": "6", "EVAL_STRIDE": "256", "NORMUON": "1", "XSA": "1", "XSA_START_LAYER": "4", "VALUE_RESID": "1", "FP16_EMBED": "1", "Z_LOSS": "1e-4", "LOGIT_SOFTCAP": "50.0", "VOCAB_SIZE": "2048", "TOKENIZER_PATH": "./data/tokenizers/fineweb_2048_bpe.model", "DATA_PATH": "./data/datasets/fineweb10B_sp2048_local", "VAL_BATCH_SIZE": "65536", "MINGRU_LAYERS": "0,1,2"}, "description": "MinGRU layers 0,1,2 (half RNN, half attention)", "hypothesis": "HYP-055-mingru012"}, "metrics": {"artifact_size_bytes": 0, "error": "all__\n    x = self.blocks[self._layer_map[i]](x, x0, v_resid=v_resid, use_xsa=layer_xsa)\n  File \"/Users/michaelellis/Projects/parameter-golf/train_gpt_mlx.py\", line 635, in __call__\n    attn_out = self.attn(self.attn_norm(x))\n  File \"/Users/michaelellis/Projects/parameter-golf/train_gpt_mlx.py\", line 611, in __call__\n    mx.eval(h)  # materialize to limit graph size\n    ~~~~~~~^^^\nValueError: [eval] Attempting to eval an array during function transformations like compile or vmap is not allowed.\n", "hypothesis": "HYP-055-mingru012"}, "timestamp": 1774116256.633989, "seed": 42}
{"experiment": "pgolf", "commit": "", "status": "keep", "val_bpb": 2.5766, "val_loss": 5.076, "train_loss": 9.8335, "param_count": 6561792, "total_flops": 0.0, "peak_memory_mb": 0.0, "wall_time_s": 829.6067910194397, "description": "MinGRU layers 0,1,2 (half RNN, half attention)", "config": {"env_overrides": {"UNIQUE_BLOCKS": "3", "NUM_HEADS": "4", "NUM_KV_HEADS": "4", "NUM_LAYERS": "6", "EVAL_STRIDE": "256", "NORMUON": "1", "XSA": "1", "XSA_START_LAYER": "4", "VALUE_RESID": "1", "FP16_EMBED": "1", "Z_LOSS": "1e-4", "LOGIT_SOFTCAP": "50.0", "VOCAB_SIZE": "2048", "TOKENIZER_PATH": "./data/tokenizers/fineweb_2048_bpe.model", "DATA_PATH": "./data/datasets/fineweb10B_sp2048_local", "VAL_BATCH_SIZE": "65536", "MINGRU_LAYERS": "0,1,2"}, "description": "MinGRU layers 0,1,2 (half RNN, half attention)", "hypothesis": "HYP-055-mingru012"}, "metrics": {"artifact_size_bytes": 3867111, "wall_time_ms": 4893.0, "steps": 170, "early_stopped": true, "hypothesis": "HYP-055-mingru012", "estimated_params": 7341568}, "timestamp": 1774117100.087884, "seed": 42}
{"experiment": "pgolf", "commit": "", "status": "keep", "val_bpb": 1.6961, "val_loss": 3.8282, "train_loss": 3.9164, "param_count": 8396815, "total_flops": 0.0, "peak_memory_mb": 0.0, "wall_time_s": 763.327929019928, "description": "sp4096 vocab with best config (BPB comparison)", "config": {"env_overrides": {"UNIQUE_BLOCKS": "3", "NUM_HEADS": "4", "NUM_KV_HEADS": "4", "NUM_LAYERS": "6", "EVAL_STRIDE": "256", "NORMUON": "1", "XSA": "1", "XSA_START_LAYER": "4", "VALUE_RESID": "1", "FP16_EMBED": "1", "Z_LOSS": "1e-4", "LOGIT_SOFTCAP": "50.0", "VOCAB_SIZE": "4096", "TOKENIZER_PATH": "./data/tokenizers/fineweb_4096_bpe.model", "DATA_PATH": "./data/datasets/fineweb10B_sp4096_local", "VAL_BATCH_SIZE": "65536"}, "description": "sp4096 vocab with best config (BPB comparison)", "hypothesis": "HYP-056-sp4096"}, "metrics": {"artifact_size_bytes": 8263753, "wall_time_ms": 417.0, "steps": 1348, "early_stopped": true, "hypothesis": "HYP-056-sp4096", "estimated_params": 8390144}, "timestamp": 1774121062.123461, "seed": 42}
{"experiment": "pgolf", "commit": "", "status": "crash", "val_bpb": Infinity, "val_loss": Infinity, "train_loss": 0.0, "param_count": 7341568, "total_flops": 0.0, "peak_memory_mb": 0.0, "wall_time_s": 0.617041826248169, "description": "CausalConv block 0 (layers 0,3 = conv, rest = attention)", "config": {"env_overrides": {"UNIQUE_BLOCKS": "3", "NUM_HEADS": "4", "NUM_KV_HEADS": "4", "NUM_LAYERS": "6", "EVAL_STRIDE": "256", "NORMUON": "1", "XSA": "1", "XSA_START_LAYER": "4", "VALUE_RESID": "1", "FP16_EMBED": "1", "Z_LOSS": "1e-4", "LOGIT_SOFTCAP": "50.0", "VOCAB_SIZE": "2048", "TOKENIZER_PATH": "./data/tokenizers/fineweb_2048_bpe.model", "DATA_PATH": "./data/datasets/fineweb10B_sp2048_local", "VAL_BATCH_SIZE": "65536", "CONV_LAYERS": "0"}, "description": "CausalConv block 0 (layers 0,3 = conv, rest = attention)", "hypothesis": "HYP-057-conv0"}, "metrics": {"artifact_size_bytes": 0, "error": "                                                                                                                                                                             ^^^^^^^^^^^^^^^^^^^^^^^^^^^^^\n  File \"/Users/michaelellis/Projects/parameter-golf/.venv/lib/python3.13/site-packages/mlx/nn/layers/base.py\", line 103, in __getattr__\n    super(Module, self).__getattribute__(key)\n    ~~~~~~~~~~~~~~~~~~~~~~~~~~~~~~~~~~~~^^^^^\nAttributeError: 'CausalConvMixer' object has no attribute 'linear_z'\n", "hypothesis": "HYP-057-conv0"}, "timestamp": 1774121272.4131122, "seed": 42}
{"experiment": "pgolf", "commit": "", "status": "crash", "val_bpb": Infinity, "val_loss": Infinity, "train_loss": 0.0, "param_count": 7341568, "total_flops": 0.0, "peak_memory_mb": 0.0, "wall_time_s": 0.6294550895690918, "description": "CausalConv block 0 (layers 0,3 = conv, rest = attention)", "config": {"env_overrides": {"UNIQUE_BLOCKS": "3", "NUM_HEADS": "4", "NUM_KV_HEADS": "4", "NUM_LAYERS": "6", "EVAL_STRIDE": "256", "NORMUON": "1", "XSA": "1", "XSA_START_LAYER": "4", "VALUE_RESID": "1", "FP16_EMBED": "1", "Z_LOSS": "1e-4", "LOGIT_SOFTCAP": "50.0", "VOCAB_SIZE": "2048", "TOKENIZER_PATH": "./data/tokenizers/fineweb_2048_bpe.model", "DATA_PATH": "./data/datasets/fineweb10B_sp2048_local", "VAL_BATCH_SIZE": "65536", "CONV_LAYERS": "0"}, "description": "CausalConv block 0 (layers 0,3 = conv, rest = attention)", "hypothesis": "HYP-057-conv0"}, "metrics": {"artifact_size_bytes": 0, "error": "                                                                                                                                                                             ^^^^^^^^^^^^^^^^^^^^^^^^^^^^^\n  File \"/Users/michaelellis/Projects/parameter-golf/.venv/lib/python3.13/site-packages/mlx/nn/layers/base.py\", line 103, in __getattr__\n    super(Module, self).__getattribute__(key)\n    ~~~~~~~~~~~~~~~~~~~~~~~~~~~~~~~~~~~~^^^^^\nAttributeError: 'CausalConvMixer' object has no attribute 'linear_z'\n", "hypothesis": "HYP-057-conv0"}, "timestamp": 1774121280.167645, "seed": 42}
{"experiment": "pgolf", "commit": "", "status": "keep", "val_bpb": 2.3045, "val_loss": 4.54, "train_loss": 4.6625, "param_count": 7877642, "total_flops": 0.0, "peak_memory_mb": 0.0, "wall_time_s": 352.2692873477936, "description": "CausalConv block 0 (layers 0,3 = conv, rest = attention)", "config": {"env_overrides": {"UNIQUE_BLOCKS": "3", "NUM_HEADS": "4", "NUM_KV_HEADS": "4", "NUM_LAYERS": "6", "EVAL_STRIDE": "256", "NORMUON": "1", "XSA": "1", "XSA_START_LAYER": "4", "VALUE_RESID": "1", "FP16_EMBED": "1", "Z_LOSS": "1e-4", "LOGIT_SOFTCAP": "50.0", "VOCAB_SIZE": "2048", "TOKENIZER_PATH": "./data/tokenizers/fineweb_2048_bpe.model", "DATA_PATH": "./data/datasets/fineweb10B_sp2048_local", "VAL_BATCH_SIZE": "65536", "CONV_LAYERS": "0"}, "description": "CausalConv block 0 (layers 0,3 = conv, rest = attention)", "hypothesis": "HYP-057-conv0"}, "metrics": {"artifact_size_bytes": 5981260, "wall_time_ms": 542.0, "steps": 200, "hypothesis": "HYP-057-conv0", "estimated_params": 7341568}, "timestamp": 1774121664.1456552, "seed": 42}
