{"experiment": "pgolf", "commit": "", "status": "keep", "val_bpb": 1.868, "val_loss": 3.1174, "train_loss": 3.1434, "param_count": 6037528, "total_flops": 0.0, "peak_memory_mb": 0.0, "wall_time_s": 651.8865458965302, "description": "3u + wd=4000 (between wd=3000 and 5000)", "config": {"env_overrides": {"ITERATIONS": "5000", "UNIQUE_BLOCKS": "3", "WARMDOWN_ITERS": "4000"}, "description": "3u + wd=4000 (between wd=3000 and 5000)", "hypothesis": "HYP-019c-schedule"}, "metrics": {"artifact_size_bytes": 3941577, "wall_time_ms": 143.0, "steps": 1312, "early_stopped": true, "hypothesis": "HYP-019c-schedule", "estimated_params": 6031360}, "timestamp": 1773914494.9432452, "seed": 42}
{"experiment": "pgolf", "commit": "", "status": "keep", "val_bpb": 1.9256, "val_loss": 3.2135, "train_loss": 3.2238, "param_count": 6062104, "total_flops": 0.0, "peak_memory_mb": 0.0, "wall_time_s": 652.5421607494354, "description": "SwiGLU 3u, default schedule (vs relu\u00b2 1.9102)", "config": {"env_overrides": {"ITERATIONS": "5000", "UNIQUE_BLOCKS": "3", "MLP_TYPE": "swiglu"}, "description": "SwiGLU 3u, default schedule (vs relu\u00b2 1.9102)", "hypothesis": "HYP-020-swiglu"}, "metrics": {"artifact_size_bytes": 4744625, "wall_time_ms": 145.0, "steps": 1280, "early_stopped": true, "hypothesis": "HYP-020-swiglu", "estimated_params": 6031360}, "timestamp": 1773915456.3302689, "seed": 42}
{"experiment": "pgolf", "commit": "", "status": "keep", "val_bpb": 1.8515, "val_loss": 3.0899, "train_loss": 3.1041, "param_count": 6062104, "total_flops": 0.0, "peak_memory_mb": 0.0, "wall_time_s": 652.4825809001923, "description": "SwiGLU 3u + wd=5000 + lr=0.03 (full combo)", "config": {"env_overrides": {"ITERATIONS": "5000", "UNIQUE_BLOCKS": "3", "MLP_TYPE": "swiglu", "WARMDOWN_ITERS": "5000", "MATRIX_LR": "0.03", "SCALAR_LR": "0.03", "TIED_EMBED_LR": "0.04"}, "description": "SwiGLU 3u + wd=5000 + lr=0.03 (full combo)", "hypothesis": "HYP-020-swiglu-combo"}, "metrics": {"artifact_size_bytes": 3638520, "wall_time_ms": 145.0, "steps": 1280, "early_stopped": true, "hypothesis": "HYP-020-swiglu-combo", "estimated_params": 6031360}, "timestamp": 1773916117.972336, "seed": 42}
{"experiment": "pgolf", "commit": "", "status": "keep", "val_bpb": 2.4145, "val_loss": 4.0295, "train_loss": 3.9189, "param_count": 6037528, "total_flops": 0.0, "peak_memory_mb": 0.0, "wall_time_s": 142.4277970790863, "description": "Baseline refresh: 3u blocks, default Muon (5 NS steps)", "config": {"env_overrides": {"ITERATIONS": "5000", "UNIQUE_BLOCKS": "3"}, "description": "Baseline refresh: 3u blocks, default Muon (5 NS steps)", "hypothesis": "HYP-021-baseline"}, "metrics": {"artifact_size_bytes": 4098164, "wall_time_ms": 147.0, "steps": 200, "hypothesis": "HYP-021-baseline", "estimated_params": 6031360}, "timestamp": 1773916909.794119, "seed": 42}
{"experiment": "pgolf", "commit": "", "status": "keep", "val_bpb": 1.9234, "val_loss": 3.2099, "train_loss": 3.2233, "param_count": 6037528, "total_flops": 0.0, "peak_memory_mb": 0.0, "wall_time_s": 651.8488159179688, "description": "Baseline refresh: 3u blocks, default Muon (5 NS steps)", "config": {"env_overrides": {"ITERATIONS": "5000", "UNIQUE_BLOCKS": "3"}, "description": "Baseline refresh: 3u blocks, default Muon (5 NS steps)", "hypothesis": "HYP-021-baseline"}, "metrics": {"artifact_size_bytes": 4734433, "wall_time_ms": 143.0, "steps": 1312, "early_stopped": true, "hypothesis": "HYP-021-baseline", "estimated_params": 6031360}, "timestamp": 1773917567.8516312, "seed": 42}
{"experiment": "pgolf", "commit": "", "status": "keep", "val_bpb": 1.9963, "val_loss": 3.3315, "train_loss": 3.3454, "param_count": 6037528, "total_flops": 0.0, "peak_memory_mb": 0.0, "wall_time_s": 651.6943049430847, "description": "3u + 3 NS steps (vs default 5)", "config": {"env_overrides": {"ITERATIONS": "5000", "UNIQUE_BLOCKS": "3", "MUON_BACKEND_STEPS": "3"}, "description": "3u + 3 NS steps (vs default 5)", "hypothesis": "HYP-021-ns3"}, "metrics": {"artifact_size_bytes": 4291102, "wall_time_ms": 143.0, "steps": 1344, "early_stopped": true, "hypothesis": "HYP-021-ns3", "estimated_params": 6031360}, "timestamp": 1773918225.248517, "seed": 42}
{"experiment": "pgolf", "commit": "", "status": "keep", "val_bpb": 1.9286, "val_loss": 3.2185, "train_loss": 3.2219, "param_count": 6037528, "total_flops": 0.0, "peak_memory_mb": 0.0, "wall_time_s": 652.4615387916565, "description": "3u + microbatch=8192 (vs default 4096)", "config": {"env_overrides": {"ITERATIONS": "5000", "UNIQUE_BLOCKS": "3", "MLX_MAX_MICROBATCH_TOKENS": "8192"}, "description": "3u + microbatch=8192 (vs default 4096)", "hypothesis": "HYP-021-mb8k"}, "metrics": {"artifact_size_bytes": 4749559, "wall_time_ms": 141.0, "steps": 1322, "early_stopped": true, "hypothesis": "HYP-021-mb8k", "estimated_params": 6031360}, "timestamp": 1773918885.441764, "seed": 42}
{"experiment": "pgolf", "commit": "", "status": "keep", "val_bpb": 1.9927, "val_loss": 3.3256, "train_loss": 3.3482, "param_count": 6037528, "total_flops": 0.0, "peak_memory_mb": 0.0, "wall_time_s": 652.0543222427368, "description": "3u + 3 NS steps + microbatch=8192 (combined)", "config": {"env_overrides": {"ITERATIONS": "5000", "UNIQUE_BLOCKS": "3", "MUON_BACKEND_STEPS": "3", "MLX_MAX_MICROBATCH_TOKENS": "8192"}, "description": "3u + 3 NS steps + microbatch=8192 (combined)", "hypothesis": "HYP-021-combined"}, "metrics": {"artifact_size_bytes": 4285714, "wall_time_ms": 141.0, "steps": 1348, "early_stopped": true, "hypothesis": "HYP-021-combined", "estimated_params": 6031360}, "timestamp": 1773919545.029074, "seed": 42}
{"experiment": "pgolf", "commit": "", "status": "keep", "val_bpb": 2.4103, "val_loss": 4.0223, "train_loss": 3.9468, "param_count": 6823960, "total_flops": 0.0, "peak_memory_mb": 0.0, "wall_time_s": 152.3707790374756, "description": "3u + full MHA (8 KV heads, no GQA)", "config": {"env_overrides": {"ITERATIONS": "5000", "UNIQUE_BLOCKS": "3", "NUM_KV_HEADS": "8"}, "description": "3u + full MHA (8 KV heads, no GQA)", "hypothesis": "HYP-022-mha"}, "metrics": {"artifact_size_bytes": 4568826, "wall_time_ms": 150.0, "steps": 200, "hypothesis": "HYP-022-mha", "estimated_params": 6817792}, "timestamp": 1773919926.935308, "seed": 42}
{"experiment": "pgolf", "commit": "", "status": "keep", "val_bpb": 1.9449, "val_loss": 3.2457, "train_loss": 3.2547, "param_count": 6823960, "total_flops": 0.0, "peak_memory_mb": 0.0, "wall_time_s": 656.3556928634644, "description": "3u + full MHA (8 KV heads, no GQA)", "config": {"env_overrides": {"ITERATIONS": "5000", "UNIQUE_BLOCKS": "3", "NUM_KV_HEADS": "8"}, "description": "3u + full MHA (8 KV heads, no GQA)", "hypothesis": "HYP-022-mha"}, "metrics": {"artifact_size_bytes": 5226713, "wall_time_ms": 150.0, "steps": 1240, "early_stopped": true, "hypothesis": "HYP-022-mha", "estimated_params": 6817792}, "timestamp": 1773920590.593673, "seed": 42}
{"experiment": "pgolf", "commit": "", "status": "keep", "val_bpb": 1.8512, "val_loss": 3.0894, "train_loss": 3.2402, "param_count": 6823948, "total_flops": 0.0, "peak_memory_mb": 0.0, "wall_time_s": 655.9003529548645, "description": "3u + 4 heads (head_dim=128, MHA)", "config": {"env_overrides": {"ITERATIONS": "5000", "UNIQUE_BLOCKS": "3", "NUM_HEADS": "4", "NUM_KV_HEADS": "4"}, "description": "3u + 4 heads (head_dim=128, MHA)", "hypothesis": "HYP-022-4h"}, "metrics": {"artifact_size_bytes": 5405720, "wall_time_ms": 130.0, "steps": 1404, "early_stopped": true, "hypothesis": "HYP-022-4h", "estimated_params": 6817792}, "timestamp": 1773921252.980662, "seed": 42}
{"experiment": "pgolf", "commit": "", "status": "keep", "val_bpb": 1.9142, "val_loss": 3.1946, "train_loss": 3.1984, "param_count": 6037528, "total_flops": 0.0, "peak_memory_mb": 0.0, "wall_time_s": 651.2065370082855, "description": "3u + no skip connections", "config": {"env_overrides": {"ITERATIONS": "5000", "UNIQUE_BLOCKS": "3", "USE_SKIP": "0"}, "description": "3u + no skip connections", "hypothesis": "HYP-022-noskip"}, "metrics": {"artifact_size_bytes": 4778618, "wall_time_ms": 144.0, "steps": 1323, "early_stopped": true, "hypothesis": "HYP-022-noskip", "estimated_params": 6031360}, "timestamp": 1773921914.236673, "seed": 42}
{"experiment": "pgolf", "commit": "", "status": "keep", "val_bpb": 1.8856, "val_loss": 3.1468, "train_loss": 3.2854, "param_count": 6823948, "total_flops": 0.0, "peak_memory_mb": 0.0, "wall_time_s": 655.4729642868042, "description": "3u + 4 heads + no skips (best combo)", "config": {"env_overrides": {"ITERATIONS": "5000", "UNIQUE_BLOCKS": "3", "NUM_HEADS": "4", "NUM_KV_HEADS": "4", "USE_SKIP": "0"}, "description": "3u + 4 heads + no skips (best combo)", "hypothesis": "HYP-022b-combo"}, "metrics": {"artifact_size_bytes": 5443021, "wall_time_ms": 133.0, "steps": 1403, "early_stopped": true, "hypothesis": "HYP-022b-combo", "estimated_params": 6817792}, "timestamp": 1773922594.488118, "seed": 42}
{"experiment": "pgolf", "commit": "", "status": "keep", "val_bpb": 1.893, "val_loss": 3.1591, "train_loss": 3.2938, "param_count": 6037516, "total_flops": 0.0, "peak_memory_mb": 0.0, "wall_time_s": 650.733521938324, "description": "3u + 4 heads + 2 KV heads (GQA with wide heads)", "config": {"env_overrides": {"ITERATIONS": "5000", "UNIQUE_BLOCKS": "3", "NUM_HEADS": "4", "NUM_KV_HEADS": "2"}, "description": "3u + 4 heads + 2 KV heads (GQA with wide heads)", "hypothesis": "HYP-022b-gqa2"}, "metrics": {"artifact_size_bytes": 4918007, "wall_time_ms": 124.0, "steps": 1498, "early_stopped": true, "hypothesis": "HYP-022b-gqa2", "estimated_params": 6031360}, "timestamp": 1773923253.077986, "seed": 42}
{"experiment": "pgolf", "commit": "", "status": "keep", "val_bpb": 1.9194, "val_loss": 3.2033, "train_loss": 3.3272, "param_count": 6823942, "total_flops": 0.0, "peak_memory_mb": 0.0, "wall_time_s": 673.4411859512329, "description": "3u + 2 heads (head_dim=256, extreme wide)", "config": {"env_overrides": {"ITERATIONS": "5000", "UNIQUE_BLOCKS": "3", "NUM_HEADS": "2", "NUM_KV_HEADS": "2"}, "description": "3u + 2 heads (head_dim=256, extreme wide)", "hypothesis": "HYP-022c-2h"}, "metrics": {"artifact_size_bytes": 5484808, "wall_time_ms": 121.0, "steps": 1464, "early_stopped": true, "hypothesis": "HYP-022c-2h", "estimated_params": 6817792}, "timestamp": 1773924081.550965, "seed": 42}
{"experiment": "pgolf", "commit": "", "status": "keep", "val_bpb": 1.8918, "val_loss": 3.157, "train_loss": 3.1415, "param_count": 8396812, "total_flops": 0.0, "peak_memory_mb": 0.0, "wall_time_s": 670.9068078994751, "description": "3u + 4h/4kv + MLP_MULT=3 (wider MLP, spend artifact budget)", "config": {"env_overrides": {"ITERATIONS": "5000", "UNIQUE_BLOCKS": "3", "NUM_HEADS": "4", "NUM_KV_HEADS": "4", "MLP_MULT": "3"}, "description": "3u + 4h/4kv + MLP_MULT=3 (wider MLP, spend artifact budget)", "hypothesis": "HYP-022c-mlp3"}, "metrics": {"artifact_size_bytes": 6346155, "wall_time_ms": 159.0, "steps": 1234, "early_stopped": true, "hypothesis": "HYP-022c-mlp3", "estimated_params": 8390656}, "timestamp": 1773924764.852674, "seed": 42}
{"experiment": "pgolf", "commit": "", "status": "keep", "val_bpb": 1.9412, "val_loss": 3.2395, "train_loss": 3.2952, "param_count": 4724744, "total_flops": 0.0, "peak_memory_mb": 0.0, "wall_time_s": 660.2588469982147, "description": "2u + 4h/4kv (fewer blocks with wide heads)", "config": {"env_overrides": {"ITERATIONS": "5000", "UNIQUE_BLOCKS": "2", "NUM_HEADS": "4", "NUM_KV_HEADS": "4"}, "description": "2u + 4h/4kv (fewer blocks with wide heads)", "hypothesis": "HYP-023-2u"}, "metrics": {"artifact_size_bytes": 3774852, "wall_time_ms": 137.0, "steps": 1376, "early_stopped": true, "hypothesis": "HYP-023-2u", "estimated_params": 4720640}, "timestamp": 1773926037.977951, "seed": 42}
{"experiment": "pgolf", "commit": "", "status": "keep", "val_bpb": 1.8945, "val_loss": 3.1616, "train_loss": 3.1957, "param_count": 11022356, "total_flops": 0.0, "peak_memory_mb": 0.0, "wall_time_s": 656.0992171764374, "description": "5u + 4h/4kv (more blocks with wide heads)", "config": {"env_overrides": {"ITERATIONS": "5000", "UNIQUE_BLOCKS": "5", "NUM_HEADS": "4", "NUM_KV_HEADS": "4"}, "description": "5u + 4h/4kv (more blocks with wide heads)", "hypothesis": "HYP-023-5u"}, "metrics": {"artifact_size_bytes": 8567776, "wall_time_ms": 133.0, "steps": 1322, "early_stopped": true, "hypothesis": "HYP-023-5u", "estimated_params": 11012096}, "timestamp": 1773926701.907818, "seed": 42}
{"experiment": "pgolf", "commit": "", "status": "keep", "val_bpb": 2.0023, "val_loss": 3.3415, "train_loss": 3.4802, "param_count": 2625540, "total_flops": 0.0, "peak_memory_mb": 0.0, "wall_time_s": 656.5409240722656, "description": "1u + 4h/4kv (extreme sharing with wide heads)", "config": {"env_overrides": {"ITERATIONS": "5000", "UNIQUE_BLOCKS": "1", "NUM_HEADS": "4", "NUM_KV_HEADS": "4"}, "description": "1u + 4h/4kv (extreme sharing with wide heads)", "hypothesis": "HYP-023-1u"}, "metrics": {"artifact_size_bytes": 2167064, "wall_time_ms": 130.0, "steps": 1461, "early_stopped": true, "hypothesis": "HYP-023-1u", "estimated_params": 2623488}, "timestamp": 1773927365.0509171, "seed": 42}
{"experiment": "pgolf", "commit": "", "status": "keep", "val_bpb": 2.4032, "val_loss": 4.0105, "train_loss": 3.9078, "param_count": 6824972, "total_flops": 0.0, "peak_memory_mb": 0.0, "wall_time_s": 187.25097608566284, "description": "3u\u00d74 cycles = 12 layers + 4h/4kv", "config": {"env_overrides": {"ITERATIONS": "5000", "UNIQUE_BLOCKS": "3", "NUM_HEADS": "4", "NUM_KV_HEADS": "4", "NUM_LAYERS": "12"}, "description": "3u\u00d74 cycles = 12 layers + 4h/4kv", "hypothesis": "HYP-024-12L"}, "metrics": {"artifact_size_bytes": 4444754, "wall_time_ms": 178.0, "steps": 200, "hypothesis": "HYP-024-12L", "estimated_params": 6818816}, "timestamp": 1773929543.180156, "seed": 42}
{"experiment": "pgolf", "commit": "", "status": "keep", "val_bpb": 1.9595, "val_loss": 3.27, "train_loss": 3.2355, "param_count": 6824972, "total_flops": 0.0, "peak_memory_mb": 0.0, "wall_time_s": 673.4940700531006, "description": "3u\u00d74 cycles = 12 layers + 4h/4kv", "config": {"env_overrides": {"ITERATIONS": "5000", "UNIQUE_BLOCKS": "3", "NUM_HEADS": "4", "NUM_KV_HEADS": "4", "NUM_LAYERS": "12"}, "description": "3u\u00d74 cycles = 12 layers + 4h/4kv", "hypothesis": "HYP-024-12L"}, "metrics": {"artifact_size_bytes": 4977249, "wall_time_ms": 186.0, "steps": 1061, "early_stopped": true, "hypothesis": "HYP-024-12L", "estimated_params": 6818816}, "timestamp": 1773930226.877446, "seed": 42}
{"experiment": "pgolf", "commit": "", "status": "keep", "val_bpb": 1.9902, "val_loss": 3.3212, "train_loss": 3.8731, "param_count": 6825484, "total_flops": 0.0, "peak_memory_mb": 0.0, "wall_time_s": 690.9939432144165, "description": "3u\u00d75 cycles = 15 layers + 4h/4kv", "config": {"env_overrides": {"ITERATIONS": "5000", "UNIQUE_BLOCKS": "3", "NUM_HEADS": "4", "NUM_KV_HEADS": "4", "NUM_LAYERS": "15"}, "description": "3u\u00d75 cycles = 15 layers + 4h/4kv", "hypothesis": "HYP-024-15L"}, "metrics": {"artifact_size_bytes": 4764104, "wall_time_ms": 217.0, "steps": 888, "early_stopped": true, "hypothesis": "HYP-024-15L", "estimated_params": 6819328}, "timestamp": 1773930928.5523388, "seed": 42}
{"experiment": "pgolf", "commit": "", "status": "keep", "val_bpb": 1.7363, "val_loss": 2.8975, "train_loss": 2.904, "param_count": 6823436, "total_flops": 0.0, "peak_memory_mb": 0.0, "wall_time_s": 637.6718318462372, "description": "3u\u00d72 cycles = 6 layers + 4h/4kv", "config": {"env_overrides": {"ITERATIONS": "5000", "UNIQUE_BLOCKS": "3", "NUM_HEADS": "4", "NUM_KV_HEADS": "4", "NUM_LAYERS": "6"}, "description": "3u\u00d72 cycles = 6 layers + 4h/4kv", "hypothesis": "HYP-024-6L"}, "metrics": {"artifact_size_bytes": 5889383, "wall_time_ms": 95.0, "steps": 1996, "early_stopped": true, "hypothesis": "HYP-024-6L", "estimated_params": 6817280}, "timestamp": 1773931571.854325, "seed": 42}
{"experiment": "pgolf", "commit": "", "status": "keep", "val_bpb": 2.4202, "val_loss": 4.0389, "train_loss": 3.9192, "param_count": 6823436, "total_flops": 0.0, "peak_memory_mb": 0.0, "wall_time_s": 96.26553320884705, "description": "Optuna trial 0: mom=0.950 lr=0.0400/0.0400 wd=1200 qk=1.50 sc=30.0", "config": {"env_overrides": {"UNIQUE_BLOCKS": "3", "NUM_HEADS": "4", "NUM_KV_HEADS": "4", "NUM_LAYERS": "6", "ITERATIONS": "5000", "MUON_MOMENTUM": "0.95", "MATRIX_LR": "0.04", "SCALAR_LR": "0.04", "WARMDOWN_ITERS": "1200", "QK_GAIN_INIT": "1.5", "LOGIT_SOFTCAP": "30.0"}, "description": "Optuna trial 0: mom=0.950 lr=0.0400/0.0400 wd=1200 qk=1.50 sc=30.0", "hypothesis": "HYP-025-optuna-t0"}, "metrics": {"artifact_size_bytes": 4613326, "wall_time_ms": 95.0, "steps": 200, "hypothesis": "HYP-025-optuna-t0", "estimated_params": 6817280}, "timestamp": 1773932021.288485, "seed": 42}
{"experiment": "pgolf", "commit": "", "status": "keep", "val_bpb": 1.7596, "val_loss": 2.9364, "train_loss": 2.8357, "param_count": 6823436, "total_flops": 0.0, "peak_memory_mb": 0.0, "wall_time_s": 637.4770841598511, "description": "Optuna trial 1: mom=0.968 lr=0.0263/0.0366 wd=500 qk=2.76 sc=47.4", "config": {"env_overrides": {"UNIQUE_BLOCKS": "3", "NUM_HEADS": "4", "NUM_KV_HEADS": "4", "NUM_LAYERS": "6", "ITERATIONS": "5000", "MUON_MOMENTUM": "0.9677861966068465", "MATRIX_LR": "0.02630685302738624", "SCALAR_LR": "0.036575467834549395", "WARMDOWN_ITERS": "500", "QK_GAIN_INIT": "2.7632962923114244", "LOGIT_SOFTCAP": "47.416354659375365"}, "description": "Optuna trial 1: mom=0.968 lr=0.0263/0.0366 wd=500 qk=2.76 sc=47.4", "hypothesis": "HYP-025-optuna-t1"}, "metrics": {"artifact_size_bytes": 5943019, "wall_time_ms": 92.0, "steps": 2014, "early_stopped": true, "hypothesis": "HYP-025-optuna-t1", "estimated_params": 6817280}, "timestamp": 1773932668.450189, "seed": 42}
{"experiment": "pgolf", "commit": "", "status": "keep", "val_bpb": 1.7735, "val_loss": 2.9597, "train_loss": 3.0007, "param_count": 6823436, "total_flops": 0.0, "peak_memory_mb": 0.0, "wall_time_s": 637.5711958408356, "description": "Optuna trial 2: mom=0.922 lr=0.0275/0.0138 wd=4500 qk=2.50 sc=18.5", "config": {"env_overrides": {"UNIQUE_BLOCKS": "3", "NUM_HEADS": "4", "NUM_KV_HEADS": "4", "NUM_LAYERS": "6", "ITERATIONS": "5000", "MUON_MOMENTUM": "0.9221574318608508", "MATRIX_LR": "0.027539078435486218", "SCALAR_LR": "0.013831127681323437", "WARMDOWN_ITERS": "4500", "QK_GAIN_INIT": "2.4998726223069374", "LOGIT_SOFTCAP": "18.516032574618805"}, "description": "Optuna trial 2: mom=0.922 lr=0.0275/0.0138 wd=4500 qk=2.50 sc=18.5", "hypothesis": "HYP-025-optuna-t2"}, "metrics": {"artifact_size_bytes": 4494095, "wall_time_ms": 94.0, "steps": 2013, "early_stopped": true, "hypothesis": "HYP-025-optuna-t2", "estimated_params": 6817280}, "timestamp": 1773933306.037121, "seed": 42}
{"experiment": "pgolf", "commit": "", "status": "keep", "val_bpb": 1.7397, "val_loss": 2.9033, "train_loss": 2.8131, "param_count": 6823436, "total_flops": 0.0, "peak_memory_mb": 0.0, "wall_time_s": 637.6069538593292, "description": "Optuna trial 3: mom=0.988 lr=0.0110/0.0359 wd=4500 qk=2.42 sc=39.8", "config": {"env_overrides": {"UNIQUE_BLOCKS": "3", "NUM_HEADS": "4", "NUM_KV_HEADS": "4", "NUM_LAYERS": "6", "ITERATIONS": "5000", "MUON_MOMENTUM": "0.9876513419390621", "MATRIX_LR": "0.011026486124341798", "SCALAR_LR": "0.03585158531413804", "WARMDOWN_ITERS": "4500", "QK_GAIN_INIT": "2.4166711592136423", "LOGIT_SOFTCAP": "39.839969943258446"}, "description": "Optuna trial 3: mom=0.988 lr=0.0110/0.0359 wd=4500 qk=2.42 sc=39.8", "hypothesis": "HYP-025-optuna-t3"}, "metrics": {"artifact_size_bytes": 4376313, "wall_time_ms": 88.0, "steps": 2015, "early_stopped": true, "hypothesis": "HYP-025-optuna-t3", "estimated_params": 6817280}, "timestamp": 1773933943.656758, "seed": 42}
{"experiment": "pgolf", "commit": "", "status": "keep", "val_bpb": 1.7309, "val_loss": 2.8886, "train_loss": 2.7995, "param_count": 6823436, "total_flops": 0.0, "peak_memory_mb": 0.0, "wall_time_s": 637.6362369060516, "description": "Optuna trial 4: mom=0.921 lr=0.0199/0.0271 wd=1500 qk=0.72 sc=47.2", "config": {"env_overrides": {"UNIQUE_BLOCKS": "3", "NUM_HEADS": "4", "NUM_KV_HEADS": "4", "NUM_LAYERS": "6", "ITERATIONS": "5000", "MUON_MOMENTUM": "0.9212484973526902", "MATRIX_LR": "0.019943659638050303", "SCALAR_LR": "0.027064145802056874", "WARMDOWN_ITERS": "1500", "QK_GAIN_INIT": "0.7202720298055463", "LOGIT_SOFTCAP": "47.19978108212331"}, "description": "Optuna trial 4: mom=0.921 lr=0.0199/0.0271 wd=1500 qk=0.72 sc=47.2", "hypothesis": "HYP-025-optuna-t4"}, "metrics": {"artifact_size_bytes": 4958589, "wall_time_ms": 95.0, "steps": 2013, "early_stopped": true, "hypothesis": "HYP-025-optuna-t4", "estimated_params": 6817280}, "timestamp": 1773934581.3051798, "seed": 42}
{"experiment": "pgolf", "commit": "", "status": "keep", "val_bpb": 1.7714, "val_loss": 2.9561, "train_loss": 2.9647, "param_count": 6823436, "total_flops": 0.0, "peak_memory_mb": 0.0, "wall_time_s": 637.5176389217377, "description": "Optuna trial 5: mom=0.988 lr=0.0531/0.0275 wd=4500 qk=1.10 sc=35.0", "config": {"env_overrides": {"UNIQUE_BLOCKS": "3", "NUM_HEADS": "4", "NUM_KV_HEADS": "4", "NUM_LAYERS": "6", "ITERATIONS": "5000", "MUON_MOMENTUM": "0.9877067344342108", "MATRIX_LR": "0.05305336841159", "SCALAR_LR": "0.027514258961077495", "WARMDOWN_ITERS": "4500", "QK_GAIN_INIT": "1.1049240443496755", "LOGIT_SOFTCAP": "34.98680190137824"}, "description": "Optuna trial 5: mom=0.988 lr=0.0531/0.0275 wd=4500 qk=1.10 sc=35.0", "hypothesis": "HYP-025-optuna-t5"}, "metrics": {"artifact_size_bytes": 5646532, "wall_time_ms": 92.0, "steps": 2014, "early_stopped": true, "hypothesis": "HYP-025-optuna-t5", "estimated_params": 6817280}, "timestamp": 1773935218.835914, "seed": 42}
