{"experiment": "pgolf", "commit": "", "status": "keep", "val_bpb": 1.6662, "val_loss": 3.2826, "train_loss": 3.5068, "param_count": 7348239, "total_flops": 0.0, "peak_memory_mb": 0.0, "wall_time_s": 755.3315079212189, "description": "Eval temp 1.1 (soften \u2014 model may be overconfident)", "config": {"env_overrides": {"UNIQUE_BLOCKS": "3", "NUM_HEADS": "4", "NUM_KV_HEADS": "4", "NUM_LAYERS": "6", "EVAL_STRIDE": "256", "NORMUON": "1", "XSA": "1", "XSA_START_LAYER": "4", "VALUE_RESID": "1", "FP16_EMBED": "1", "Z_LOSS": "1e-4", "LOGIT_SOFTCAP": "50.0", "VOCAB_SIZE": "2048", "TOKENIZER_PATH": "./data/tokenizers/fineweb_2048_bpe.model", "DATA_PATH": "./data/datasets/fineweb10B_sp2048_local", "VAL_BATCH_SIZE": "65536", "EVAL_TEMP": "1.1"}, "description": "Eval temp 1.1 (soften \u2014 model may be overconfident)", "hypothesis": "HYP-063-temp11"}, "metrics": {"artifact_size_bytes": 6963005, "wall_time_ms": 333.0, "steps": 1805, "early_stopped": true, "hypothesis": "HYP-063-temp11", "estimated_params": 7341568}, "timestamp": 1774141945.3394508, "seed": 42}
{"experiment": "pgolf", "commit": "", "status": "keep", "val_bpb": 1.6484, "val_loss": 3.2474, "train_loss": 3.497, "param_count": 7348239, "total_flops": 0.0, "peak_memory_mb": 0.0, "wall_time_s": 754.8871319293976, "description": "Grad accum 2 (16K effective batch, 50% fewer steps)", "config": {"env_overrides": {"UNIQUE_BLOCKS": "3", "NUM_HEADS": "4", "NUM_KV_HEADS": "4", "NUM_LAYERS": "6", "EVAL_STRIDE": "256", "NORMUON": "1", "XSA": "1", "XSA_START_LAYER": "4", "VALUE_RESID": "1", "FP16_EMBED": "1", "Z_LOSS": "1e-4", "LOGIT_SOFTCAP": "50.0", "VOCAB_SIZE": "2048", "TOKENIZER_PATH": "./data/tokenizers/fineweb_2048_bpe.model", "DATA_PATH": "./data/datasets/fineweb10B_sp2048_local", "VAL_BATCH_SIZE": "65536", "GRAD_ACCUM_STEPS": "2"}, "description": "Grad accum 2 (16K effective batch, 50% fewer steps)", "hypothesis": "HYP-064-accum2"}, "metrics": {"artifact_size_bytes": 6955294, "wall_time_ms": 334.0, "steps": 1812, "early_stopped": true, "hypothesis": "HYP-064-accum2", "estimated_params": 7341568}, "timestamp": 1774142904.705701, "seed": 42}
{"experiment": "pgolf", "commit": "", "status": "keep", "val_bpb": 1.6528, "val_loss": 3.2561, "train_loss": 3.0319, "param_count": 7348239, "total_flops": 0.0, "peak_memory_mb": 0.0, "wall_time_s": 754.7099661827087, "description": "Grad accum 4 (32K effective batch, 75% fewer steps)", "config": {"env_overrides": {"UNIQUE_BLOCKS": "3", "NUM_HEADS": "4", "NUM_KV_HEADS": "4", "NUM_LAYERS": "6", "EVAL_STRIDE": "256", "NORMUON": "1", "XSA": "1", "XSA_START_LAYER": "4", "VALUE_RESID": "1", "FP16_EMBED": "1", "Z_LOSS": "1e-4", "LOGIT_SOFTCAP": "50.0", "VOCAB_SIZE": "2048", "TOKENIZER_PATH": "./data/tokenizers/fineweb_2048_bpe.model", "DATA_PATH": "./data/datasets/fineweb10B_sp2048_local", "VAL_BATCH_SIZE": "65536", "GRAD_ACCUM_STEPS": "4"}, "description": "Grad accum 4 (32K effective batch, 75% fewer steps)", "hypothesis": "HYP-064-accum4"}, "metrics": {"artifact_size_bytes": 6926217, "wall_time_ms": 341.0, "steps": 1770, "early_stopped": true, "hypothesis": "HYP-064-accum4", "estimated_params": 7341568}, "timestamp": 1774143668.077527, "seed": 42}
{"experiment": "pgolf", "commit": "", "status": "keep", "val_bpb": 1.7206, "val_loss": 3.3897, "train_loss": 3.7223, "param_count": 7643152, "total_flops": 0.0, "peak_memory_mb": 0.0, "wall_time_s": 835.4131729602814, "description": "BigramHash 4096 dim=64 with sp2048 (local context mixing)", "config": {"env_overrides": {"UNIQUE_BLOCKS": "3", "NUM_HEADS": "4", "NUM_KV_HEADS": "4", "NUM_LAYERS": "6", "EVAL_STRIDE": "256", "NORMUON": "1", "XSA": "1", "XSA_START_LAYER": "4", "VALUE_RESID": "1", "FP16_EMBED": "1", "Z_LOSS": "1e-4", "LOGIT_SOFTCAP": "50.0", "VOCAB_SIZE": "2048", "TOKENIZER_PATH": "./data/tokenizers/fineweb_2048_bpe.model", "DATA_PATH": "./data/datasets/fineweb10B_sp2048_local", "VAL_BATCH_SIZE": "65536", "BIGRAM_VOCAB_SIZE": "4096", "BIGRAM_DIM": "64"}, "description": "BigramHash 4096 dim=64 with sp2048 (local context mixing)", "hypothesis": "HYP-065-bigram4k"}, "metrics": {"artifact_size_bytes": 6405010, "wall_time_ms": 586.0, "steps": 1261, "early_stopped": true, "hypothesis": "HYP-065-bigram4k", "estimated_params": 7341568}, "timestamp": 1774144628.73552, "seed": 42}
{"experiment": "pgolf", "commit": "", "status": "crash", "val_bpb": Infinity, "val_loss": Infinity, "train_loss": 0.0, "param_count": 7341568, "total_flops": 0.0, "peak_memory_mb": 0.0, "wall_time_s": 0.20193004608154297, "description": "Context mixing alpha=0.01 (1% unigram, 99% transformer)", "config": {"env_overrides": {"UNIQUE_BLOCKS": "3", "NUM_HEADS": "4", "NUM_KV_HEADS": "4", "NUM_LAYERS": "6", "EVAL_STRIDE": "256", "NORMUON": "1", "XSA": "1", "XSA_START_LAYER": "4", "VALUE_RESID": "1", "FP16_EMBED": "1", "Z_LOSS": "1e-4", "LOGIT_SOFTCAP": "50.0", "VOCAB_SIZE": "2048", "TOKENIZER_PATH": "./data/tokenizers/fineweb_2048_bpe.model", "DATA_PATH": "./data/datasets/fineweb10B_sp2048_local", "VAL_BATCH_SIZE": "65536", "EVAL_MIX_ALPHA": "0.01", "EVAL_MIX_LOGPROBS": "./data/unigram_sp2048_logprobs.npy"}, "description": "Context mixing alpha=0.01 (1% unigram, 99% transformer)", "hypothesis": "HYP-066-mix001"}, "metrics": {"artifact_size_bytes": 0, "error": "/Users/michaelellis/Projects/parameter-golf/train_gpt_mlx.py\", line 1910, in main\n    n_params = sum(int(np.prod(p.shape)) for _, p in tree_flatten(model.parameters()))\n  File \"/Users/michaelellis/Projects/parameter-golf/train_gpt_mlx.py\", line 1910, in <genexpr>\n    n_params = sum(int(np.prod(p.shape)) for _, p in tree_flatten(model.parameters()))\n                       ^^\nNameError: cannot access free variable 'np' where it is not associated with a value in enclosing scope. Did you mean: 'p'?\n", "hypothesis": "HYP-066-mix001"}, "timestamp": 1774145144.620254, "seed": 42}
{"experiment": "pgolf", "commit": "", "status": "crash", "val_bpb": Infinity, "val_loss": Infinity, "train_loss": 0.0, "param_count": 7341568, "total_flops": 0.0, "peak_memory_mb": 0.0, "wall_time_s": 0.13720417022705078, "description": "Context mixing alpha=0.01 (1% unigram, 99% transformer)", "config": {"env_overrides": {"UNIQUE_BLOCKS": "3", "NUM_HEADS": "4", "NUM_KV_HEADS": "4", "NUM_LAYERS": "6", "EVAL_STRIDE": "256", "NORMUON": "1", "XSA": "1", "XSA_START_LAYER": "4", "VALUE_RESID": "1", "FP16_EMBED": "1", "Z_LOSS": "1e-4", "LOGIT_SOFTCAP": "50.0", "VOCAB_SIZE": "2048", "TOKENIZER_PATH": "./data/tokenizers/fineweb_2048_bpe.model", "DATA_PATH": "./data/datasets/fineweb10B_sp2048_local", "VAL_BATCH_SIZE": "65536", "EVAL_MIX_ALPHA": "0.01", "EVAL_MIX_LOGPROBS": "./data/unigram_sp2048_logprobs.npy"}, "description": "Context mixing alpha=0.01 (1% unigram, 99% transformer)", "hypothesis": "HYP-066-mix001"}, "metrics": {"artifact_size_bytes": 0, "error": "/Users/michaelellis/Projects/parameter-golf/train_gpt_mlx.py\", line 1910, in main\n    n_params = sum(int(np.prod(p.shape)) for _, p in tree_flatten(model.parameters()))\n  File \"/Users/michaelellis/Projects/parameter-golf/train_gpt_mlx.py\", line 1910, in <genexpr>\n    n_params = sum(int(np.prod(p.shape)) for _, p in tree_flatten(model.parameters()))\n                       ^^\nNameError: cannot access free variable 'np' where it is not associated with a value in enclosing scope. Did you mean: 'p'?\n", "hypothesis": "HYP-066-mix001"}, "timestamp": 1774145151.955061, "seed": 42}
{"experiment": "pgolf", "commit": "", "status": "keep", "val_bpb": 1.6503, "val_loss": 3.2512, "train_loss": 3.4971, "param_count": 7348239, "total_flops": 0.0, "peak_memory_mb": 0.0, "wall_time_s": 753.7262489795685, "description": "Context mixing alpha=0.01 (1% unigram, 99% transformer)", "config": {"env_overrides": {"UNIQUE_BLOCKS": "3", "NUM_HEADS": "4", "NUM_KV_HEADS": "4", "NUM_LAYERS": "6", "EVAL_STRIDE": "256", "NORMUON": "1", "XSA": "1", "XSA_START_LAYER": "4", "VALUE_RESID": "1", "FP16_EMBED": "1", "Z_LOSS": "1e-4", "LOGIT_SOFTCAP": "50.0", "VOCAB_SIZE": "2048", "TOKENIZER_PATH": "./data/tokenizers/fineweb_2048_bpe.model", "DATA_PATH": "./data/datasets/fineweb10B_sp2048_local", "VAL_BATCH_SIZE": "65536", "EVAL_MIX_ALPHA": "0.01", "EVAL_MIX_LOGPROBS": "./data/unigram_sp2048_logprobs.npy"}, "description": "Context mixing alpha=0.01 (1% unigram, 99% transformer)", "hypothesis": "HYP-066-mix001"}, "metrics": {"artifact_size_bytes": 6982417, "wall_time_ms": 340.0, "steps": 1843, "early_stopped": true, "hypothesis": "HYP-066-mix001", "estimated_params": 7341568}, "timestamp": 1774145923.009326, "seed": 42}
{"experiment": "pgolf", "commit": "", "status": "keep", "val_bpb": 1.679, "val_loss": 3.3077, "train_loss": 3.5194, "param_count": 7348239, "total_flops": 0.0, "peak_memory_mb": 0.0, "wall_time_s": 754.2879769802094, "description": "Context mixing alpha=0.05 (5% unigram, 95% transformer)", "config": {"env_overrides": {"UNIQUE_BLOCKS": "3", "NUM_HEADS": "4", "NUM_KV_HEADS": "4", "NUM_LAYERS": "6", "EVAL_STRIDE": "256", "NORMUON": "1", "XSA": "1", "XSA_START_LAYER": "4", "VALUE_RESID": "1", "FP16_EMBED": "1", "Z_LOSS": "1e-4", "LOGIT_SOFTCAP": "50.0", "VOCAB_SIZE": "2048", "TOKENIZER_PATH": "./data/tokenizers/fineweb_2048_bpe.model", "DATA_PATH": "./data/datasets/fineweb10B_sp2048_local", "VAL_BATCH_SIZE": "65536", "EVAL_MIX_ALPHA": "0.05", "EVAL_MIX_LOGPROBS": "./data/unigram_sp2048_logprobs.npy"}, "description": "Context mixing alpha=0.05 (5% unigram, 95% transformer)", "hypothesis": "HYP-066-mix005"}, "metrics": {"artifact_size_bytes": 6972097, "wall_time_ms": 335.0, "steps": 1825, "early_stopped": true, "hypothesis": "HYP-066-mix005", "estimated_params": 7341568}, "timestamp": 1774146687.796012, "seed": 42}
{"experiment": "pgolf", "commit": "", "status": "keep", "val_bpb": 1.6358, "val_loss": 3.2227, "train_loss": 3.4692, "param_count": 7348239, "total_flops": 0.0, "peak_memory_mb": 0.0, "wall_time_s": 755.357922077179, "description": "Context mixing alpha=0.001 (0.1% unigram, 99.9% transformer)", "config": {"env_overrides": {"UNIQUE_BLOCKS": "3", "NUM_HEADS": "4", "NUM_KV_HEADS": "4", "NUM_LAYERS": "6", "EVAL_STRIDE": "256", "NORMUON": "1", "XSA": "1", "XSA_START_LAYER": "4", "VALUE_RESID": "1", "FP16_EMBED": "1", "Z_LOSS": "1e-4", "LOGIT_SOFTCAP": "50.0", "VOCAB_SIZE": "2048", "TOKENIZER_PATH": "./data/tokenizers/fineweb_2048_bpe.model", "DATA_PATH": "./data/datasets/fineweb10B_sp2048_local", "VAL_BATCH_SIZE": "65536", "EVAL_MIX_ALPHA": "0.001", "EVAL_MIX_LOGPROBS": "./data/unigram_sp2048_logprobs.npy"}, "description": "Context mixing alpha=0.001 (0.1% unigram, 99.9% transformer)", "hypothesis": "HYP-066-mix0001"}, "metrics": {"artifact_size_bytes": 6967485, "wall_time_ms": 337.0, "steps": 1827, "early_stopped": true, "hypothesis": "HYP-066-mix0001", "estimated_params": 7341568}, "timestamp": 1774147467.8851478, "seed": 42}
{"experiment": "pgolf", "commit": "", "status": "keep", "val_bpb": 1.6572, "val_loss": 3.2648, "train_loss": 3.5568, "param_count": 7348239, "total_flops": 0.0, "peak_memory_mb": 0.0, "wall_time_s": 753.6404769420624, "description": "Progressive seq: 60% at 512, 40% at 1024 (multigrid)", "config": {"env_overrides": {"UNIQUE_BLOCKS": "3", "NUM_HEADS": "4", "NUM_KV_HEADS": "4", "NUM_LAYERS": "6", "EVAL_STRIDE": "256", "NORMUON": "1", "XSA": "1", "XSA_START_LAYER": "4", "VALUE_RESID": "1", "FP16_EMBED": "1", "Z_LOSS": "1e-4", "LOGIT_SOFTCAP": "50.0", "VOCAB_SIZE": "2048", "TOKENIZER_PATH": "./data/tokenizers/fineweb_2048_bpe.model", "DATA_PATH": "./data/datasets/fineweb10B_sp2048_local", "VAL_BATCH_SIZE": "65536", "PROGRESSIVE_SEQ": "0.6"}, "description": "Progressive seq: 60% at 512, 40% at 1024 (multigrid)", "hypothesis": "HYP-067-prog06"}, "metrics": {"artifact_size_bytes": 7130917, "wall_time_ms": 294.0, "steps": 1993, "early_stopped": true, "hypothesis": "HYP-067-prog06", "estimated_params": 7341568}, "timestamp": 1774148231.976704, "seed": 42}
{"experiment": "pgolf", "commit": "", "status": "keep", "val_bpb": 1.6442, "val_loss": 3.2392, "train_loss": 3.5211, "param_count": 7348239, "total_flops": 0.0, "peak_memory_mb": 0.0, "wall_time_s": 753.3678798675537, "description": "Progressive seq: 40% at 512, 60% at 1024", "config": {"env_overrides": {"UNIQUE_BLOCKS": "3", "NUM_HEADS": "4", "NUM_KV_HEADS": "4", "NUM_LAYERS": "6", "EVAL_STRIDE": "256", "NORMUON": "1", "XSA": "1", "XSA_START_LAYER": "4", "VALUE_RESID": "1", "FP16_EMBED": "1", "Z_LOSS": "1e-4", "LOGIT_SOFTCAP": "50.0", "VOCAB_SIZE": "2048", "TOKENIZER_PATH": "./data/tokenizers/fineweb_2048_bpe.model", "DATA_PATH": "./data/datasets/fineweb10B_sp2048_local", "VAL_BATCH_SIZE": "65536", "PROGRESSIVE_SEQ": "0.4"}, "description": "Progressive seq: 40% at 512, 60% at 1024", "hypothesis": "HYP-067-prog04"}, "metrics": {"artifact_size_bytes": 7093626, "wall_time_ms": 296.0, "steps": 1936, "early_stopped": true, "hypothesis": "HYP-067-prog04", "estimated_params": 7341568}, "timestamp": 1774148995.326899, "seed": 42}
{"experiment": "pgolf", "commit": "", "status": "keep", "val_bpb": 1.7255, "val_loss": 3.3994, "train_loss": 3.6369, "param_count": 7348239, "total_flops": 0.0, "peak_memory_mb": 0.0, "wall_time_s": 754.0738990306854, "description": "Shared Q-K weights (Mahalanobis attention, saves 11% params)", "config": {"env_overrides": {"UNIQUE_BLOCKS": "3", "NUM_HEADS": "4", "NUM_KV_HEADS": "4", "NUM_LAYERS": "6", "EVAL_STRIDE": "256", "NORMUON": "1", "XSA": "1", "XSA_START_LAYER": "4", "VALUE_RESID": "1", "FP16_EMBED": "1", "Z_LOSS": "1e-4", "LOGIT_SOFTCAP": "50.0", "VOCAB_SIZE": "2048", "TOKENIZER_PATH": "./data/tokenizers/fineweb_2048_bpe.model", "DATA_PATH": "./data/datasets/fineweb10B_sp2048_local", "VAL_BATCH_SIZE": "65536", "SHARE_QK": "1"}, "description": "Shared Q-K weights (Mahalanobis attention, saves 11% params)", "hypothesis": "HYP-068-shareqk"}, "metrics": {"artifact_size_bytes": 7007360, "wall_time_ms": 321.0, "steps": 1910, "early_stopped": true, "hypothesis": "HYP-068-shareqk", "estimated_params": 7341568}, "timestamp": 1774149997.48752, "seed": 42}
{"experiment": "pgolf", "commit": "", "status": "keep", "val_bpb": 1.6495, "val_loss": 3.2496, "train_loss": 3.3783, "param_count": 7348239, "total_flops": 0.0, "peak_memory_mb": 0.0, "wall_time_s": 755.048581123352, "description": "Proper train/val split: 20M train tokens, 0 data overlap", "config": {"env_overrides": {"UNIQUE_BLOCKS": "3", "NUM_HEADS": "4", "NUM_KV_HEADS": "4", "NUM_LAYERS": "6", "EVAL_STRIDE": "256", "NORMUON": "1", "XSA": "1", "XSA_START_LAYER": "4", "VALUE_RESID": "1", "FP16_EMBED": "1", "Z_LOSS": "1e-4", "LOGIT_SOFTCAP": "50.0", "VOCAB_SIZE": "2048", "TOKENIZER_PATH": "./data/tokenizers/fineweb_2048_bpe.model", "DATA_PATH": "./data/datasets/fineweb10B_sp2048_local_v2", "VAL_BATCH_SIZE": "65536"}, "description": "Proper train/val split: 20M train tokens, 0 data overlap", "hypothesis": "HYP-069-properdata"}, "metrics": {"artifact_size_bytes": 6973290, "wall_time_ms": 335.0, "steps": 1826, "early_stopped": true, "hypothesis": "HYP-069-properdata", "estimated_params": 7341568}, "timestamp": 1774150901.474475, "seed": 42}
{"experiment": "pgolf", "commit": "", "status": "keep", "val_bpb": 1.7002, "val_loss": 3.3495, "train_loss": 3.432, "param_count": 7348236, "total_flops": 0.0, "peak_memory_mb": 0.0, "wall_time_s": 736.3531451225281, "description": "v2 baseline: sp2048, NO XSA/VR/z-loss/softcap50", "config": {"env_overrides": {"UNIQUE_BLOCKS": "3", "NUM_HEADS": "4", "NUM_KV_HEADS": "4", "NUM_LAYERS": "6", "EVAL_STRIDE": "256", "NORMUON": "1", "VOCAB_SIZE": "2048", "TOKENIZER_PATH": "./data/tokenizers/fineweb_2048_bpe.model", "DATA_PATH": "./data/datasets/fineweb10B_sp2048_local_v2", "VAL_BATCH_SIZE": "65536"}, "description": "v2 baseline: sp2048, NO XSA/VR/z-loss/softcap50", "hypothesis": "HYP-070-v2plain"}, "metrics": {"artifact_size_bytes": 6408132, "wall_time_ms": 311.0, "steps": 1930, "early_stopped": true, "hypothesis": "HYP-070-v2plain", "estimated_params": 7341568}, "timestamp": 1774151824.092454, "seed": 42}
{"experiment": "pgolf", "commit": "", "status": "keep", "val_bpb": 1.653, "val_loss": 3.2565, "train_loss": 3.385, "param_count": 7348239, "total_flops": 0.0, "peak_memory_mb": 0.0, "wall_time_s": 752.2454748153687, "description": "v2 full stack: sp2048 + XSA+VR+z-loss+softcap50", "config": {"env_overrides": {"UNIQUE_BLOCKS": "3", "NUM_HEADS": "4", "NUM_KV_HEADS": "4", "NUM_LAYERS": "6", "EVAL_STRIDE": "256", "NORMUON": "1", "XSA": "1", "XSA_START_LAYER": "4", "VALUE_RESID": "1", "FP16_EMBED": "1", "Z_LOSS": "1e-4", "LOGIT_SOFTCAP": "50.0", "VOCAB_SIZE": "2048", "TOKENIZER_PATH": "./data/tokenizers/fineweb_2048_bpe.model", "DATA_PATH": "./data/datasets/fineweb10B_sp2048_local_v2", "VAL_BATCH_SIZE": "65536"}, "description": "v2 full stack: sp2048 + XSA+VR+z-loss+softcap50", "hypothesis": "HYP-070-v2full"}, "metrics": {"artifact_size_bytes": 6969604, "wall_time_ms": 337.0, "steps": 1835, "early_stopped": true, "hypothesis": "HYP-070-v2full", "estimated_params": 7341568}, "timestamp": 1774152584.0348952, "seed": 42}
{"experiment": "pgolf", "commit": "", "status": "keep", "val_bpb": 1.6992, "val_loss": 3.3475, "train_loss": 3.0846, "param_count": 7355407, "total_flops": 0.0, "peak_memory_mb": 0.0, "wall_time_s": 843.4054048061371, "description": "Affine RMSNorm: learned \u03b3,\u03b2 (preconditioning, ~7K extra params)", "config": {"env_overrides": {"UNIQUE_BLOCKS": "3", "NUM_HEADS": "4", "NUM_KV_HEADS": "4", "NUM_LAYERS": "6", "EVAL_STRIDE": "256", "NORMUON": "1", "XSA": "1", "XSA_START_LAYER": "4", "VALUE_RESID": "1", "FP16_EMBED": "1", "Z_LOSS": "1e-4", "LOGIT_SOFTCAP": "50.0", "VOCAB_SIZE": "2048", "TOKENIZER_PATH": "./data/tokenizers/fineweb_2048_bpe.model", "DATA_PATH": "./data/datasets/fineweb10B_sp2048_local_v2", "VAL_BATCH_SIZE": "65536", "AFFINE_NORM": "1"}, "description": "Affine RMSNorm: learned \u03b3,\u03b2 (preconditioning, ~7K extra params)", "hypothesis": "HYP-071-affine"}, "metrics": {"artifact_size_bytes": 6428548, "wall_time_ms": 492.0, "steps": 1269, "early_stopped": true, "hypothesis": "HYP-071-affine", "estimated_params": 7341568}, "timestamp": 1774153678.697751, "seed": 42}
{"experiment": "pgolf", "commit": "", "status": "keep", "val_bpb": 2.4698, "val_loss": 4.8658, "train_loss": 4.9322, "param_count": 7348239, "total_flops": 0.0, "peak_memory_mb": 0.0, "wall_time_s": 750.6887817382812, "description": "Weight decay 0.005 (\u22480.04 at 64K batch equivalent)", "config": {"env_overrides": {"UNIQUE_BLOCKS": "3", "NUM_HEADS": "4", "NUM_KV_HEADS": "4", "NUM_LAYERS": "6", "EVAL_STRIDE": "256", "NORMUON": "1", "XSA": "1", "XSA_START_LAYER": "4", "VALUE_RESID": "1", "FP16_EMBED": "1", "Z_LOSS": "1e-4", "LOGIT_SOFTCAP": "50.0", "VOCAB_SIZE": "2048", "TOKENIZER_PATH": "./data/tokenizers/fineweb_2048_bpe.model", "DATA_PATH": "./data/datasets/fineweb10B_sp2048_local_v2", "VAL_BATCH_SIZE": "65536", "WEIGHT_DECAY": "0.005"}, "description": "Weight decay 0.005 (\u22480.04 at 64K batch equivalent)", "hypothesis": "HYP-072-wd005"}, "metrics": {"artifact_size_bytes": 1893200, "wall_time_ms": 330.0, "steps": 1854, "early_stopped": true, "hypothesis": "HYP-072-wd005", "estimated_params": 7341568}, "timestamp": 1774154611.25572, "seed": 42}
{"experiment": "pgolf", "commit": "", "status": "keep", "val_bpb": 2.315, "val_loss": 4.5607, "train_loss": 4.6529, "param_count": 7348239, "total_flops": 0.0, "peak_memory_mb": 0.0, "wall_time_s": 751.5386610031128, "description": "Weight decay 0.001 (very mild shrinkage)", "config": {"env_overrides": {"UNIQUE_BLOCKS": "3", "NUM_HEADS": "4", "NUM_KV_HEADS": "4", "NUM_LAYERS": "6", "EVAL_STRIDE": "256", "NORMUON": "1", "XSA": "1", "XSA_START_LAYER": "4", "VALUE_RESID": "1", "FP16_EMBED": "1", "Z_LOSS": "1e-4", "LOGIT_SOFTCAP": "50.0", "VOCAB_SIZE": "2048", "TOKENIZER_PATH": "./data/tokenizers/fineweb_2048_bpe.model", "DATA_PATH": "./data/datasets/fineweb10B_sp2048_local_v2", "VAL_BATCH_SIZE": "65536", "WEIGHT_DECAY": "0.001"}, "description": "Weight decay 0.001 (very mild shrinkage)", "hypothesis": "HYP-072-wd001"}, "metrics": {"artifact_size_bytes": 1965663, "wall_time_ms": 326.0, "steps": 1851, "early_stopped": true, "hypothesis": "HYP-072-wd001", "estimated_params": 7341568}, "timestamp": 1774155372.288404, "seed": 42}
{"experiment": "pgolf", "commit": "", "status": "crash", "val_bpb": Infinity, "val_loss": Infinity, "train_loss": 0.0, "param_count": 7341568, "total_flops": 0.0, "peak_memory_mb": 0.0, "wall_time_s": 6.393454074859619, "description": "Random MLP fc (freeze input proj, learn output only)", "config": {"env_overrides": {"UNIQUE_BLOCKS": "3", "NUM_HEADS": "4", "NUM_KV_HEADS": "4", "NUM_LAYERS": "6", "EVAL_STRIDE": "256", "NORMUON": "1", "XSA": "1", "XSA_START_LAYER": "4", "VALUE_RESID": "1", "FP16_EMBED": "1", "Z_LOSS": "1e-4", "LOGIT_SOFTCAP": "50.0", "VOCAB_SIZE": "2048", "TOKENIZER_PATH": "./data/tokenizers/fineweb_2048_bpe.model", "DATA_PATH": "./data/datasets/fineweb10B_sp2048_local_v2", "VAL_BATCH_SIZE": "65536", "RANDOM_MLP_FC": "1"}, "description": "Random MLP fc (freeze input proj, learn output only)", "hypothesis": "HYP-073-randomfc"}, "metrics": {"artifact_size_bytes": 0, "error": "t.step(model, grads, step=step, lr_mul=lr_mul)\n    ~~~~~~~~^^^^^^^^^^^^^^^^^^^^^^^^^^^^^^^^^^^^^^^^\n  File \"/Users/michaelellis/Projects/parameter-golf/train_gpt_mlx.py\", line 1346, in step\n    updated.update(self.muon.step(params, grads, step=step, lr_mul=lr_mul))\n                   ~~~~~~~~~~~~~~^^^^^^^^^^^^^^^^^^^^^^^^^^^^^^^^^^^^^^^^^\n  File \"/Users/michaelellis/Projects/parameter-golf/train_gpt_mlx.py\", line 1279, in step\n    g = grads[k]\n        ~~~~~^^^\nKeyError: 'blocks.0.mlp.fc.weight'\n", "hypothesis": "HYP-073-randomfc"}, "timestamp": 1774155578.841843, "seed": 42}
